Affiliate URL,Image URL,Name,Description,Category
"https://s.click.aliexpress.com/e/_c2zKjXKl","https://ae-pic-a1.aliexpress-media.com/kf/S7eaab84fcf1f475297b3938c405d6aa0h.jpg_480x480q75.jpg_.avif","Amber Shield High-Visibility Goggles | Tactical Precision & Safety","Professional protection for high-stakes environments. These safety goggles feature high-impact orange lenses that enhance contrast while providing 100% UV protection. The wrap-around design and adjustable fit ensure maximum security and visual clarity for technical or outdoor labor. #SafetyGoggles #TacticalGear #UVProtection #ad","Eyewear"
"https://s.click.aliexpress.com/e/_c3wTPsLx","https://ae-pic-a1.aliexpress-media.com/kf/S93b7583b1f7843d9b404ef1f87bc5b0ay.jpg_480x480q75.jpg_.avif","Amber Square Aviator Shades | High-Contrast Night Vision","Command the road with high-visibility style. These square aviators feature striking yellow lenses designed to enhance contrast and reduce glare in low-light conditions. The bold gold-toned frame adds a touch of retro-cool, making them a functional and stylish statement. #YellowLens #AviatorStyle #NightVisionShades #ad","Eyewear"
"https://s.click.aliexpress.com/e/_c3l7RywD","https://ae-pic-a1.aliexpress-media.com/kf/HTB1Nen6er9YBuNjy0Fgq6AxcXXaW.jpg_220x220q75.jpg_.avif","Anti-Blue Light Presbyopia Glasses | Comfortable Reading Eyewear","Protect your eyes while reading with these Anti-Blu-Ray Presbyopia Lenses. Designed to block harmful blue light from screens while providing crystal clear vision. A stylish and healthy choice for digital life. #BlueLightBlocking #ReadingGlasses #EyeHealth #Presbyopia #ComputerGlasses","Eyewear"
"https://s.click.aliexpress.com/e/_c3gcKH5Z","https://ae-pic-a1.aliexpress-media.com/kf/S1e15c6378ea244ad82149e846b74a557g.jpg_220x220q75.jpg_.avif","Aura Sport Polarized Trio | High-Performance Mirrored Optics","Engineered for the high-velocity lifestyle. This trio of square-frame sport sunglasses features advanced polarized lenses with a vibrant mirrored finish. Designed for maximum glare reduction and impact resistance, they offer a sharp, athletic aesthetic that performs under the toughest outdoor conditions. #SportEyewear #PolarizedLenses #HighPerformance #ad","Eyewear"
"https://s.click.aliexpress.com/e/_c4T7DnCb","https://raw.githubusercontent.com/avivaknin/PinterestImages/main/pinterest2/%D7%90%D7%91%D7%99%D7%96%D7%A8%D7%99%D7%9D/Eyewear/2/H138547b886314a528e15bc3a258b561a3.png","Avant-Garde Luxury Geometric Eyewear | Unique Architectural Design with Premium Craftsmanship","Step outside the ordinary with these avant-garde geometric sunglasses, showcasing a unique architectural design that serves as a true fashion statement. The bold lines and modern silhouette reflect a passion for innovation and high-end creative expression in the world of designer accessories. Crafted from superior materials, these glasses provide a luxurious feel and lasting durability for the trendsetting individual who loves to stand out. Elevate your personal style with this exquisite piece that perfectly balances artistic flair with modern luxury aesthetics. #AvantGarde #DesignerShades #ad","Eyewear"
"https://s.click.aliexpress.com/e/_c3SLIaJb","https://ae-pic-a1.aliexpress-media.com/kf/S78d21f786f7b4babb1414baaf4fc06e1X.jpg_220x220q75.jpg_.avif","Azure Rectangular Executive Frames | Sharp Contemporary Polish","Define your professional aesthetic with sharp, contemporary lines. These azure blue rectangular frames feature a sleek profile and a high-shine finish. The modern silhouette and vibrant yet professional tone make them the perfect accessory for the corporate leader. #RectangularFrames #ExecutiveStyle #ModernOptics #ad","Eyewear"
"https://s.click.aliexpress.com/e/_c3j0zGhJ","https://ae-pic-a1.aliexpress-media.com/kf/Scd6c54dfa30945f9ab8c7501045fdbb9P.jpg_220x220q75.jpg_.avif","Beta-Titanium Ultralight Readers | Minimalist Precision","Experience the weightless strength of Beta-Titanium. These reading glasses offer a flexible, ultra-slim profile that provides maximum comfort for extended wear. The minimalist design and high-end metallic finish deliver a look of quiet luxury and professional precision. #TitaniumEyewear #MinimalistStyle #PrecisionOptics #ad","Eyewear"
"https://s.click.aliexpress.com/e/_c3mp4n4R","https://ae-pic-a1.aliexpress-media.com/kf/Sa334d83b041a46bea23704f04ca35323b.jpg_480x480q75.jpg_.avif","CCSPACE Vintage Round Frames | Retro Artisanal Craft","A poetic tribute to mid-century design. These CCSPACE frames are crafted from premium vintage-style acetate, featuring a classic round silhouette and reinforced hinges. The artisanal finish and timeless shape offer a sophisticated look for the modern creative. #VintageEyewear #RoundFrames #ArtisanalStyle #ad","Eyewear"
"https://s.click.aliexpress.com/e/_c3i9UGM5","https://ae-pic-a1.aliexpress-media.com/kf/Sfb9a65a6bc3c4187a8cd88f62dd4ee6aB.jpg_480x480q75.jpg_.avif","Cinematic Dual DLP 3D Optics | Immersive Home Theater Luxe","Elevate your home cinema experience to professional standards. These Dual DLP 3D glasses offer high-speed shutter technology for flicker-free, immersive viewing. The ergonomic, lightweight design ensures comfort throughout the longest cinematic masterpieces. #3DGlasses #HomeCinema #ImmersiveTech #ad","Eyewear"
"https://s.click.aliexpress.com/e/_c4T7DnCb","https://raw.githubusercontent.com/avivaknin/PinterestImages/main/pinterest2/%D7%90%D7%91%D7%99%D7%96%D7%A8%D7%99%D7%9D/Eyewear/%D7%94%D7%95%D7%A8%D7%93%D7%94%20%284%29.png","Cook Shark Men's TAC Polarized Sunglasses: Ideal for Driving, Fishing & Outdoor Sports","Eyewear Elevate your outdoor experience with Cook Shark Men's TAC Polarized Sunglasses. Designed for optimal clarity and glare reduction, these stylish and durable shades are perfect for driving, fishing, cycling, and other adventures. Enjoy superior UV protection and comfortable wear. #CookShark #PolarizedSunglasses #MensEyewear #OutdoorAdventure #DrivingGlasses #UVProtection #affiliatelink","Eyewear"
"https://s.click.aliexpress.com/e/_c2uEXtm9","https://ae-pic-a1.aliexpress-media.com/kf/A4df4426e47244f9e89ef74f0ddf0f61fk.jpg_480x480q75.jpg_.avif","Crystal Clear Digital Armor | Avant-Garde Screen Protection","Modern protection with a transparent edge. These thick-frame glasses feature a crystal-clear acetate build and high-performance blue-light blocking lenses. The bold, chunky silhouette offers an avant-garde look while safeguarding your eyes from digital fatigue. #ClearFrames #BlueLightGlasses #ModernTech #ad","Eyewear"
"https://s.click.aliexpress.com/e/_c4nk9rmV","https://ae-pic-a1.aliexpress-media.com/kf/S92a5a244fc84415fa17ec4b5bdd10cb6C.jpg_220x220q75.jpg_.avif","Digital Shield Progressive Readers | High-Tech Optical Clarity","Protect your vision in the digital age. These progressive readers feature advanced blue-light blocking technology integrated into a seamless multi-focal lens. The sleek, professional frame ensures you stay focused and comfortable during long hours of screen time. #BlueLightBlocking #ProgressiveReaders #DigitalWellness #ad","Eyewear"
"https://s.click.aliexpress.com/e/_c3OZWbaL","https://raw.githubusercontent.com/avivaknin/PinterestImages/main/pinterst1/%D7%90%D7%91%D7%99%D7%96%D7%A8%D7%99%D7%9D/Eyewear/5/%D7%94%D7%95%D7%A8%D7%93%D7%94%20%2811%29.png","Effortlessly Chic: Elegant Satin Camisole Paired with Classic Black Skirt for Modern Style","Eyewear Elevate your everyday style with this stunning combination of a luxurious cream satin camisole and a versatile black skirt. Perfect for a polished office look, a sophisticated evening out, or a chic casual ensemble. This outfit embodies modern elegance and timeless appeal, a true wardrobe essential. #SatinStyle #CamisoleTop #BlackSkirt #MinimalistFashion #OfficeWear #ChicOutfit #affiliatelink","Eyewear"
"https://s.click.aliexpress.com/e/_c39qWR7X","https://ae-pic-a1.aliexpress-media.com/kf/Sf3339714f9f944fa99c6b383e3a8a495b.jpg_480x480q75.jpg_.avif","Elegant Round Gold Eyeglasses | Classic Minimalist Frames","Achieve a timeless, sophisticated look with these Elegant Round Gold Eyeglasses. The lightweight gold frames offer a minimalist aesthetic that complements any face shape and outfit. #GoldFrames #RoundEyeglasses #MinimalistStyle #ClassicEyewear #ChicFrames","Eyewear"
"https://s.click.aliexpress.com/e/_c4PTE3rd","https://raw.githubusercontent.com/avivaknin/PinterestImages/main/pinterst1/%D7%90%D7%91%D7%99%D7%96%D7%A8%D7%99%D7%9D/Eyewear/3/%D7%94%D7%95%D7%A8%D7%93%D7%94%20%289%29.png","Elite Aviator Classic Performance Shades | Timeless Professional Design with High-End Metallic Finish","Command attention with these elite aviator shades, featuring a timeless professional design and a premium metallic finish for a bold look. The high-performance lenses ensure crystal-clear vision and superior protection, making them ideal for both adventurous travel and daily urban wear. Crafted with precision, the thin and durable frame offers a sophisticated edge that complements any face shape and clothing style. These sunglasses are a must-have staple for a refined wardrobe, radiating confidence and a love for high-quality fashion. #AviatorStyle #EliteFashion #ad","Eyewear"
"https://s.click.aliexpress.com/e/_c3IO41Mp","https://ae-pic-a1.aliexpress-media.com/kf/S56b1d72d8b43408f9898da9669a58c7cd.jpg_480x480q75.jpg_.avif","Heritage Small Round Frames | Vintage Intellectual Charm","A classic tribute to the golden age of eyewear. These small round frames offer a refined retro silhouette that radiates intellectual charm. The lightweight construction and timeless design make them a sophisticated choice for readers or daily prescription wear. #RetroEyewear #RoundFrames #VintageChic #ad","Eyewear"
"https://s.click.aliexpress.com/e/_c43pGadn","https://ae-pic-a1.aliexpress-media.com/kf/Hd0ee4bfaf98543a0ba23ac539e8288b96.jpg_480x480q75.jpg_.avif","LED Magnifier Shield | Surgical-Grade Visual Power","Featuring an architectural multi-lens system and integrated LED illumination for absolute visual clarity. This piece provides a statuesque and presence-filled aesthetic for the modern technical specialist. #PrecisionVision #TechnicalEyewear #ad","Eyewear"
"https://s.click.aliexpress.com/e/_c39BmyQn","https://raw.githubusercontent.com/avivaknin/PinterestImages/main/pinterst1/%D7%90%D7%91%D7%99%D7%96%D7%A8%D7%99%D7%9D/Eyewear/3/%D7%94%D7%95%D7%A8%D7%93%D7%94%20%2812%29.png","Luxury Designer Statement Sunglasses | Premium Polarized Lenses with Iconic Gold Detail","Elevate your eyewear collection with these stunning luxury designer sunglasses, featuring high-quality polarized lenses and an iconic gold-tone finish. The sleek frame and meticulous craftsmanship offer a sophisticated aesthetic that transitions perfectly from sunny beach days to high-end city outings. These sunglasses provide maximum UV protection while ensuring you maintain a polished, fashion-forward presence throughout the day. It is the ultimate accessory for those who value superior quality and timeless, elite designer style. #LuxuryEyewear #StyleIcon #ad","Eyewear"
"https://s.click.aliexpress.com/e/_c4qSH9BR","https://ae-pic-a1.aliexpress-media.com/kf/S65d0cfdc11344afbb11ab8675ca2e8edi.jpg_480x480q75.jpg_.avif","Midnight Aviator Classic Trio | Timeless Pilot Heritage","The definitive silhouette of authority. This collection features three variations of the classic black-frame aviator, offering a lightweight fit and superior lens clarity. A versatile essential that transitions seamlessly from executive travel to relaxed weekend escapes with timeless heritage grace. #AviatorStyle #ClassicShades #EssentialEyewear #ad","Eyewear"
"https://s.click.aliexpress.com/e/_c4T7DnCb","https://raw.githubusercontent.com/avivaknin/PinterestImages/main/pinterst1/%D7%90%D7%91%D7%99%D7%96%D7%A8%D7%99%D7%9D/Eyewear/3/%D7%94%D7%95%D7%A8%D7%93%D7%94%20%288%29.png","Modern Chic Retro-Inspired Eyewear | Elegant Lightweight Frames with Sophisticated Urban Appeal","Discover the perfect blend of classic retro charm and modern urban sophistication with these elegantly crafted, lightweight eyewear frames. Designed for ultimate comfort and durability, the sleek silhouette provides a flattering fit that enhances any contemporary or casual ensemble. These glasses offer a refined look that captures the essence of ""cool kid"" energy while maintaining a high-end, professional feel. A versatile and essential accessory for anyone looking to add a touch of effortless style to their daily wardrobe. #RetroChic #ModernEyewear #ad","Eyewear"
"https://s.click.aliexpress.com/e/_c4N3erLr","https://ae-pic-a1.aliexpress-media.com/kf/S5af6b031664b4a11aea648f53265f0e0b.jpg_480x480q75.jpg_.avif","Onyx Multi-Focal Progressive Readers | Seamless Visual Transition","Clarity at every distance. These black-frame reading glasses feature advanced progressive lenses that offer a seamless transition from near to far vision. The professional matte finish and ergonomic build provide a sophisticated solution for the modern multi-tasker. #ProgressiveLenses #ReadingGlasses #ExecutivePrecision #ad","Eyewear"
"https://s.click.aliexpress.com/e/_c4ETeidP","https://ae-pic-a1.aliexpress-media.com/kf/S4be5691a5226435daa434766ac791996w.jpg_480x480q75.jpg_.avif","Onyx Stealth Red-Lens Shades | Bold Cinematic Contrast","Make a high-contrast statement. Featuring a lightweight matte black frame paired with striking crimson lenses, these sunglasses offer a cinematic, futuristic look. The UV400 protection ensures visual safety while the bold color palette commands attention on the city streets. #RedLensShades #StealthStyle #UrbanEyewear #ad","Eyewear"
"https://s.click.aliexpress.com/e/_c4kAMVLR","https://ae-pic-a1.aliexpress-media.com/kf/S522a51a6984b4abcb4e6f2e6a40269df4.png_480x480.png_.avif","Oveliness Titanium Square Frames | Ultra-Light Precision","Engineered for ultimate durability and weightless comfort. These Oveliness frames are crafted from high-grade thin titanium, offering a sleek square silhouette that complements any professional look. The minimalist design ensures all-day comfort for prescription lens wearers. #TitaniumEyewear #Oveliness #ProfessionalStyle #ad","Eyewear"
"https://s.click.aliexpress.com/e/_c3EDt5Qz","https://ae-pic-a1.aliexpress-media.com/kf/Scfeac3ca858143f09db6bdb2cd417e41b.jpg_220x220q75.jpg_.avif","Oversized Clear Digital Armor | Bold Modern Clarity","Make a contemporary statement while protecting your vision. These oversized square frames feature a trendy transparent finish and high-performance blue-light blocking technology. Perfect for the digital professional who wants a fashion-forward look with technical benefits. #ClearFrames #BlueLightBlocking #ModernEyewear #ad","Eyewear"
"https://s.click.aliexpress.com/e/_c45NHgud","https://ae-pic-a1.aliexpress-media.com/kf/See50132ebfd04373bc042ab31961cc4dW.jpg_220x220q75.jpg_.avif","Oversized Custom Prescription Frames | Bold Optical Statement","Embrace the oversized aesthetic with zero compromise on clarity. These custom-ready prescription glasses feature an extra-large frame design that makes a powerful fashion statement. Perfect for those who prefer a wide field of vision and a bold, statuesque look. #OversizedFrames #CustomEyewear #BoldStyle #ad","Eyewear"
"https://s.click.aliexpress.com/e/_c4tANA0l","https://ae-pic-a1.aliexpress-media.com/kf/H0e0688ae6aa74743b39f99b23371a23bs.jpg_220x220q75.jpg_.avif","Photochromic Blue Light Eyewear | Versatile Indoor & Outdoor Glasses","These Versatile Photochromic Glasses adapt to your environment, darkening in sunlight and staying clear indoors. Combined with blue light protection, they are the perfect all-in-one solution for your vision. #PhotochromicLenses #Transitions #BlueLightProtection #VersatileEyewear #SmartGlasses","Eyewear"
"https://s.click.aliexpress.com/e/_c2w4Xp6V","https://ae-pic-a1.aliexpress-media.com/kf/S799a541181d04019a24fe21de97e2cbdX.jpg_480x480q75.jpg_.avif","Photochromic Smart Audio Shades | Next-Gen Intelligent Gear","The ultimate 3-in-1 tech accessory. These glasses feature photochromic lenses that change color based on light intensity, integrated Bluetooth audio for music/calls, and a stylish modern frame. Perfect for those who demand intelligence and versatility in their eyewear. #AudioGlasses #SmartEyewear #TechStyle #ad","Eyewear"
"https://s.click.aliexpress.com/e/_c3r5Vf2z","https://ae-pic-a1.aliexpress-media.com/kf/S0423ebe095bb43e393a6d23ab915f3e0F.jpg_480x480q75.jpg_.avif","Premium TR90 Thick-Frame Readers | Flexible Digital Armor","Built for comfort and protection. Crafted from ultra-flexible and durable TR90 material, these thickened reading glasses offer a lightweight, unbreakable feel. The advanced anti-blue-light coating makes them the perfect companion for the modern, screen-focused professional. #TR90Frames #DurableReaders #DigitalEyeCare #ad","Eyewear"
"https://s.click.aliexpress.com/e/_c4P2wIat","https://ae-pic-a1.aliexpress-media.com/kf/S32d60c50ed6e4876bf32e0fcd7cc43b1N.jpg_220x220q75.jpg_.avif","Programmable LED Tech Shades | Avant-Garde Digital Style","Step into the future of festival and party wear. These programmable LED glasses allow you to customize animations and text via an app, creating a high-impact digital statement. The ultimate accessory for those who live at the intersection of technology and fashion. #LEDGlasses #CyberpunkStyle #PartyTech #ad","Eyewear"
"https://s.click.aliexpress.com/e/_c4STyTdF","https://ae-pic-a1.aliexpress-media.com/kf/S0e40d01510504d179701e13024ed20fft.jpg_480x480q75.jpg_.avif","Pure Titanium Vintage Eyeglasses | Premium Lightweight Frames","Experience ultimate durability and comfort with these Pure Titanium Vintage Eyeglasses. Featuring high-quality vacuum plating and a retro-inspired design, these frames are built to last and style. #TitaniumEyewear #VintageGlasses #PremiumFrames #RetroStyle #LightweightEyewear","Eyewear"
"https://s.click.aliexpress.com/e/_c40sWf8Z","https://ae-pic-a1.aliexpress-media.com/kf/S4cc2602b4fcb43299e492d32a10a9f54v.jpg_220x220q75.jpg_.avif","Rayneo Air Precision Lenses | Next-Gen Smart View","Designed specifically for the Rayneo Air ecosystem. These high-definition prescription lenses offer crystal-clear visual correction while maintaining the sleek, lightweight profile of your smart eyewear. Experience the perfect fusion of optical precision and augmented reality. #RayneoAir #SmartGlasses #OpticalTech #ad","Eyewear"
"https://s.click.aliexpress.com/e/_c4PNgl5T","https://ae-pic-a1.aliexpress-media.com/kf/HTB1aGfupcuYBuNkSmRyq6AA3pXaO.jpg_480x480q75.jpg_.avif","Rimless Bifocal Digital Shield | Seamless Vision & Protection","Clarity without boundaries. These rimless reading glasses feature bifocal lenses and anti-blue-light coating, providing a seamless transition between viewing distances while protecting your eyes from screen fatigue. The invisible-feel design offers a polished, minimalist aesthetic. #RimlessGlasses #BifocalReaders #DigitalWellness #ad","Eyewear"
"https://s.click.aliexpress.com/e/_c3gAK33X","https://ae-pic-a1.aliexpress-media.com/kf/S2d35eb17aca14dc39a486e2e1a4216604.jpg_480x480q75.jpg_.avif","Sapphire Acetate & Tortoise Frames | Bold Intellectual Style","A masterful blend of texture and tone. These chunky eyeglasses feature a deep sapphire blue acetate front paired with classic tortoise-shell arms. The architectural frame design and premium materials provide a look of intellectual sophistication and artistic flair. #AcetateFrames #ChunkyEyeglasses #IntellectualStyle #ad","Eyewear"
"https://s.click.aliexpress.com/e/_c2QKtJzT","https://ae-pic-a1.aliexpress-media.com/kf/S33cd2148864c4771bc6febc8cd3b66a9H.jpg_480x480q75.jpg_.avif","Sapphire Blue Sequin | Radiant Evening Bag","Step into the spotlight with this dazzling sapphire blue sequin bag designed for prestigious wedding gala celebrations. The radiant finish catches the light beautifully ensuring you stand out at every high end social gathering. Designed for both beauty and functionality providing a secure space for your essentials during any formal social ceremony. This luxury purse represents the ultimate in modern evening fashion for your most prestigious and special night. #blueclutch #sequinbag #weddingpurse #luxuryfashion #glamour #formalstyle #fashion #elegant","Eyewear"
"https://s.click.aliexpress.com/e/_c4M2GDt7","https://ae-pic-a1.aliexpress-media.com/kf/S79102400f8674653b05d53e812032d01C.jpg_480x480q75.jpg_.avif","Screwless 9704 Round Tortoise | Architectural Precision","Innovation meets classic style. These 9704 series eyeglasses feature a unique screwless hinge design for maximum durability and a clean look. The combination of round tortoise rims and sleek metal arms offers a sophisticated, modern-vintage aesthetic. #ScrewlessEyewear #TortoiseFrames #ArchitecturalDesign #ad","Eyewear"
"https://s.click.aliexpress.com/e/_c3ddssb3","https://ae-pic-a1.aliexpress-media.com/kf/Sd0286b197e524331a4d6eb179b30ee7az.jpg_220x220q75.jpg_.avif","Signature Tortoise Round Frames | Timeless Continental Style","Embrace the rich patterns of a classic heritage look. These round frames feature a premium tortoise-shell finish with warm amber and mahogany tones. The sophisticated shape and traditional aesthetic provide a look of timeless continental elegance and scholarly charm. #TortoiseFrames #RoundEyeglasses #ClassicCouture #ad","Eyewear"
"https://s.click.aliexpress.com/e/_c4T7DnCb","https://raw.githubusercontent.com/avivaknin/PinterestImages/main/pinterest2/%D7%90%D7%91%D7%99%D7%96%D7%A8%D7%99%D7%9D/Eyewear/7/H47937c6e7e5849038c6807f10a17d5f7z.png","Sleek Minimalist Urban Tech Sunglasses | High-Performance Aerodynamic Frames with Modern Finish","These sleek urban tech sunglasses offer a minimalist aesthetic combined with high-performance features for an active and stylish lifestyle. The aerodynamic frames and modern matte finish deliver a polished, sporty look that fits seamlessly into any contemporary professional or casual setting. Engineered for a secure and comfortable fit, they provide all-day wearability without sacrificing a touch of high-end luxury and trend-setting style. A versatile essential for those who appreciate a clean design and superior functionality in their seasonal accessory collection. #MinimalistStyle #UrbanTech #ad","Eyewear"
"https://s.click.aliexpress.com/e/_c41KJ8PD","https://ae-pic-a1.aliexpress-media.com/kf/S312202e3e3b24f37a53fd939a29351afr.jpg_480x480q75.jpg_.avif","Smart Audio Sunglasses | The Kinetic Sonic Shield","A masterclass in hybrid technology, merging high-fidelity audio with a statuesque eyewear silhouette. These sunglasses radiate an aura of mission-ready urban authority and uncompromised boutique-level innovation. #SmartEyewear #TechLuxe #ad","Eyewear"
"https://s.click.aliexpress.com/e/_c4T7DnCb","https://raw.githubusercontent.com/avivaknin/PinterestImages/main/pinterest2/%D7%90%D7%91%D7%99%D7%96%D7%A8%D7%99%D7%9D/Eyewear/3/Hb38f9eec58bd4ba7a50a993b6bc6aee4f.png","Sophisticated Hollywood Glamour Shades | Bold Oversized Frames with Elegant Designer Detailing","Bring back the golden age of cinema with these sophisticated oversized shades, offering a touch of Hollywood glamour to your everyday look. The bold frames and elegant designer detailing create a striking visual presence that radiates charm and high-fashion luxury for any occasion. Designed with premium lenses, they provide excellent coverage and protection while maintaining a mysterious and chic aesthetic that never goes out of style. Add a layer of timeless elegance to your accessory rotation with these beautifully crafted and undeniably stunning fashion-forward sunglasses. #HollywoodGlam #LuxuryLiving #ad","Eyewear"
"https://s.click.aliexpress.com/e/_c4N3g4J7","https://ae-pic-a1.aliexpress-media.com/kf/Se601ce446dd945bfb86083ad9ece4cc4N.jpg_480x480q75.jpg_.avif","The 'Academic' Round Wire Frames | Minimalist Golden-Age Grace","A timeless essential for the discerning minimalist. These round wire-frame glasses offer a delicate, lightweight silhouette that echoes the golden age of academic style. The fine metallic finish and classic shape provide an air of sophisticated, understated grace. #WireFrames #RoundEyeglasses #AcademicChic #ad","Eyewear"
"https://s.click.aliexpress.com/e/_c40aRBXl","https://ae-pic-a1.aliexpress-media.com/kf/S5451fe6eb7e04f129eaf3c10f3043238w.jpg_480x480q75.jpg_.avif","The 'Silk-Touch' Casual Evening Dress | Effortless Daily Grace","(Note: Item appears to be a dress misplaced in eyewear). A masterclass in relaxed refinement. This casual evening dress features a soft, silk-touch fabric and a fluid silhouette that celebrates the feminine form. The minimalist design and elegant drape make it a versatile essential for sunset cocktails or upscale daily wear. #CasualElegance #SilkTouch #EffortlessGrace #ad","Eyewear"
"https://s.click.aliexpress.com/e/_c34yc78Z","https://ae-pic-a1.aliexpress-media.com/kf/S254d2e7b8e894dfb9b3a671e22ed2f36c.jpg_480x480q75.jpg_.avif","Titanium Rimless 'Infinity' Frames | Seamless Executive Clarity","The ultimate in unobstructed vision. These rimless glasses utilize high-grade titanium bridges and arms to create a weightless, invisible-feel experience. The sleek, high-tech design offers a polished and powerful look for the modern professional who values clarity above all. #RimlessEyewear #TitaniumDesign #QuietLuxury #ad","Eyewear"
"https://s.click.aliexpress.com/e/_c35AbUQ1","https://ae-pic-a1.aliexpress-media.com/kf/S69e6f20781774753ba94253770a154d0Z.jpg_480x480q75.jpg_.avif","Titanium Round Shield | The Lightweight Geometric Anchor","Engineered from high-density titanium to provide a statuesque facial frame with zero-gravity comfort. These round eyeglasses radiate a look of professional-grade intellectual authority and unyielding modernistic polish. #TitaniumFrames #OpticalArchitecture #ad","Eyewear"
