Affiliate URL,Image URL,Name,Description,Category
"https://s.click.aliexpress.com/e/_c4sRiMqv","https://ae-pic-a1.aliexpress-media.com/kf/S0c4b2e08cb194ee1b5ed096868d2d270b.jpg_480x480q75.jpg_.avif","Tortoise Architectural Frame | The Earth-Tone Foundation","Utilizing a high-contrast tortoise motif to define the facial geometry with statuesque precision. These frames radiate an aura of heritage-grade luxury and unstudied boutique energy. #TortoiseShell #BoutiqueEyewear #ad","Eyewear"
"https://s.click.aliexpress.com/e/_c3nQDqHJ","https://ae-pic-a1.aliexpress-media.com/kf/S4d645b4485354861982a029ee2cdd1a9g.jpg_480x480q75.jpg_.avif","Vintage Rimless Rectangle Shades | Retro Minimalist Gold","Channel 90s high-fashion with these minimalist rimless sunglasses. Featuring small rectangular lenses and elegant gold-toned arms, they offer a sharp, vintage-inspired look. The lightweight construction and tinted lenses provide a look of effortless cool and urban luxury. #VintageSunglasses #RimlessStyle #90sFashion #ad","Eyewear"
"https://s.click.aliexpress.com/e/_c3Eb38ud","https://ae-pic-a1.aliexpress-media.com/kf/Sdb838c18eb4a4dff9c71b62eb850bac4w.jpg_220x220q75.jpg_.avif","Viper Shield Cycling Goggles | Aerodynamic Sport Vision","Dominate the track with high-definition coverage. These oversized Viper Shield goggles feature a wrap-around multicolor lens for maximum peripheral vision and wind protection. The aerodynamic design and anti-fog technology make them a must-have for elite cyclists and outdoor athletes. #CyclingGoggles #SportVision #ViperShield #ad","Eyewear"
"https://s.click.aliexpress.com/e/_c3ahoQBT","https://ae-pic-a1.aliexpress-media.com/kf/H6851b0c47a654f8ab9cf275ec4535ce5d.jpg_480x480q75.jpg_.avif","Women's Blue Prescription Glasses | Trendy Colorful Frames","Add a pop of color to your daily look with these Women's Blue Prescription Glasses. These stylish frames offer a modern, vibrant twist on traditional eyewear, perfect for making a subtle fashion statement. #BlueGlasses #PrescriptionEyewear #WomensFashion #ColorfulFrames #StylishGlasses","Eyewear"
"https://s.click.aliexpress.com/e/_c3rIkRur","https://ae-pic-a1.aliexpress-media.com/kf/S69b0b55b886448d5b0651e9f80daf5635.jpg_480x480q75.jpg_.avif","Xiaomi Signature Smart Audio Shades | Seamless Tech Integration","Experience the pinnacle of wearable audio technology by Xiaomi. These smart sunglasses combine high-fidelity directional speakers with a sleek, fashion-forward frame. Enjoy your favorite media and take calls hands-free while maintaining a polished and modern aesthetic. #XiaomiSmart #AudioSunglasses #WearableTech #ad","Eyewear"