Affiliate URL,Image URL,Name,Description,Category
"https://s.click.aliexpress.com/e/_c30JJn8j","https://raw.githubusercontent.com/avivaknin/PinterestImages/main/pinterst1/Pants/3/pose_3_4_view_bg-library.png","Achieve Effortless Chic: Light Blue Cardigan, Crop Top & White Wide-Leg Pants","Pants Embrace a fresh and stylish look with this comfortable outfit featuring a light blue knit cardigan, a cream crop top, and elegant white pleated wide-leg pants. This ensemble effortlessly creates an illusion of tall, long legs, perfect for a chic and relaxed everyday aesthetic. Ideal for spring and summer, this outfit offers both comfort and modern flair. #WideLegPants #CardiganStyle #SpringFashion #CasualChic #LongLegsFashion #EverydayStyle #affiliatelink
","Pants"
"https://s.click.aliexpress.com/e/_c3jL1kdB","https://ae-pic-a1.aliexpress-media.com/kf/Sb27e71a980cf42f0987c7fa043e57572U.jpg_480x480q75.jpg_.avif","Alpine Suspender Snowboard Pants | Technical Winter Authority","Command the mountain with professional grace. These high-performance snowboard pants feature integrated suspenders for a secure, ergonomic fit. Engineered with water-resistant fabric and high-loft insulation, they offer a powerful and practical silhouette that stands up to the most demanding winter conditions. #SnowboardStyle #AlpineChic #WinterTechnical #ad","Pants"
"https://s.click.aliexpress.com/e/_c3VU9ZFv","https://ae-pic-a1.aliexpress-media.com/kf/S5509d94219be4717949557489796f3cal.jpg_480x480q75.jpg_.avif","Artisanal Patterned Harem Pants | Bohemian Global Elegance","Experience the luxury of total freedom. These harem pants feature an intricate artisanal pattern and a signature relaxed, dropped-crotch silhouette. The lightweight, flowing fabric and bold print evoke a sense of worldly travel and bohemian elegance, making them a standout piece for the creative soul. #HaremPants #BohoStyle #GlobalFashion #ad","Pants"
"https://s.click.aliexpress.com/e/_c32W01LB","https://ae-pic-a1.aliexpress-media.com/kf/A99532a62f6944b93b876f090484c8b09r.jpg_480x480q75.jpg_.avif","Baggy Striped Track Pants | Retro Streetwear Aesthetic","Nail the Athleisure trend with these Baggy Striped Track Pants. Featuring a relaxed fit and sporty side stripes, they are perfect for a cool, effortless street-style look. #TrackPants #Streetwear #BaggyPants #SportyChic #RetroFashion","Pants"
"https://s.click.aliexpress.com/e/_c3OUazMj","https://ae-pic-a1.aliexpress-media.com/kf/Sf431a08aef9c4a9e91abfc7422f2dad1c.jpg_220x220q75.jpg_.avif","Blush Rose Zen Yoga Leggings | Breathable Feminine Flow","Find your inner peace in soft rose tones. These yoga-ready leggings are crafted from an ultra-breathable, moisture-wicking blend that feels like a second skin. The wide, stay-put waistband and seamless construction offer a flexible, feminine fit that moves gracefully through every sun salutation. #YogaWear #BlushPink #ZenStyle #ad","Pants"
"https://s.click.aliexpress.com/e/_c3KugAM5","https://ae-pic-a1.aliexpress-media.com/kf/Sf99e1b46c7694f2c8f39aade97392c4bp.jpg_480x480q75.jpg_.avif","Celestial Blue Ombre Baggy Jeans | Artistic Gradient Denim","A masterclass in textile artistry. These baggy jeans feature a stunning ombre fade, transitioning from a deep midnight to a soft sky blue. The voluminous, relaxed fit offers a contemporary street-style edge, while the unique gradient effect ensures you stand out with creative, high-fashion flair. #OmbreJeans #GradientDenim #ArtisticStyle #ad","Pants"
"https://s.click.aliexpress.com/e/_c3ya6bA5","https://ae-pic-a1.aliexpress-media.com/kf/Sf48b6fc7e502418c8c0e1ac1316e1cfdM.jpg_480x480q75.jpg_.avif","Champagne Satin Wide-Leg Trousers | Lustrous Evening Flow","Experience the feeling of liquid gold. Crafted from premium high-shine satin, these wide-leg pants offer a fluid, ethereal drape that moves beautifully with every step. The warm champagne hue and luxurious sheen make them a breathtaking choice for gala events or sophisticated soirées where elegance is paramount. #SatinPants #EveningGlamour #WideLegLuxury #ad","Pants"
"https://s.click.aliexpress.com/e/_c3z6CBvH","https://ae-pic-a1.aliexpress-media.com/kf/Sb7cda366865142f8848b43b4159bc014D.jpg_480x480q75.jpg_.avif","Crimson 'Booty-Lift' Performance Leggings | Bold Sculpted Allure","Turn heads in the gym with these high-impact red leggings. Designed with strategic seam placement to enhance and lift your natural shape, they provide a powerful, sculpted look. The compression fabric aids muscle recovery while the bold crimson hue radiates energy and unstoppable confidence. #RedLeggings #SculptedStyle #FitnessGlamour #ad","Pants"
"https://s.click.aliexpress.com/e/_c31OO0nh","https://raw.githubusercontent.com/avivaknin/PinterestImages/main/pinterst1/Pants/2/pose_3_4_view_bg-spaceship-deck.png","Crystal Ankle Sandals | Elite Social Wear","Radiate confidence with these enchanting crystal ankle sandals featuring a unique silhouette and modern finish for prestigious social celebrations tonight in the city. The sophisticated design and slim heel add a touch of royal drama and authority to your formal evening look in the grand ballroom. High quality tailoring provides a polished and professional look that enhances your natural beauty for every prestigious social event tonight in style. Enjoy a luxurious feel and a mesmerizing shimmer. #crystalsandals #socialsandals #eveningwear #weddingguest #luxuryfashion #glamour #style #elegant #ad","Pants"
"https://s.click.aliexpress.com/e/_c32VGTyh","https://ae-pic-a1.aliexpress-media.com/kf/See524dd35db34164a76039478fc69c294.jpg_480x480q75.jpg_.avif","Electric Blue High-Waist Leggings | Radiant Second-Skin Fit","Brighten your fitness routine with these electric blue leggings. Featuring a wide, stay-put waistband and a seamless design, they offer a flawless, high-rise fit that moves beautifully with your body. The high-opacity, four-way stretch fabric provides total coverage and a radiant, sporty look for any activity. #HighWaistLeggings #BlueAesthetic #SportyChic #ad","Pants"
"https://s.click.aliexpress.com/e/_c2Qxb9Qj","https://ae-pic-a1.aliexpress-media.com/kf/S9064b337e9154fd1ae1b0e279ef696e7Y.jpg_220x220q75.jpg_.avif","Graphite Wide-Leg Drawstring Pants | Casual Couture Comfort","Where comfort meets high-end design. These wide-leg pants feature a practical drawstring waist paired with a sophisticated, voluminous cut. The graphite-grey fabric offers a subtle sheen and a premium feel, delivering a casual-couture aesthetic that is perfect for those who refuse to compromise on style during their downtime. #DrawstringPants #WideLegChic #CoutureComfort #ad","Pants"
"https://s.click.aliexpress.com/e/_c3JkoNcD","https://ae-pic-a1.aliexpress-media.com/kf/Sd63248b3eab34730aaa860fa61ac22abu.jpg?has_lang=1&ver=1_220x220q75.jpg_.avif","Grey Wide-Leg Drawstring Pants | Minimalist Cozy Lounge Trousers","The ultimate Clean Girl staple. These Grey Wide-Leg Drawstring Pants combine the comfort of loungewear with a polished, minimalist aesthetic for daily errands. #GreyPants #LoungeWear #MinimalistStyle #CleanGirlAesthetic #ComfortableFashion","Pants"
"https://s.click.aliexpress.com/e/_c4lwe0Rb","https://ae-pic-a1.aliexpress-media.com/kf/S0bb68979aa0640b2be1b1d76c73ea9faN.jpg_220x220q75.jpg_.avif","Heather Grey Striped Wide-Leg Sweats | Elevated Athleticism","A luxurious upgrade to your leisure essentials. These wide-leg sweatpants feature a sophisticated heather grey palette and classic athletic side stripes that elongate the leg. The premium heavy-weight fabric and voluminous cut offer a luxury-loungewear aesthetic perfect for travel or chic urban errands. #WideLegSweats #AthleisureElegance #GreyStyle #ad","Pants"
"https://s.click.aliexpress.com/e/_c3RCwVWz","https://ae-pic-a1.aliexpress-media.com/kf/H5f293ea968394d78a47ff881a6e61d39i.jpg_480x480q75.jpg_.avif","High-Rise Thermal Fleece Jeans | Luxe Winter Warmth","Don't let the cold stop your style. These high-rise jeans are engineered with a premium thermal fleece lining that traps body heat in freezing weather. The classic denim exterior ensures the warmth remains your secret, providing a perfect, sculpted look for the winter season. #ThermalJeans #WinterWarmth #HighRiseDenim #ad","Pants"
"https://s.click.aliexpress.com/e/_c3dMJDZL","https://ae-pic-a1.aliexpress-media.com/kf/Sc31d1e47ddfe49a3ac5b479469671369Z.jpg_220x220q75.jpg_.avif","High-Waisted Wide-Leg Jeans | Classic Blue Denim Trend","Upgrade your denim game with these High-Waisted Wide-Leg Jeans. The flattering waistline and flared hem provide a vintage-inspired look that pairs perfectly with cropped tops. #WideLegJeans #DenimStyle #HighWaistedJeans #VintageDenim #JeansInspo","Pants"
"https://s.click.aliexpress.com/e/_c32obOHZ","https://ae-pic-a1.aliexpress-media.com/kf/S68e8b9fcedab4dd79666dfdf5478a9cc6.jpg_480x480q75.jpg_.avif","Insulated Baggy Snow Pants | High-Performance Alpine Chic","Conquer the slopes in style. These snow pants feature professional-grade insulation in a trendy, oversized silhouette. Designed for maximum mobility and superior warmth, they blend technical performance with an alpine-chic aesthetic that looks just as good at the après-ski as it does on the powder. #SnowPants #AlpineStyle #WinterPerformance #ad","Pants"
"https://s.click.aliexpress.com/e/_c3N23iaZ","https://ae-pic-a1.aliexpress-media.com/kf/Sbc1d9383a0b044469c58288689f11724C.jpg_480x480q75.jpg_.avif","Lilac Dream High-Waist Flare Pants | Soft Pastel Radiance","Add a touch of ethereal color to your rotation. These flare pants in a delicate lilac shade feature a flattering high-waist and a gentle bell-bottom hem. The romantic pastel hue and graceful movement of the flare create a fresh, feminine aesthetic that is perfect for spring celebrations and sunny days. #LilacPants #FlareStyle #PastelRadiance #ad","Pants"
"https://s.click.aliexpress.com/e/_c43tDyIZ","https://ae-pic-a1.aliexpress-media.com/kf/S5e69757f6fec48369eef0549a7d90f71j.jpg_480x480q75.jpg_.avif","Luxe Sand Wide-Leg Lounge Pants | Effortless Fluidity","Experience the ultimate in relaxed luxury. These loose-fitting wide-leg pants feature a soft, flowing fabric that drapes beautifully over the body. The versatile sand tone and airy silhouette offer a sense of effortless fluidity, making them the perfect choice for high-end lounging or a chic, oversized street look. #WideLegStyle #RelaxedLuxury #FluidFashion #ad","Pants"
"https://s.click.aliexpress.com/e/_c4TNOjKX","https://ae-pic-a1.aliexpress-media.com/kf/S33d6b31fd18c4019a54ba8ad1f7e86c55.jpg_220x220q75.jpg_.avif","Luxe Thermal Fleece-Lined Joggers | Ultimate Winter Sanctuary","Your personal sanctuary against the cold. These premium joggers feature a thick, insulating fleece lining that provides incredible warmth without sacrificing style. The tailored fit and soft-touch exterior make them the ultimate choice for stylish winter lounging or cozy mountain getaways. #FleeceJoggers #WinterWarmth #LuxeLounge #ad","Pants"
"https://s.click.aliexpress.com/e/_c3G31e3x","https://ae-pic-a1.aliexpress-media.com/kf/S1c56d254d111454b88f311f2d8ff049aK.jpg_220x220q75.jpg_.avif","Midnight Black Balloon Pants | Avant-Garde Fashion Volume","Play with proportions in style. These balloon pants feature a unique, curved leg design that creates a striking avant-garde silhouette. The high waistband balances the voluminous cut, offering a sophisticated and forward-thinking look for those who love to lead the fashion conversation. #BalloonPants #AvantGardeStyle #BlackFashion #ad","Pants"
"https://s.click.aliexpress.com/e/_c327onXr","https://ae-pic-a1.aliexpress-media.com/kf/Se542baa3ee67465e9260b560b9bc4f25l.jpg_480x480q75.jpg_.avif","Midnight Noir Flared Trousers | Timeless Retro Sophistication","Bring a touch of 70s-inspired glamour to the modern day. These chic black pants feature a subtle flare from the knee, creating a graceful and flattering silhouette. The premium stretch-twill fabric provides a comfortable, structured fit that transitions seamlessly from a sharp office look to an elegant evening out. #FlaredPants #NoirStyle #TimelessSophistication #ad","Pants"
"https://s.click.aliexpress.com/e/_c4O5oIVJ","https://ae-pic-a1.aliexpress-media.com/kf/Sa0d953922b3f493ba208350e2a9ad67bv.jpg_220x220q75.jpg_.avif","Monochrome Sleeveless Pant Set | Minimalist Daily Sophistication","Simplify your style with this perfectly coordinated duo. Featuring a chic sleeveless top and matching relaxed-fit pants, this set offers a clean, monochrome aesthetic. The soft-touch fabric and effortless drape create a minimalist look that is both comfortable for travel and polished enough for a casual dinner. #CoOrdSet #MinimalistFashion #EffortlessChic #ad","Pants"
"https://s.click.aliexpress.com/e/_c4t3mzFv","https://raw.githubusercontent.com/avivaknin/PinterestImages/main/pinterest2/Women%20Pants/2/S40ac02f26baa44d894f8c1d0302cfaa9n.png","Navy Blue Contouring Short Sleeve Active Bodysuit for Workouts and Swim","Women Pants Elevate your active wardrobe with this sleek navy blue short sleeve bodysuit. Designed with innovative contouring seams, it accentuates your figure while providing ultimate comfort and flexibility. Ideal for gym workouts, yoga, cycling, or as stylish swimwear. Its breathable, quick-drying fabric ensures peak performance and confidence. #ActivewearFashion #SportyStyle #BodysuitLove #WorkoutGear #SwimsuitTrends #AthleisureWear #affiliatelink","Pants"
"https://s.click.aliexpress.com/e/_c3jfdsE1","https://ae-pic-a1.aliexpress-media.com/kf/Sd3c61daee5244b8582c26edcafc92cafg.jpg_220x220q75.jpg_.avif","Oatmeal Knitted Luxe Joggers | Premium Hygge Warmth","Wrap yourself in the softest embrace. These knitted joggers are crafted from a premium wool-blend yarn, offering incredible warmth and a rich, tactile texture. The adjustable drawstring and ribbed cuffs create a cozy, Hygge-inspired look that is perfect for cold-weather relaxation and elevated winter lounging. #KnittedJoggers #CozyLuxury #HyggeStyle #ad","Pants"
"https://s.click.aliexpress.com/e/_c3gHuNIf","https://ae-pic-a1.aliexpress-media.com/kf/S573857dd66cb4bd5b773006abccd5aadp.jpg_220x220q75.jpg_.avif","Onyx Seamless Scrunch Leggings | Precision Sculpted Fit","Engineered for a flawless, second-skin experience. These seamless black leggings combine supportive compression with a strategic scrunch-butt detail to enhance your silhouette. The lack of seams ensures a friction-free workout, providing a sleek, professional look for high-level athletic performance. #SeamlessLeggings #SculptedFit #GymEssential #ad","Pants"
"https://s.click.aliexpress.com/e/_c3OBc92H","https://ae-pic-a1.aliexpress-media.com/kf/S187de43264d040539dc9f5d0542a5025g.jpg_480x480q75.jpg_.avif","Peach Sorbet High-Waist Leggings | Radiant Active Glow","Infuse your workout with a burst of sweet energy. These peach-toned leggings feature a high-performance compression fit and a soft-touch matte finish. The vibrant sorbet hue complements all skin tones, while the supportive high waistband ensures a streamlined silhouette during high-intensity sessions. #PeachLeggings #ActiveGlow #FitnessFashion #ad","Pants"
"https://s.click.aliexpress.com/e/_c3GmFWit","https://ae-pic-a1.aliexpress-media.com/kf/S075f7b5802a946aa8e2821194ab7f8c6P.jpg_480x480q75.jpg_.avif","Pink 'Scrunch-Butt' Sculpting Leggings | Ultimate Rear Contour","Designed to celebrate and enhance your natural curves. These vibrant pink leggings utilize innovative scrunch-butt technology to provide a lifted and sculpted appearance. The high-stretch, squat-proof fabric offers total confidence and comfort, making them a standout choice for the gym or an active day out. #ScrunchButt #SculptingLeggings #PinkAesthetic #ad","Pants"
"https://s.click.aliexpress.com/e/_c4aR5SkN","https://ae-pic-a1.aliexpress-media.com/kf/S50067c62f1c94235ad9fc1f33fc2911dz.jpg_480x480q75.jpg_.avif","Rich Burgundy Wide-Leg Trousers | Deep Crimson Majesty","Radiate warmth and authority in these stunning burgundy trousers. The dramatic wide-leg cut and high-waisted fit offer a regal silhouette that moves with fluid grace. Crafted in a rich, seasonal hue, they provide a sophisticated alternative to traditional black, perfect for making a powerful statement. #WideLegPants #BurgundyStyle #PowerTailoring #ad","Pants"
"https://s.click.aliexpress.com/e/_c3HaoUWp","https://ae-pic-a1.aliexpress-media.com/kf/Se9a89bf585994a408c14ddae34d9c7497.jpg_480x480q75.jpg_.avif","Ruched Cargo Flare Leggings | Edgy Tactical Femininity","Where street-style utility meets a flattering flare. These unique leggings feature intricate ruching along the leg and functional cargo pockets, creating a dynamic and textured look. The flared hem adds a dramatic finish, offering a powerful, tactical aesthetic that’s undeniably high-fashion. #CargoLeggings #RuchedStyle #TacticalChic #ad","Pants"
"https://s.click.aliexpress.com/e/_c4UXrPdt","https://ae-pic-a1.aliexpress-media.com/kf/Hdc7e555c03584a81b62b158c0b17721av.jpg_220x220q75.jpg_.avif","Sage Botanical High-Waist Leggings | Serene Earthy Performance","Connect with nature through style. These sage green leggings offer a calming, earthy palette and a premium compression fit. The high-rise waistband provides exceptional core support, while the velvety-soft fabric ensures maximum comfort for yoga, pilates, or a stylish morning hike. #SageGreen #EarthyStyle #ActivewearLuxe #ad","Pants"
"https://s.click.aliexpress.com/e/_c3EMuTal","https://ae-pic-a1.aliexpress-media.com/kf/S67da5752741646858acbc5e91314a39fk.jpg_480x480q75.jpg_.avif","Sky Blue 'Butt-Lift' Yoga Leggings | Ultimate Sculpt & Glow","Experience a new level of confidence in your workout. These vibrant blue yoga leggings feature innovative rear-contouring technology and a high-performance compression fit. Designed to lift and sculpt while providing maximum flexibility, the moisture-wicking fabric ensures you stay cool and radiant through every pose. #YogaLeggings #ButtLift #ActivewearLuxury #ad","Pants"
"https://s.click.aliexpress.com/e/_c3PT7arb","https://ae-pic-a1.aliexpress-media.com/kf/S579aeccb77c249eda5b56c5dd16c4dbed.jpg_480x480q75.jpg_.avif","Slate Grey Baggy Lounge Sweats | Premium Relaxed Luxury","Indulge in the luxury of pure space. These baggy grey sweatpants feature an oversized, voluminous fit and a heavy-weight cotton blend for maximum comfort. The slate grey hue and structured drape offer an elevated take on loungewear, perfect for those who value both comfort and style. #BaggySweats #GreyLounge #OversizedChic #ad","Pants"
"https://s.click.aliexpress.com/e/_c3OsZZFn","https://ae-pic-a1.aliexpress-media.com/kf/S66f7ce02101a47148594da3564533965N.jpg_220x220q75.jpg_.avif","Slate Grey Structured Wide-Leg Pants | Modern Tailored Radiance","A masterclass in modern proportions. These structured wide-leg trousers feature a high-rise waist and a crisp, tailored finish in a sophisticated slate grey. The clean lines and architectural silhouette offer a high-fashion look that is both professional and undeniably on-trend. #WideLegTrousers #GreyAesthetic #ModernTailoring #ad","Pants"
"https://s.click.aliexpress.com/e/_c39GlKKZ","https://ae-pic-a1.aliexpress-media.com/kf/Sacf3df4e8d994433bfe438b820e95d97m.jpg?has_lang=1&ver=1_220x220q75.jpg_.avif","Sparkling Iridescent Beach Trousers | Ethereal Summer Radiance","Captivate the sunlight in these breathtaking beach pants. Featuring a sheer, lightweight fabric infused with iridescent shimmer, they offer an ethereal look perfect for layering over swimwear. The fluid movement and sparkling finish create a high-end resort aesthetic that is truly unforgettable. #BeachPants #SparklingStyle #ResortRadiance #ad","Pants"
"https://s.click.aliexpress.com/e/_c3ZOHAWp","https://ae-pic-a1.aliexpress-media.com/kf/S3b637536e8c74798b6118694e73555abO.jpg?has_lang=1&ver=1_220x220q75.jpg_.avif","Urban Distressed Baggy Jeans | Edgy Heritage Cool","Embrace the beauty of imperfection. These baggy jeans feature strategic distressed detailing and a relaxed, lived-in fit. Crafted from premium heavy-weight denim, they offer a rugged yet sophisticated urban aesthetic that’s perfect for creating a powerful, high-fashion street look. #DistressedDenim #BaggyJeans #UrbanEdgy #ad","Pants"
"https://s.click.aliexpress.com/e/_c40gH6wD","https://ae-pic-a1.aliexpress-media.com/kf/S888ed09e40c04e42a925c6908919db06H.jpg_480x480q75.jpg_.avif","Vertical Striped Palazzo Pants | Flowy Summer Statement Bottoms","Elongate your legs with these Vertical Striped Palazzo Pants. The lightweight, flowy fabric and bold stripes make them a must-have for beach vacations and summer nights. #PalazzoPants #StripedPants #SummerFashion #BohoStyle #FlowyPants","Pants"
"https://s.click.aliexpress.com/e/_c3CTD7Sd","https://ae-pic-a1.aliexpress-media.com/kf/Sd0f1df76a3d5400eb6d685c566d519a7v.png_220x220.png_.avif","Vintage Faded Black Wide-Leg Jeans | Effortless Retro Cool","Capture the iconic aesthetic of the 90s. These jeans feature a premium faded black wash that delivers a sought-after lived-in vintage look. The voluminous wide-leg cut provides an effortless urban edge, making them the perfect foundation for a high-fashion streetwear ensemble paired with sleek boots or sneakers. #WideLegJeans #VintageBlack #RetroCool #ad","Pants"
"https://s.click.aliexpress.com/e/_c4FpbD8p","https://ae-pic-a1.aliexpress-media.com/kf/S556640f292ff420bb3aa229f3213fdb48.jpg_480x480q75.jpg_.avif","Vintage-Washed Wide-Leg Denim | Effortless Heritage Cool","Celebrate the timeless appeal of perfectly aged denim. These wide-leg jeans feature a classic vintage wash and a relaxed, voluminous fit. The premium denim fabric provides a soft, lived-in feel while the wide-leg silhouette delivers a modern, high-fashion take on traditional heritage styles. #WashedDenim #WideLegJeans #HeritageCool #ad","Pants"
"https://s.click.aliexpress.com/e/_c3M4XLqr","https://ae-pic-a1.aliexpress-media.com/kf/S665b9121c6914bae82b312411740dbc86.jpg_220x220q75.jpg_.avif","Wild Instinct Leopard Print Jeans | Bold Exotic Glamour","Unleash your wild side with a touch of luxury. These high-waisted jeans feature an iconic leopard print on premium structured denim. The bold pattern serves as a powerful statement piece, offering an exotic and glamorous edge that transforms even the simplest outfit into a high-fashion look. #LeopardJeans #AnimalPrint #BoldFashion #ad","Pants"
"https://s.click.aliexpress.com/e/_c3YRj8BL","https://ae-pic-a1.aliexpress-media.com/kf/S7f3f46c35556408ab98f98fbb82d75bdN.jpg_480x480q75.jpg_.avif","Zen Flow High-Waist Flare Yoga Pants | Serene Active Movement","Practice yoga with unparalleled style. These flare yoga pants provide total freedom of movement with a trendy silhouette that works perfectly outside the studio. The ultra-stretch, breathable fabric hugs the body in all the right places, offering maximum comfort and a serene, fashionable athletic look. #FlareYogaPants #ZenStyle #ActiveMovement #ad","Pants"