Affiliate URL,Image URL,Name,Description,Category
"https://s.click.aliexpress.com/e/_c3RQrwwr","https://raw.githubusercontent.com/avivaknin/PinterestImages/main/pinterst1/%D7%90%D7%91%D7%99%D7%96%D7%A8%D7%99%D7%9D/Rings/5/%D7%94%D7%95%D7%A8%D7%93%D7%94%20%2814%29.png","אביזריםEarrings2 הורדה (9).png","Discover the beauty of simplicity with these sophisticated minimalist elite hoops, defined by their sleek modern lines and meticulous designer craftsmanship for a refined finish. The premium material and structured silhouette offer a professional yet fashionable look that is perfect for maintaining a polished profile in exclusive social settings. These hoops represent a beautiful harmony of minimalist design and opulent texture, making them a must-have for a curated and elite personal jewelry collection. #MinimalistHoops #ModernLuxe #ad","Rings"
"https://s.click.aliexpress.com/e/_c3RQrwwr","https://raw.githubusercontent.com/avivaknin/PinterestImages/main/pinterst1/%D7%90%D7%91%D7%99%D7%96%D7%A8%D7%99%D7%9D/Rings/5/%D7%94%D7%95%D7%A8%D7%93%D7%94%20%2811%29.png","אביזריםNecklaces3 הורדה (13).png","This elite diamond statement necklace features a radiant geometric design that captures the light from every angle, offering a sophisticated and authoritative fashion presence for high-profile events. Crafted with premium precious metals, it provides a polished and timeless look that serves as the perfect centerpiece for a professional or social wardrobe. It is an essential masterpiece for the modern trendsetter, providing a seamless blend of technical innovation and superior, high-end designer quality. #DiamondNecklace #LuxuryGlow #ad","Rings"
"https://s.click.aliexpress.com/e/_c3RQrwwr","https://raw.githubusercontent.com/avivaknin/PinterestImages/main/pinterst1/%D7%90%D7%91%D7%99%D7%96%D7%A8%D7%99%D7%9D/Rings/5/%D7%94%D7%95%D7%A8%D7%93%D7%94%20%2813%29.png","אביזריםNecklaces5 הורדה (12).png","Command attention with this majestic emerald heritage necklace, designed with a vibrant regal aesthetic that captures the magic of timeless beauty and modern craftsmanship. The lustrous gold detailing and high-quality gemstone provide an exceptional sensory experience, ensuring you radiate high-fashion charm and confidence throughout any prestigious celebration. This piece is a stunning addition to any luxury jewelry collection, providing a polished and trendy appearance that adds unparalleled glamour to your personal style. #EmeraldHeritage #RegalNecklace #ad","Rings"
"https://s.click.aliexpress.com/e/_c3mc23oh","https://ae-pic-a1.aliexpress-media.com/kf/S31587c9dd2fc43aba6bd988ee92951c7w.jpg_480x480q75.jpg_.avif","Aiternity Moissanite Halo Band | Majestic Bridal Radiance","A symbol of eternal light. This Aiternity ring features a central Moissanite brilliant-cut stone framed by a shimmering halo. The precision-crafted band is designed for a seamless fit, offering a high-end bridal aesthetic that radiates sophisticated love and timeless style. #EngagementRing #MoissaniteHalo #BridalJewelry #ad","Rings"
"https://s.click.aliexpress.com/e/_c3GWZWJF","https://ae-pic-a1.aliexpress-media.com/kf/Sba6c98b62023463e9d693ab129f9d1a9t.jpg_480x480q75.jpg_.avif","Brushed Onyx Smart Health Ring | Next-Gen Bio-Intelligence","Precision health in a bold design. The brushed onyx finish of this smart ring provides an industrial, high-end look. It monitors sleep stages, blood oxygen, and recovery metrics, delivering deep bio-intelligence to your smartphone in a sleek, wearable form that complements any modern wardrobe. #HealthRing #BioIntelligence #SmartJewelry #ad","Rings"
"https://s.click.aliexpress.com/e/_c3FBXUc9","https://ae-pic-a1.aliexpress-media.com/kf/S48e37ebebec946b1ae00246a9702d589v.jpg_480x480q75.jpg_.avif","Chic Minimalist Smart Fitness Ring | Seamless Health Integration","Track your journey with understated elegance. This smart fitness ring features a smooth, low-profile design that integrates seamlessly into your daily style. From heart rate monitoring to step counting, it provides high-level data in a sophisticated, minimalist package. #FitnessRing #ChicTech #HealthTracker #ad","Rings"
"https://s.click.aliexpress.com/e/_c393GIC5","https://ae-pic-a1.aliexpress-media.com/kf/S07d8a96126db46d28f3327ba995970b4H.jpg_480x480q75.jpg_.avif","Cool Silver Moissanite Eternity Band | Endless Geometric Sparkle","A seamless circle of icy fire. Crafted in premium sterling silver and set with a continuous row of Moissanite stones, this eternity band offers a cool-toned, modern brilliance. Its versatile design makes it an ideal stacking ring, providing a sophisticated layer of shimmer that symbolizes infinite style. #EternityBand #MoissaniteSilver #ModernStack #ad","Rings"
"https://s.click.aliexpress.com/e/_c2wBdyxF","https://ae-pic-a1.aliexpress-media.com/kf/Sf7d7db2ef6d745898b40c1d39b66c7c6A.jpg_480x480q75.jpg_.avif","Digital Age Life","Satin Lace Pumps | Vintage Bridal Style","Rings"
"https://s.click.aliexpress.com/e/_c3RQrwwr","https://raw.githubusercontent.com/avivaknin/PinterestImages/main/pinterst1/%D7%90%D7%91%D7%99%D7%96%D7%A8%D7%99%D7%9D/Rings/5/%D7%94%D7%95%D7%A8%D7%93%D7%94%20%2812%29.png","Effortlessly Chic Summer Style: Light Wash Denim Shorts, White Top & Dazzling Diamond Ring","Rings Elevate your casual summer look with these stylish light wash denim shorts paired with a crisp white top. Complete the effortlessly chic ensemble with a stunning large diamond ring, perfect for adding a touch of sparkle to any outfit. A versatile and trendy combination for warm weather days. #DenimShorts #SummerFashion #DiamondRing #CasualStyle #EverydayJewelry #FashionInspo #affiliatelink","Rings"
"https://s.click.aliexpress.com/e/_c3aBvFPJ","https://ae-pic-a1.aliexpress-media.com/kf/S93ff7b169da141028f8a7703cf5446f1P.jpg_480x480q75.jpg_.avif","Geometric Dual-Square Ring | Modern Architectural Sparkle","A bold take on contemporary geometry. This unique ring features two square-cut stones set in a dynamic, offset arrangement. The sharp lines and brilliant fire of the stones offer an architectural aesthetic that is perfect for the woman who appreciates modern design and high-end craftsmanship. #GeometricRing #SquareCut #ModernJewelry #ad","Rings"
"https://s.click.aliexpress.com/e/_c3JGzOeZ","https://ae-pic-a1.aliexpress-media.com/kf/Sfb9fb71ff8244e61a57ed7de1e9fd6f50.jpg_480x480q75.jpg_.avif","Gilded Elite Smart Fitness Ring | Luxury Health Monitoring","Luxury that learns your rhythm. Finished in premium gold plating, this smart ring tracks everything from stress levels to recovery time. It’s a masterclass in functional jewelry, offering the highest level of health monitoring within a stunning, executive-style golden band. #GoldSmartRing #LuxeTech #WellnessStyle #ad","Rings"
"https://s.click.aliexpress.com/e/_c3QLA7RP","https://ae-pic-a1.aliexpress-media.com/kf/S63b464e02c244975be6c936e2982d0f1f.jpg_480x480q75.jpg_.avif","Gilded Elite Smart Fitness Ring | Luxury Health Monitoring","Luxury that learns your rhythm. Finished in premium gold plating, this smart ring tracks everything from stress levels to recovery time. It’s a masterclass in functional jewelry, offering the highest level of health monitoring within a stunning, executive-style golden band. #GoldSmartRing #LuxeTech #WellnessStyle #ad","Rings"
"https://s.click.aliexpress.com/e/_c4kVYQuH","https://ae-pic-a1.aliexpress-media.com/kf/S43716866b7be4687b55d2195fd7f7d4ck.jpg_480x480q75.jpg_.avif","Gold Buckle Box | Shimmering Party Clutch","Make a regal entrance with this magnificent gold buckle box clutch featuring a unique artistic silhouette and glamorous silver sparkle details for gala nights. The shimmering finish and modern design create a show stopping presence that will make you the center of attention during the grand wedding party. Crafted from premium materials to ensure a secure fit and a luxurious feel during your most prestigious gala wedding night celebrations today. This artistic masterpiece is designed for the modern woman who wants to showcase her unique feminine grace and authority in the city ballroom. This luxury accessory represents high fashion for the elite guest. #sparkleclutch #goldbuckle #boxbag #weddingstyle #luxuryfashion #formalwear #fashion #elegant #ad","Rings"
"https://s.click.aliexpress.com/e/_c3YWmAs5","https://ae-pic-a1.aliexpress-media.com/kf/S2d2a7bafeb7740399bd1d6c2cdcf89a0u.jpg_220x220q75.jpg_.avif","Gold-Infused Smart Health Tracker | The Pinnacle of Tech-Chic","Who says technology can't be beautiful? This stylish health tracker ring features a designer gold finish and a high-performance bio-sensor suite. It monitors your vitals with precision while looking like a piece of high-end jewelry, making it the perfect choice for the fashion-forward wellness enthusiast. #SmartWellness #TechChic #HealthTrackerRing #ad","Rings"
"https://s.click.aliexpress.com/e/_c3sTQiFL","https://ae-pic-a1.aliexpress-media.com/kf/S87eb4f4738a544e1a7bdb136d5477a82t.jpg_480x480q75.jpg_.avif","Icy Diamond Pavé Band | High-Octane Shimmer","Drenched in a sea of light. This ring features a multi-row pavé setting that creates a continuous surface of shimmering stones. The precision-set design ensures that the ring catches the light from every possible angle, providing a high-impact, glamorous look that is perfect for evening elegance. #PaveRing #SparkleJewelry #EveningGlam #ad","Rings"
"https://s.click.aliexpress.com/e/_c3dvPeXF","https://ae-pic-a1.aliexpress-media.com/kf/S31f37bacaa714dab8154efdeef48b49fj.jpg_480x480q75.jpg_.avif","Iridescent Smart Wellness Ring | Trend-Forward Health Tech","Fashion-first fitness. This smart ring features a unique, light-catching finish that shifts with your movement. Beyond its stunning exterior, it packs advanced sensors to track your recovery and fitness goals, proving that high-end wellness technology can be the centerpiece of your jewelry collection. #SmartTech #IridescentRing #FashionFitness #ad","Rings"
"https://s.click.aliexpress.com/e/_c3zjglgb","https://raw.githubusercontent.com/avivaknin/PinterestImages/main/pinterst1/%D7%90%D7%91%D7%99%D7%96%D7%A8%D7%99%D7%9D/Rings/7/%D7%94%D7%95%D7%A8%D7%93%D7%94%20%289%29.png","Majestic Sapphire Royal Ring ǀ Radiant Atmospheric Glow and Delicate Artisan Detailing","Exude timeless grace with this majestic sapphire royal ring, featuring a radiant atmospheric glow that highlights its delicate artisan detailing and high-quality gemstone. The high-end construction and refined finish offer a sophisticated look that is both visually striking and incredibly durable for a confident, authoritative fashion presence. This ring represents a commitment to superior craftsmanship, blending romantic charm with a professional and elite designer flair for the modern icon. #SapphireGrace #RoyalJewelry #ad","Rings"
"https://s.click.aliexpress.com/e/_c4nMmezR","https://ae-pic-a1.aliexpress-media.com/kf/S1dab0002d6d143a188577ef0528af1b8c.jpg_480x480q75.jpg_.avif","Modern Home Idea","Step into the spotlight with these breathtaking satin bow heels designed for elite social celebrations and prestigious gala events tonight in the city ballroom. The natural iridescent finish and structured silhouette offer a regal and polished appearance for grand gala wedding balls tonight in style today. Crafted from premium materials to ensure a durable and high quality finish for a sophisticated look during the entire evening ceremony and gala today. This designer piece is a timeless investment. #bowheels #satinpumps #partydress #weddingstyle #luxuryfashion #formalwear #style #elegant #ad","Rings"
"https://s.click.aliexpress.com/e/_c3uwZrgv","https://ae-pic-a1.aliexpress-media.com/kf/S8b8afe26c3464da5bb65ed5a377a2a3cq.jpg_480x480q75.jpg_.avif","Onyx & Gold Smart Fitness Ring | Elite Wellness Technology","Wellness, reimagined in black and gold. This sleek smart ring tracks your vitals, sleep, and activity with surgical precision. The onyx-toned finish and gold accents hide powerful sensors, offering a high-tech health companion that looks like a designer accessory. #SmartRing #FitnessTracker #WellnessTech #ad","Rings"
"https://s.click.aliexpress.com/e/_c4T8pyG9","https://ae-pic-a1.aliexpress-media.com/kf/S6d412dbc36084f11ad1bd437977e4913L.jpg_480x480q75.jpg_.avif","Onyx & Silver Double-Row Band | Modern Geometric Stacking","Twice the brilliance. This elegant ring features two parallel rows of shimmering stones, creating a wider, more impactful presence on the hand. The geometric precision and high-shine finish make it a perfect piece for stacking or wearing alone as a modern statement of luxury. #DoubleRowRing #StackableJewelry #GeometricElegance #ad","Rings"
"https://s.click.aliexpress.com/e/_c3zjglgb","https://raw.githubusercontent.com/avivaknin/PinterestImages/main/pinterst1/%D7%90%D7%91%D7%99%D7%96%D7%A8%D7%99%D7%9D/Rings/7/Sa088aaed56a1433d99c2d087eac704fa7.jpg_220x220q75.jpg_.png","Outerwea7 description_imageS9f2d18fefbb04d779e854f.jpg","This elite signature designer overcoat defines the pinnacle of modern luxury, featuring a sleek contemporary cut and a refined polish that radiates authority. Crafted from the finest materials, it offers a sharp fashion profile that is ideal for those who appreciate fine artisan craftsmanship and a minimalist aesthetic. The premium fabric drapes with effortless beauty, providing a luxurious sensory experience that ensures you stay comfortable while radiating pure elegance. It is a versatile staple for any curated wardrobe, offering a seamless blend of classic charm and contemporary high-fashion innovation for the leader. This piece provides a polished silhouette that ensures you stand out with undeniable elegance and a superior, high-end designer flair in any professional setting. #SignatureOvercoat #EliteLuxe #ad","Rings"
"https://s.click.aliexpress.com/e/_c3RQrwwr","https://raw.githubusercontent.com/avivaknin/PinterestImages/main/pinterest2/%D7%90%D7%91%D7%99%D7%96%D7%A8%D7%99%D7%9D/Rings/7/S485f708d52a34f0fb8dd247bfef59b41b.png","Past Day Note","Silver Crystal Pumps | Ethereal Gala Style","Rings"
"https://s.click.aliexpress.com/e/_c3GcfNJR","https://ae-pic-a1.aliexpress-media.com/kf/Sd473bfdf861140949c2dd66bbd21cbbfs.jpg_480x480q75.jpg_.avif","Pear-Cut Moissanite Solitaire | Elongated Grace & Fire","A silhouette of pure sophistication. This ring features a breathtaking pear-cut center stone, designed to visually elongate the finger and capture light with a unique, teardrop-shaped fire. Set on a minimalist band, it offers a romantic and statuesque look that is both timeless and trend-forward. #PearCut #SolitaireRing #ElegantSparkle #ad","Rings"
"https://s.click.aliexpress.com/e/_c3zjglgb","https://raw.githubusercontent.com/avivaknin/PinterestImages/main/pinterst1/%D7%90%D7%91%D7%99%D7%96%D7%A8%D7%99%D7%9D/Rings/7/%D7%94%D7%95%D7%A8%D7%93%D7%94%20%288%29.png","Premier Avant-Garde Luxury Ring ǀ Bold Architectural Design and Elite Technical Polish","Redefine boundaries with this premier avant-garde luxury ring, featuring a bold architectural design and an elite technical polish that commands respect in any setting. The innovative craftsmanship and unique structure ensure a durable and high-fashion aesthetic, providing a polished profile that reflects a deep passion for artistic innovation. It serves as a stunning masterpiece of modern jewelry design, offering a seamless blend of sophisticated charm and superior, high-end designer quality. #AvantGardeRing #ModernMasterpiece #ad","Rings"
"https://s.click.aliexpress.com/e/_c3RQrwwr","https://raw.githubusercontent.com/avivaknin/PinterestImages/main/pinterest2/%D7%90%D7%91%D7%99%D7%96%D7%A8%D7%99%D7%9D/Rings/7/S5d8c098ca85f406ea539064d140794c9I.png","Premier Ethereal Rose Gold Ring ǀ Delicate Intricate Detailing and Timeless Romantic Grace","Exude romantic grace in this premier ethereal rose gold ring, featuring delicate intricate detailing that creates a striking and modern aesthetic for a high-end personal rotation. The high-quality construction and refined finish offer a sophisticated look that is both visually striking and incredibly comfortable for a confident and elegant presence. Designed for the style visionary, this ring provides a polished profile that ensures you stand out with undeniable elegance and a superior designer flair. #RoseGoldRing #EtherealGrace #ad","Rings"
"https://s.click.aliexpress.com/e/_c2QTDbFf","https://ae-pic-a1.aliexpress-media.com/kf/S685f097e251f43f0bc60cbfa76f8557fr.jpg_480x480q75.jpg_.avif","Red Wedding Heels | Sexy Stiletto Style","Make a bold fashion statement with these exquisite red wedding heels featuring a unique artistic silhouette and glamorous details for gala nights tonight. The sparkling finish and modern design create a show stopping presence that will make you the center of attention during the party today. Crafted from premium materials to ensure a secure fit and a luxurious feel during your most prestigious gala wedding night celebrations. This artistic masterpiece is designed for the modern woman who wants to shine. #redheels #stilettoheels #weddingstyle #luxuryfashion #glamour #formalwear #fashion #elegant #ad","Rings"
"https://s.click.aliexpress.com/e/_c3YgsCnF","https://ae-pic-a1.aliexpress-media.com/kf/S75403fd1643342f3ae59019d773d0290w.jpg_220x220q75.jpg_.avif","Rose Gold Chic Health Tracker | Sophisticated Wellness Ring","Elegance meets intelligence. Finished in a soft rose gold or polished metal, this smart ring provides comprehensive health insights including blood oxygen and sleep quality. It’s the ultimate accessory for the modern woman who values both her health and her high-end aesthetic. #SmartHealthRing #WellnessLuxury #TechStyle #ad","Rings"
"https://s.click.aliexpress.com/e/_c3OhDZnR","https://ae-pic-a1.aliexpress-media.com/kf/S7213b87e5fb040af836b5453fc19e596R.jpg_480x480q75.jpg_.avif","Rose Gold Infinity Sparkle Band | Warm Romantic Radiance","A romantic twist on a classic silhouette. This eternity ring features a warm rose gold setting that perfectly complements the brilliant stones. The blush-toned metal adds a soft, feminine glow to the continuous circle of light, making it an exquisite choice for a wedding band or a sentimental gift. #RoseGoldRing #EternityBand #RomanticRadiance #ad","Rings"
"https://s.click.aliexpress.com/e/_c40dZh4Z","https://ae-pic-a1.aliexpress-media.com/kf/Sd556b6d998794fdf97d8b2e30ae302c1C.jpg_480x480q75.jpg_.avif","Sculpted Female Smart Health Ring | Feminine Tech Precision","Tailored specifically for the feminine aesthetic. This smart ring features a slimmer, more delicate band without compromising on performance. It tracks female-specific wellness cycles and daily activity, providing a personalized health experience in a beautiful, high-fashion form. #SmartJewelry #WomensHealth #TechChic #ad","Rings"
"https://s.click.aliexpress.com/e/_c4sLoSe1","https://ae-pic-a1.aliexpress-media.com/kf/A09a63ac8883e4899b8872549c3770b33B.png_480x480.png_.avif","Sleek Midnight Smart Ring | Minimalist Athletic Intelligence","Intelligence in its most streamlined form. This midnight-toned smart ring features a matte finish and advanced fitness tracking capabilities. Its discreet design hides a powerful heart rate sensor and pedometer, offering the perfect solution for the athlete who demands high-end data without the bulk of a watch. #SmartFitness #SleekTech #ModernWellness #ad","Rings"
"https://s.click.aliexpress.com/e/_c3cjjkwv","https://ae-pic-a1.aliexpress-media.com/kf/S00755799b49345a88600d71bef96b95ao.jpg_480x480q75.jpg_.avif","Sleek Midnight Smart Ring | Minimalist Athletic Intelligence","Intelligence in its most streamlined form. This midnight-toned smart ring features a matte finish and advanced fitness tracking capabilities. Its discreet design hides a powerful heart rate sensor and pedometer, offering the perfect solution for the athlete who demands high-end data without the bulk of a watch. #SmartFitness #SleekTech #ModernWellness #ad","Rings"
"https://s.click.aliexpress.com/e/_c3BHpGOp","https://ae-pic-a1.aliexpress-media.com/kf/S711c441b151548bf87057221f8c57567N.jpg_480x480q75.jpg_.avif","Smyoue Sterling Moissanite Band | Minimalist Linear Sparkle","The perfect balance of simplicity and light. This Smyoue band is crafted from hallmarked 925 sterling silver and set with a row of brilliant-cut Moissanite stones. Its clean, linear design makes it an ideal choice for a modern wedding band or a sophisticated addition to a luxury ring stack. #SmyoueJewelry #MoissaniteBand #SterlingSilver #ad","Rings"
"https://s.click.aliexpress.com/e/_c3qasSJ3","https://ae-pic-a1.aliexpress-media.com/kf/Sc7017be49e9242369b5eecf4eb567c36q.jpg_480x480q75.jpg_.avif","Smyoue Three-Stone Trilogy Ring | Past, Present, & Future Fire","A breathtaking symbol of your journey. This trilogy ring features three perfectly matched round Moissanite stones, representing the past, present, and future. The elevated setting and high-polish band ensure maximum brilliance, making it a powerful and romantic choice for an engagement or milestone anniversary. #ThreeStoneRing #TrilogyRing #MoissaniteLuxury #ad","Rings"
"https://s.click.aliexpress.com/e/_c4o1mblx","https://ae-pic-a1.aliexpress-media.com/kf/Se9a7ad5e733447798cea08adef908fabS.jpg_480x480q75.jpg_.avif","Solid 18k Gold Radiant Band | Pure Gilded Sophistication","Experience the warmth of true luxury. This 18k gold ring offers a rich, deep hue that only high-purity gold can provide. Its smooth, radiant finish and substantial weight make it a standout piece of Quiet Luxury, designed to be worn for a lifetime as a symbol of enduring style. #18kGold #GoldRing #TimelessLuxury #ad","Rings"
"https://s.click.aliexpress.com/e/_c3RQrwwr","https://raw.githubusercontent.com/avivaknin/PinterestImages/main/pinterest2/%D7%90%D7%91%D7%99%D7%96%D7%A8%D7%99%D7%9D/Rings/2/S4e94af43c71344bbb55f278d3114e5940.png","Sophisticated Noir Onyx Ring ǀ Sharp Modern Silhouette and Meticulous Elite Polish","Elevate your style with this sophisticated noir onyx ring, defined by its sharp modern silhouette and meticulous elite polish for a refined, high-end finish. The premium gemstone and structured design provide an exceptional visual impact, ensuring you maintain a sharp and trendy social appearance at any exclusive gathering. It represents a beautiful harmony of bold minimalist design and opulent texture, making it an essential piece for any curated luxury accessory collection. #NoirOnyx #EliteStyle #ad","Rings"
"https://s.click.aliexpress.com/e/_c42DMEy9","https://ae-pic-a1.aliexpress-media.com/kf/Sc2ffb03cedd44c2d9d857756086c15dd3.jpg_480x480q75.jpg_.avif","Sparkling Moissanite Eternity Band | Ultimate Bridal & Anniversary Ring","The epitome of elegance. This Moissanite Eternity Band provides incredible fire and brilliance, making it the perfect anniversary gift or a luxurious addition to your jewelry collection. #BridalJewelry #AnniversaryGift #MoissaniteStyle #WeddingRing #Sparkle #ad","Rings"
"https://s.click.aliexpress.com/e/_c3zjglgb","https://raw.githubusercontent.com/avivaknin/PinterestImages/main/pinterst1/%D7%90%D7%91%D7%99%D7%96%D7%A8%D7%99%D7%9D/Rings/7/%D7%94%D7%95%D7%A8%D7%93%D7%94%20%287%29.png","Sparkling Rose Gold Five-Stone Ring - Elegant 925 Silver Anniversary Band","Rings Discover this stunning rose gold plated 925 sterling silver ring, featuring five brilliant round-cut stones in a beautiful half-eternity design. Perfect as an anniversary gift, a wedding band, or a timeless accessory for everyday elegance. Its radiant sparkle adds a touch of sophistication to any look. #RoseGoldRing #EternityBand #925SilverRing #AnniversaryGift #FineJewelry #GemstoneRing #affiliatelink","Rings"
"https://s.click.aliexpress.com/e/_c3RQrwwr","https://raw.githubusercontent.com/avivaknin/PinterestImages/main/pinterest2/%D7%90%D7%91%D7%99%D7%96%D7%A8%D7%99%D7%9D/Rings/5/%D7%94%D7%95%D7%A8%D7%93%D7%94%20%283%29.png","Sparkling Rose Gold Five-Stone Ring - Elegant 925 Silver Anniversary Band","Rings Discover this stunning rose gold plated 925 sterling silver ring, featuring five brilliant round-cut stones in a beautiful half-eternity design. Perfect as an anniversary gift, a wedding band, or a timeless accessory for everyday elegance. Its radiant sparkle adds a touch of sophistication to any look. #RoseGoldRing #EternityBand #925SilverRing #AnniversaryGift #FineJewelry #GemstoneRing #affiliatelink","Rings"
"https://s.click.aliexpress.com/e/_c36gmWGl","https://ae-pic-a1.aliexpress-media.com/kf/S683f3b12a95941fba7bc10d902b0ff0eO.jpg_480x480q75.jpg_.avif","The Eternal Brilliant-Cut Solitaire | Iconic Diamond-Style Fire","A celebration of the perfect circle. This ring features a classic round-cut center stone designed for maximum light refraction. The slender, high-polish band allows the stone to take center stage, delivering an iconic look of sophisticated brilliance that never goes out of style. #RoundCutRing #SolitaireJewelry #IconicSparkle #ad","Rings"
"https://s.click.aliexpress.com/e/_c3egxH8Z","https://ae-pic-a1.aliexpress-media.com/kf/S41fa40223385459b9fb92412de53ba963.jpg_480x480q75.jpg_.avif","Titanium Smart Wellness Band | High-Performance Health Tracking","Where durability meets data. Crafted from premium titanium-grade materials, this elegant smart ring monitors your heart rate, sleep cycles, and daily activity with medical-grade accuracy. Its sleek, unadorned exterior hides a world of intelligence, providing a sophisticated health companion for the high-achiever. #SmartHealthRing #WellnessData #TitaniumTech #ad","Rings"