Affiliate URL,Image URL,Name,Description,Category
"https://s.click.aliexpress.com/e/_c3mNL4Ch","https://ae-pic-a1.aliexpress-media.com/kf/Se6d3dd492d35476298e2465f03eb4fb91.jpg_480x480q75.jpg_.avif","Black-Satin-Leopard-Robe | Noir Exotic Fluidity","A daring fusion of midnight satin and high-definition leopard motifs. This robe offers a liquid-like drape and a provocative yet polished aesthetic, perfect for the woman who commands authority even in her private sanctuary. #SatinRobe #LeopardPrint #BoudoirLuxe #ad","Robes"
"https://s.click.aliexpress.com/e/_c4Bbmml7","https://ae-pic-a1.aliexpress-media.com/kf/S9b27ed78709b41c8ad09152dec9735c1L.jpg_480x480q75.jpg_.avif","Champagne-Satin-Kimono-Robe | Luminous Silk-Touch Wrap","Radiating a soft, golden glow, this champagne satin kimono features wide architectural sleeves and a seamless finish. It offers a look of unstudied high-society elegance for a refined morning routine. #ChampagneRobe #KimonoStyle #SatinLuxury #ad","Robes"
"https://s.click.aliexpress.com/e/_c3wBhpwh","https://ae-pic-a1.aliexpress-media.com/kf/Se995e464499441a0adae5e6d9b069a90Z.jpg_220x220q75.jpg_.avif","Cozy Button-Front Fleece Robe | Soft Plush Winter Bathrobe","The ultimate comfort for chilly mornings. This button-front fleece robe offers plush warmth and a secure fit, making it your favorite companion for coffee and relaxation. #FleeceRobe #CozyVibes #WinterLoungewear #HomeComfort #ad","Robes"
"https://s.click.aliexpress.com/e/_c41hl1oz","https://ae-pic-a1.aliexpress-media.com/kf/Scf239e69a4934d13968cfd768c95ee64g.jpg_480x480q75.jpg_.avif","Cozy-Hooded-Cable-Knit-Robe | Textural Heritage Warmth","Combining the timeless appeal of cable-knit artistry with the supreme comfort of a hooded robe. This piece offers a structured, weighty drape that provides a statuesque silhouette and elite thermal protection. #CableKnitRobe #HeritageLounge #WinterLuxury #ad","Robes"
"https://s.click.aliexpress.com/e/_c4CSL1DH","https://ae-pic-a1.aliexpress-media.com/kf/S831938b6b63441f7b7deaafcfebb2773U.jpg_480x480q75.jpg_.avif","Cozy-Hooded-Fleece-Robe | High-Density Thermal Envelope","Engineered for the ultimate insulation. This hooded fleece robe provides a voluminous, cloud-like sanctuary against the cold, radiating a look of serene, unyielding comfort for the winter season. #FleeceRobe #HoodedComfort #ThermalLuxe #ad","Robes"
"https://s.click.aliexpress.com/e/_c2ypiD6t","https://ae-pic-a1.aliexpress-media.com/kf/Safbc6f6d16464e118a203440c0e7199au.jpg_480x480q75.jpg_.avif","Cozy-Plush-Aqua-Robe | Serene Cerulean Plush","In a vibrant yet calming aqua hue, this plush robe utilizes high-pile fibers to create a soft-touch experience. Its statuesque length and vibrant color story make it a standout piece for the modern home. #AquaRobe #PlushLounge #VibrantComfort #ad","Robes"
"https://s.click.aliexpress.com/e/_c4Ej3GCp","https://ae-pic-a1.aliexpress-media.com/kf/Sa976959b02ac4be0aee9a9a4ad9388fb0.jpg_480x480q75.jpg_.avif","Cozy-Women-S-Fleece-Robe | The Essential Soft-Touch Wrap","A foundational staple for a luxury lounge wardrobe. This fleece robe focuses on fabric purity and a relaxed, protective fit, offering a look of unstudied elegance and reliable warmth. #FleeceLounge #SoftRobe #DailyLuxury #ad","Robes"
"https://s.click.aliexpress.com/e/_c3Xei1Rj","https://ae-pic-a1.aliexpress-media.com/kf/Sd467352441cc487e9fc985096769fb06M.jpg_480x480q75.jpg_.avif","Crystal Cage Design | Designer Jewelry Purse","Stand out from the crowd with this breathtaking crystal cage evening bag featuring an artistic jewelry inspired silhouette. The brilliant stones and metallic frame create a mesmerizing shimmer that reflects your sophisticated taste in high end fashion. Crafted with professional precision to ensure a secure and luxurious feel throughout your prestigious social wedding night. This stunning accessory is the ultimate statement piece for a woman who demands absolute elegance and style. #crystalbag #cageclutch #jewelrybag #formalwear #luxuryfashion #weddingstyle #fashion #elegant","Robes"
"https://s.click.aliexpress.com/e/_c4pIT1r7","https://ae-pic-a1.aliexpress-media.com/kf/Sd296311d1dc845a29dd3604fad90190fz.jpg_480x480q75.jpg_.avif","Elegant Satin Lace Robe | Romantic Silky Morning Gown","Add a touch of luxury to your daily routine. Featuring delicate lace sleeves and a silky satin finish, this robe is perfect for feeling glam while getting ready. #SatinRobe #LaceDetail #MorningLuxury #GettingReady #BoudoirStyle #ad","Robes"
"https://s.click.aliexpress.com/e/_c40gx3n3","https://ae-pic-a1.aliexpress-media.com/kf/S48c94661c9274c37b9e09b613cf0d594c.jpg_480x480q75.jpg_.avif","Elegant-Lace-Satin-Robe | Sculpted Intimacy In Satin","A masterclass in boudoir detail. This robe features intricate lace appliqué set against high-lustre satin, creating a multi-textural aesthetic that is both romantically ethereal and statuesque. #LaceSatinRobe #EveningLuxe #IntimateApparel #ad","Robes"
"https://s.click.aliexpress.com/e/_c3rZISd7","https://ae-pic-a1.aliexpress-media.com/kf/Ad38045ef5b3d425d8af8e1979f4f8617t.jpg_220x220q75.jpg_.avif","Elegant-Satin-Lace-Robes | The Boutique Satin Collective","Highlighting the interplay of light and shadow. These robes offer a professional-grade satin finish with delicate lace trims, providing a unified look of high-end boutique sophistication for the bridal party or individual curator. #SatinLace #BoutiqueRobe #LuxuryLounge #ad","Robes"
"https://s.click.aliexpress.com/e/_c3J5DS3P","https://ae-pic-a1.aliexpress-media.com/kf/Sfb7d173d281b4cbb95813a2263754c78Z.jpg_220x220q75.jpg_.avif","Feather Satin Robe | The Luminous Bridal Monolith","A masterclass in ethereal architecture, featuring high-fidelity feather trim and a statuesque satin framework. This robe provides a continuous vertical sweep and a radiant facial frame, radiating an aura of sovereign bridal power and uncompromised elite-level luxury. It serves as the definitive structural anchor for the private sanctuary.  #BridalRobe #FeatherArchitecture #LuminousLuxe #ad","Robes"
"https://s.click.aliexpress.com/e/_c3HPrjtr","https://ae-pic-a1.aliexpress-media.com/kf/S2dd4c9dc9c9c47bd819ac547f79a22edS.jpg_480x480q75.jpg_.avif","Fluffy Hooded Robe | The Saturated Thermal Vault","Engineered with high-pile tactile fibers and a protective architectural hood to define a statuesque domestic profile. This robe radiates an aura of mission-ready urban warmth and unyielding professional-grade comfort, serving as a powerful structural shield for sub-zero resilience.  #FluffyRobe #ThermalVault #SaturatedStyle #ad","Robes"
"https://s.click.aliexpress.com/e/_c4TsB8Mf","https://ae-pic-a1.aliexpress-media.com/kf/Sb30122e97d35407f9f9df56a12a90937g.jpg_480x480q75.jpg_.avif","Fluffy-Abstract-Print-Robe | Kinetic Graphic Plush","Merging avant-garde abstract art with the tactile luxury of fluffy fleece. This robe offers a high-impact visual presence and an incredibly soft hand-feel, designed for the modern art-conscious home. #AbstractRobe #GraphicLounge #TexturalArt #ad","Robes"
"https://s.click.aliexpress.com/e/_c43QmBcF","https://ae-pic-a1.aliexpress-media.com/kf/Sde41cebde98d4e12a74e604ffaf6bf949.jpg_480x480q75.jpg_.avif","Full-Length White Robe | The Luminous Ivory Column","Defined by an extreme statuesque verticality and a pristine ivory tone that creates a continuous architectural line. This robe provides a sharp horizontal balance and radiates an aura of modernistic serenity and unyielding heritage-grade luxury for the sophisticated curator.  #WhiteRobe #IvoryColumn #ModernistLuxe #ad","Robes"
"https://s.click.aliexpress.com/e/_c3EY1aLV","https://ae-pic-a1.aliexpress-media.com/kf/S25ef3162b5504f35a1df4d525aa85496L.jpg_220x220q75.jpg_.avif","Hooded Plush Monolith | The Kinetic Geometric Vault","Featuring a rigid plush framework and a statuesque hooded architecture designed for uncompromised mobility. This robe radiates an aura of unstudied boutique energy and unyielding professional-grade polish, framing the sanctuary profile with surgical-grade precision.  #PlushRobe #GeometricVault #KineticStyle #ad","Robes"
"https://s.click.aliexpress.com/e/_c4eQcT7v","https://ae-pic-a1.aliexpress-media.com/kf/S86100d5c885b43da86eabd467fd7cc1cQ.jpg_480x480q75.jpg_.avif","Hooded Plush Monolith | The Kinetic Geometric Vault","Featuring a rigid plush framework and a statuesque hooded architecture designed for uncompromised mobility. This robe radiates an aura of unstudied boutique energy and unyielding professional-grade polish, framing the sanctuary profile with surgical-grade precision.  #PlushRobe #GeometricVault #KineticStyle #ad","Robes"
"https://s.click.aliexpress.com/e/_c3KNIkXX","https://ae-pic-a1.aliexpress-media.com/kf/S79afaaf69e1748149aedf8876e924005T.jpg_220x220q75.jpg_.avif","Lightweight-Floral-Kimono-Robe | Botanical Breathability","A poetic display of seasonal blooms on a weightless fabric base. This floral kimono provides a fluid, airy silhouette that is perfect for summer mornings and high-end resort lounging. #FloralKimono #SummerRobe #BotanicalLuxe #ad","Robes"
"https://s.click.aliexpress.com/e/_c4Xmvclx","https://ae-pic-a1.aliexpress-media.com/kf/Sc9f9dc4783e34e2aad2f33ae0813530d5.jpg_480x480q75.jpg_.avif","Long-Plush-Women-S-Robe | Statuesque Floor-Length Cloud","Experience the grandeur of a floor-sweeping silhouette. This long plush robe provides total body coverage and a majestic presence, radiating an aura of unyielding warmth and high-society comfort. #LongPlushRobe #FloorLengthLuxe #WinterSanctuary #ad","Robes"
"https://s.click.aliexpress.com/e/_c3yiIxXL","https://ae-pic-a1.aliexpress-media.com/kf/S78f7b15f2edd4306993e6e410d145213D.jpg_220x220q75.jpg_.avif","Personalized Bridal Robe Set | Unique Wedding Morning Gift","Make your special day even more memorable with this personalized robe set. Ideal for bridal party photos and a beautiful keepsake from your wedding morning. #BridalRobe #WeddingGift #PersonalizedGifts #BrideToBe #BridalParty #ad","Robes"
"https://s.click.aliexpress.com/e/_c4UQFNTj","https://ae-pic-a1.aliexpress-media.com/kf/S0beca46d22344f0a84f03c675e14709ev.jpg_220x220q75.jpg_.avif","Personalized-Bridal-Satin-Robe | Bespoke Matrimonial Silk","Tailored for the most significant morning of your life. This customizable satin robe offers a crisp, tailored fit and high-shine finish, serving as a permanent keepsake of bridal elegance. #BridalRobe #CustomSatin #WeddingMorning #ad","Robes"
"https://s.click.aliexpress.com/e/_c3cYqmQN","https://ae-pic-a1.aliexpress-media.com/kf/S26770f65ed4f4c80a5efb020b7cb22ff7.jpg_480x480q75.jpg_.avif","Plush-Hooded-Bow-Loungewear | Playful Feminine Volume","Featuring a charming bow-detail and a protective hood, this plush piece offers a youthful, high-energy aesthetic without compromising on the supreme warmth of premium fleece. #PlushLoungewear #BowDetail #CozyChic #ad","Robes"
"https://s.click.aliexpress.com/e/_c2wSCNud","https://ae-pic-a1.aliexpress-media.com/kf/S1b7d66889aaf4457a05bf47383f54f08E.jpg_480x480q75.jpg_.avif","Red-Golden-Floral-Kimono | Imperial Crimson Garden","A breathtaking display of imperial red and gilded floral motifs. This kimono-style robe radiates an aura of high-heritage luxury and artisanal storytelling, perfect for a powerful morning presence. #RedKimono #GoldFloral #ImperialLuxe #ad","Robes"
"https://s.click.aliexpress.com/e/_c4nntmCv","https://ae-pic-a1.aliexpress-media.com/kf/Sefb0f65c66604942af0c3ec087074b3fd.jpg_480x480q75.jpg_.avif","Satin Feather Pillar | The Radiant Noir Shield","Integrating light-refracting satin with delicate feather detailing to create multi-dimensional architectural depth. This piece offers a presence-filled silhouette and an aura of Quiet Luxury, radiating unstudied high-fashion authority and unyielding professional-grade elegance.  #SatinRobe #FeatherPillar #RadiantShield #ad","Robes"
"https://s.click.aliexpress.com/e/_c4MIAFGH","https://ae-pic-a1.aliexpress-media.com/kf/S97e0076e27794baab51cfa7f821b9939Z.jpg_480x480q75.jpg_.avif","Satin-Lace-Nightgown-Robe-Set | The Unified Boudoir Ensemble","A pre-curated set featuring a fluid nightgown and a coordinated robe. This duo offers a seamless, high-shine aesthetic that provides a look of complete, statuesque evening polish. #RobeSet #SatinNightgown #CoordinatedLuxe #ad","Robes"
"https://s.click.aliexpress.com/e/_c2yYcVVR","https://ae-pic-a1.aliexpress-media.com/kf/Ha4a9d7f280914497ba6dbd2994ca4cf8h.jpg_220x220q75.jpg_.avif","Silky Lace Robe Set | Sophisticated Lingerie Layering","Feel feminine and refined in this silky robe set. The intricate lace trim and lightweight fabric create a sophisticated look for a romantic evening or slow weekend morning. #SilkyRobe #LaceLingerie #SoftAesthetic #LoungewearChic #ad","Robes"
"https://s.click.aliexpress.com/e/_c3AZCEDb","https://ae-pic-a1.aliexpress-media.com/kf/S547dd7523f224a00b6572c8fb6ab36bci.jpg_480x480q75.jpg_.avif","Silky-Lace-Maxi-Robe-Set | Maxi-Length Ethereal Silk","Elongating the frame with a floor-sweeping maxi cut. This silky set utilizes delicate lace to frame the silhouette, offering a look of high-end romantic allure and unstudied grace. #MaxiRobe #SilkyLace #StatuesqueLounge #ad","Robes"
"https://s.click.aliexpress.com/e/_c3JKTlyd","https://ae-pic-a1.aliexpress-media.com/kf/Sfe07e81d1eec412189020e88f879dc8ds.jpg_220x220q75.jpg_.avif","Soft Textured Wrap Robe | Minimalist Spa-Style Housecoat","Bring the spa experience home with this textured wrap robe. The soft, breathable fabric and adjustable belt provide a flattering fit and maximum relaxation. #SpaRobe #TexturedKnit #MinimalistHome #SelfCareDaily #Bathrobe #ad","Robes"
"https://s.click.aliexpress.com/e/_c3PadeCD","https://ae-pic-a1.aliexpress-media.com/kf/Sbf8929cd3f0c487780dd86e155e89f7bO.png_480x480.png_.avif","Soft-Hooded-Fleece-Robe | The Obsidian Thermal Sanctuary","A sleek, noir-inspired take on the classic fleece robe. The integrated hood and deep-pile fabric provide a protective, statuesque envelope of warmth for the modern minimalist home. #BlackFleeceRobe #MinimalistLounge #ThermalStyle #ad","Robes"
"https://s.click.aliexpress.com/e/_c45Ik4K9","https://ae-pic-a1.aliexpress-media.com/kf/Sfae75ab05302483ebb2e2a2be9a48d7cx.jpg_480x480q75.jpg_.avif","Soft-Lemon-Print-Robe | Zesty Mediterranean Morning","Infuse your routine with high-energy citrus motifs. This soft-touch robe features a vibrant lemon print, radiating a look of fresh, Mediterranean-inspired charm and whimsical boutique luxury. #LemonPrint #VibrantLounge #SummerHomeStyle #ad","Robes"
"https://s.click.aliexpress.com/e/_c3jBvryz","https://ae-pic-a1.aliexpress-media.com/kf/S48d3ee43cc174cbba13a5b8afc198a11u.jpg_220x220q75.jpg_.avif","Soft-Pink-Hooded-Robe | Petal-Tone Plush Warmth","In a serene petal pink, this hooded robe offers a soft, inviting aesthetic. The premium fleece construction ensures a high-density warmth while maintaining a gentle, feminine silhouette. #PinkRobe #HoodedPlush #SoftStyle #ad","Robes"
"https://s.click.aliexpress.com/e/_c2J8n5pn","https://ae-pic-a1.aliexpress-media.com/kf/Sbd7e0ba654ff46f38483e08236584a383.jpg_220x220q75.jpg_.avif","Soft-Tie-Waist-Cotton-Robe | Organic Cotton Purity","The pinnacle of breathable comfort. This cotton robe features a classic tie-waist and a structured fit, offering a look of Quiet Luxury and unstudied, high-end hotel elegance. #CottonRobe #NaturalLuxe #HotelStyle #ad","Robes"
"https://s.click.aliexpress.com/e/_c4nodFVn","https://ae-pic-a1.aliexpress-media.com/kf/Sf6bcd559ec4e40579a70b6a711ee16edS.jpg_480x480q75.jpg_.avif","Velvet-Lace-Robe-Set | The Royal Velvet Curation","A heavy-weight velvet set framed by exquisite lace. This ensemble offers a rich, tactile depth and a statuesque profile, making it the definitive choice for cold-weather evening glamour. #VelvetSet #LaceTrim #HighEndLounge #ad","Robes"
"https://s.click.aliexpress.com/e/_c4KEEkxP","https://ae-pic-a1.aliexpress-media.com/kf/S1bebb8b90a6f4b52bd97bd7c68960f50T.jpg_220x220q75.jpg_.avif","Waffle-Weave-Piped-Bathrobe | Sculpted Spa Authority","Utilizing high-definition waffle-weave technology for maximum absorbency and texture. The contrasting piping adds a professional, tailored edge, radiating an aura of elite spa-level luxury. #WaffleRobe #SpaLuxe #TailoredLounge #ad","Robes"
"https://s.click.aliexpress.com/e/_c34feIxX","https://ae-pic-a1.aliexpress-media.com/kf/S77f26018a52449db875d6b9eb9a28a614.jpg_480x480q75.jpg_.avif","White-Feather-Trim-Robe | Starlight Couture Boudoir","A breathtaking statement in evening luxury. This white robe features dramatic feather-trim sleeves, creating a voluminous, statuesque silhouette that captures the essence of red-carpet-ready loungewear. #FeatherRobe #CoutureLounge #WhiteLuxury #ad","Robes"
"https://s.click.aliexpress.com/e/_c3KJ2JZd","https://ae-pic-a1.aliexpress-media.com/kf/S34249cbc511940c1a32625098224b39bk.jpg_480x480q75.jpg_.avif","Women-S-Geometric-Lounge-Robe | Modernist Linear Rhythm","A bold exploration of shape and form. This robe features a high-contrast geometric print, offering a sharp, modernistic aesthetic for the woman who values architectural design in every detail. #GeometricRobe #ModernistLounge #GraphicStyle #ad","Robes"
"https://s.click.aliexpress.com/e/_c3nTBljb","https://ae-pic-a1.aliexpress-media.com/kf/Sad42515b6e184859b517931e5bafb7c9t.jpg_480x480q75.jpg_.avif","Women-S-Plush-Purple-Robe | Royal Amethyst Plush","In a deep, regal purple, this plush robe offers a look of unyielding authority and warmth. The rich color story and voluminous fit make it a cornerstone of a powerful private wardrobe. #PurpleRobe #RoyalLounge #PlushLuxury #ad","Robes"
"https://s.click.aliexpress.com/e/_c3vTJCxX","https://ae-pic-a1.aliexpress-media.com/kf/Sb9347e6b0937459dbe308e09d4428579B.jpg_220x220q75.jpg_.avif","Women-S-Quilted-Button-Robe | Architectural Padded Armor","Redefining the robe with structural quilting and a functional button-front. This piece offers a tailored, protective silhouette that bridges the gap between loungewear and high-end outdoor duster coats. #QuiltedRobe #TailoredLounge #ModernOuterwear #ad","Robes"
"https://s.click.aliexpress.com/e/_c3bTq2g1","https://ae-pic-a1.aliexpress-media.com/kf/S78ed73957753499e864816b68e405d1bE.jpg_220x220q75.jpg_.avif","Women-S-Satin-Lace-Robe | The Definitive Silky Wrap","A pure expression of satin-and-lace elegance. This robe offers a flawless, high-shine finish and delicate detailing, creating a statuesque and timeless aesthetic for the modern romantic. #SatinRobe #LaceDetail #ClassicBoudoir #ad","Robes"