Affiliate URL,Image URL,Name,Description,Category
"https://s.click.aliexpress.com/e/_c3eWTvOJ","https://raw.githubusercontent.com/avivaknin/PinterestImages/main/pinterst1/Skirts/3/pose_power_stance_bg-library.png","Authoritative Power Stance Designer Skirt | Bold Intellectual Presence and Structured Library Style","Command attention with this striking designer skirt, designed for an authoritative silhouette amidst the timeless surroundings of a grand library. The high-quality fabric and structured design offer a perfect blend of professional durability and high-end fashion for any important engagement. Featuring meticulous stitching and a modern fit, it’s an essential piece for those who want to radiate confidence and intellectual strength. This skirt provides a polished and powerful look that stands out, making it the ultimate choice for achieving a perfectly put-together presence. #PowerStance #ProfessionalStyle #ad","Skirts"
"https://s.click.aliexpress.com/e/_c4TxGYmj","https://ae-pic-a1.aliexpress-media.com/kf/Sfe81922ec74842d0a5d51df6f971f042W.jpg_480x480q75.jpg_.avif","Black Ruffled Column | The Noir Geometric Vault","Utilizing rhythmic ruffled geometry to create multi-dimensional architectural depth and a statuesque profile. This skirt radiates an aura of Quiet Luxury and unyielding high-fashion authority, serving as a definitive noir anchor for the metropolitan wardrobe. #RuffledSkirt #NoirVault #GeometricArchitecture #ad","Skirts"
"https://s.click.aliexpress.com/e/_c3Ya24uJ","https://ae-pic-a1.aliexpress-media.com/kf/S98037df0003e45989fc85eb088798e33L.jpg_220x220q75.jpg_.avif","Black-Studded Pleated Mini | Kinetic Gothic Architecture","A high-octane fusion of sharp pleating and industrial metallic hardware. This skirt features high-density studs that trace the rhythmic movement of each fold, creating a statuesque and powerful silhouette. It radiates a look of unyielding urban authority and avant-garde boutique edge. #StuddedSkirt #PleatedMini #GothicLuxe #ad","Skirts"
"https://s.click.aliexpress.com/e/_c3eWTvOJ","https://raw.githubusercontent.com/avivaknin/PinterestImages/main/pinterst1/Skirts/3/pose_3_4_view_bg-loft.png","Bold Red Box | Designer Banquet Handbag","Achieve a look of modern glamour with this stunning bold red box clutch for prestigious social celebrations. The sleek designer silhouette and rich color create a dazzling presence that will make you the center of attention. Crafted with premium materials to ensure a secure finish and a luxurious feel throughout the gala event. This bag is a must have for any woman seeking a blend of elegance and modern fashion. #redclutch #boxbag #banquethandbag #formalwear #fashion #style #elegant #partybag","Skirts"
"https://s.click.aliexpress.com/e/_c4tbdZKn","https://ae-pic-a1.aliexpress-media.com/kf/Sefe068fe91244921ab093773d436aae8W.jpg_480x480q75.jpg_.avif","Brown-Satin Lace Midi | Espresso Textural Contrast","A masterclass in sophisticated material interplay. This midi skirt combines the liquid-like sheen of espresso-toned satin with an intricate lace hem, providing a statuesque verticality. The rich, deep palette radiates an aura of Quiet Luxury and unstudied high-society grace. #SatinMidi #LaceDetail #EspressoChic #ad","Skirts"
"https://s.click.aliexpress.com/e/_c3YhpJlV","https://raw.githubusercontent.com/avivaknin/PinterestImages/main/pinterst1/Skirts/7/pose_quick_spin_bg-spaceship-deck.png","Chic Fall Outfit: Cozy Cream Sweater, Brown Lace Satin Skirt & Western Boots","Skirts Embrace the autumn season with this effortlessly chic outfit! Featuring a cozy cream knit sweater paired with an elegant brown satin midi skirt, beautifully accented with a delicate lace trim. Complete the look with stylish brown suede cowboy boots and a matching handbag for a perfect fall ensemble. #FallFashion #AutumnStyle #CozySweater #SatinSkirt #LaceSkirt #CowboyBoots #affiliatelink
","Skirts"
"https://s.click.aliexpress.com/e/_c4pPLQf5","https://ae-pic-a1.aliexpress-media.com/kf/Sa4f9f4f5378c4c5b9c504399c4f28e27T.jpg_480x480q75.jpg_.avif","Chic-Satin Slip Skirt | The Liquid Minimalist Column","Defined by its flawless, bias-cut drape that skims the silhouette with surgical precision. This satin slip skirt offers a continuous, statuesque line that captures the light with every movement, serving as the definitive foundation for an elite, high-energy minimalist wardrobe. #SatinSlipSkirt #MinimalistLuxe #LiquidSilk #ad","Skirts"
"https://s.click.aliexpress.com/e/_c3F9M7sL","https://ae-pic-a1.aliexpress-media.com/kf/Sec72599d90d2424b8a9a5142a1ca3511r.jpg_480x480q75.jpg_.avif","Crinkle-Blue Maxi Skirt | Azure Textural Waves","Utilizing high-definition crinkle-fabric technology to add multi-dimensional depth. In a vibrant azure blue, this maxi skirt provides a voluminous, statuesque profile that radiates an aura of nomadic luxury and effortless coastal sophistication. #MaxiSkirt #CrinkleFabric #AzureStyle #ad","Skirts"
"https://s.click.aliexpress.com/e/_c3vZwbCF","https://ae-pic-a1.aliexpress-media.com/kf/S2abfe5b40747491fabd503003efe7cb0q.jpg_480x480q75.jpg_.avif","Cropped Blazer Set | The Sovereign Tailored Monolith","A masterclass in coordinated geometry, featuring a statuesque cropped blazer anchor paired with a structural skirt. This set radiates an aura of professional-grade competence and unyielding heritage luxury, framing the movement with surgical-grade precision. #BlazerSet #TailoredMonolith #SovereignStyle #ad","Skirts"
"https://s.click.aliexpress.com/e/_c3feJxcx","https://ae-pic-a1.aliexpress-media.com/kf/Sfb8c6b56544c496ca96094e8b040cd70t.jpg_220x220q75.jpg_.avif","Dark-Floral Maxi Skirt | Noir Botanical Majesty","A breathtaking display of moody, high-fidelity florals set against a deep obsidian background. This floor-sweeping maxi offers a dramatic, statuesque presence, combining romantic botanical artistry with a powerful, unyielding evening aesthetic. #FloralMaxi #NoirBotanical #StatuesqueDrape #ad","Skirts"
"https://s.click.aliexpress.com/e/_c3YhpJlV","https://raw.githubusercontent.com/avivaknin/PinterestImages/main/pinterst1/Skirts/7/pose_stolen_glance_shoulder_bg-sunset-cliffs.png","Dramatic Sunset Cliffside Statement Skirt ǀ Sophisticated Over-the-Shoulder Grace and Coastal Luxury","Capture a moment of pure cinematic elegance with this dramatic statement skirt, showcased in a sophisticated over-the-shoulder pose against a vibrant sunset cliffside. The flowing silhouette and premium fabric catch the golden hour light beautifully, creating a breathtaking look that is perfect for high-end coastal events or exclusive evening soirées. Featuring meticulous tailoring and a refined finish, this skirt provides a polished and trendy aesthetic that radiates confidence and timeless high-fashion charm. It represents a beautiful harmony of natural wonder and elite designer craftsmanship, making it an essential masterpiece for the modern style visionary. Elevate your seasonal wardrobe with a piece that perfectly balances romantic allure with a powerful and authoritative fashion presence. #SunsetSkirt #CoastalCouture #ad","Skirts"
"https://s.click.aliexpress.com/e/_c3CsrnV9","https://ae-pic-a1.aliexpress-media.com/kf/S80a1396846374408a3c94d5d7d795126S.jpg_480x480q75.jpg_.avif","Elegant-Lace Slip Skirt | Intricate Boudoir Precision","Merging the provocative allure of sheer lace with the structured elegance of a slip silhouette. This skirt features high-contrast lace panels that frame the legs with architectural grace, offering a look of sophisticated intimacy and high-end boutique polish. #LaceSkirt #SlipStyle #BoutiqueElegance #ad","Skirts"
"https://s.click.aliexpress.com/e/_c3nM2u3N","https://ae-pic-a1.aliexpress-media.com/kf/Sd0fadbc7e07c4da8ab84bd4464222a5di.jpg_220x220q75.jpg_.avif","Elegant-Pleated Midi | Rhythmic Linear Sophistication","Featuring precision-engineered sunray pleats that create a sense of constant, structured motion. This midi skirt provides a statuesque vertical profile and a professional-grade finish, radiating a look of intellectual authority and unstudied grace. #PleatedMidi #LinearStyle #ClassicElegance #ad","Skirts"
"https://s.click.aliexpress.com/e/_c4r2IKNZ","https://ae-pic-a1.aliexpress-media.com/kf/Sa1a0f8b015564aa89a2b27f44d81e116c.jpg_480x480q75.jpg_.avif","Elegant-Red Satin Midi | Crimson High-Lustre Power","Saturated in a vibrant, commanding red, this satin midi skirt is designed for maximum visual impact. The high-shine fabric and fluid drape create a statuesque silhouette that radiates unapologetic confidence and high-society evening glamour. #RedSatin #CrimsonStyle #PowerDressing #ad","Skirts"
"https://s.click.aliexpress.com/e/_c3mr2yd1","https://ae-pic-a1.aliexpress-media.com/kf/Se34060f9d6ff45fc8844f4d1d4f898eao.jpg_.webp","Elegant-Satin Midi Skirt | The Sovereign Silk Silhouette","A quintessential staple of the luxury collection. This satin midi focuses on a flawless, bias-cut construction that offers a liquid-like drape and a statuesque profile. It serves as a masterclass in understated elegance and unyielding professional polish. #SatinMidi #QuietLuxury #ExecutiveStyle #ad","Skirts"
"https://s.click.aliexpress.com/e/_c3m2TnJp","https://ae-pic-a1.aliexpress-media.com/kf/Sdd31cfdcfad94438a849dfed3ac403e5I.jpg_220x220q75.jpg_.avif","Elegant-Satin Midi Skirt | The Sovereign Silk Silhouette","A quintessential staple of the luxury collection. This satin midi focuses on a flawless, bias-cut construction that offers a liquid-like drape and a statuesque profile. It serves as a masterclass in understated elegance and unyielding professional polish. #SatinMidi #QuietLuxury #ExecutiveStyle #ad","Skirts"
"https://s.click.aliexpress.com/e/_c3rXhwgr","https://ae-pic-a1.aliexpress-media.com/kf/S8a17efc8480c4507886552b33dfdd737E.jpg_480x480q75.jpg_.avif","Elegant-White Satin Set | Pristine Monochromatic Column","(Note: Skirt Set). A unified, high-lustre ensemble in a snow-white palette. The coordinated skirt provides a seamless, statuesque line that elongates the frame, creating a look of high-end resort elegance and uncompromised purity. #WhiteSatin #SkirtSet #ResortLuxe #ad","Skirts"
"https://s.click.aliexpress.com/e/_c3eWTvOJ","https://raw.githubusercontent.com/avivaknin/PinterestImages/main/pinterest2/Skirts/5/%D7%94%D7%95%D7%A8%D7%93%D7%94%20%283%29.png","Elite Designer Statement Pleated Skirt | Classic Radiant Charm and Sophisticated Modern Detail","This elite designer pleated skirt offers a radiant touch of luxury, perfect for the individual who values classic charm and modern sophistication. Each pleat is crafted to perfection, ensuring a brilliant aesthetic that captures the light and commands attention from every angle. The sophisticated design allows for versatile styling, making it a reliable companion for professional business events or social gatherings alike. Add a layer of timeless elegance to your ensemble with this exquisitely designed and undeniably beautiful fashion statement piece. #PleatedSkirt #LuxuryFashion #ad","Skirts"
"https://s.click.aliexpress.com/e/_c3J2sz1H","https://ae-pic-a1.aliexpress-media.com/kf/S2d94587e3d804167b5405ffcaff82de9C.jpg_220x220q75.jpg_.avif","Floral Wrap Maxi | The Botanical Radiant Column","While a dress profile, this piece utilizes a statuesque wrap architecture and high-saturation floral motifs to create a continuous vertical line. It radiates an aura of unstudied nomadic luxury and unyielding professional-grade glamour for the elite curator. #WrapMaxi #BotanicalColumn #RadiantStyle #ad","Skirts"
"https://s.click.aliexpress.com/e/_c3I2i8yP","https://ae-pic-a1.aliexpress-media.com/kf/Sef001c0c42034a56a0fc3af9ffb0ca95I.jpg_480x480q75.jpg_.avif","Front-Slit Midi Pillar | The Indigo Linear Vault","Precision-engineered with high-integrity denim and a statuesque front-slit architecture to define a sharp, vertical line of power. This skirt radiates an aura of Quiet Luxury and unyielding professional-grade competence, serving as a definitive structural anchor. #DenimSkirt #LinearVault #IndigoArchitecture #ad","Skirts"
"https://s.click.aliexpress.com/e/_c4nlQUpv","https://ae-pic-a1.aliexpress-media.com/kf/Sdaefc368b9314e48bbae71bfd3cb1880u.jpg_480x480q75.jpg_.avif","Grey Pleated Mini Skirt | Classic Preppy Schoolgirl Style","A timeless wardrobe staple! This grey pleated mini skirt offers a sharp, preppy look that pairs perfectly with oversized sweaters or crisp white shirts. #PleatedSkirt #GreySkirt #PreppyStyle #TennisSkirt #SchoolgirlAesthetic #ad","Skirts"
"https://s.click.aliexpress.com/e/_c4S39atD","https://ae-pic-a1.aliexpress-media.com/kf/S31583de238c84af7904cee7c70f9a9f1r.jpg_480x480q75.jpg_.avif","High-Waist Pleated Mini | Structured Academic Edge","A precision-engineered mini skirt featuring high-tension pleats that hold their architectural form during movement. The high-waisted cut provides a statuesque vertical lift, radiating a look of sharp, intellectual authority and unstudied boutique-cool energy. #PleatedMini #AcademicChic #SculptedStyle #ad","Skirts"
"https://s.click.aliexpress.com/e/_c3tZ63Ar","https://ae-pic-a1.aliexpress-media.com/kf/S62e7efcb50f14e61bc1ff5ac6ac5c71eF.jpg_480x480q75.jpg_.avif","Off-Shoulder Ribbed Knit | Tactile Linear Sophistication","(Note: Sweater/Top). Defined by its high-density vertical ribbing and dramatic off-shoulder neckline. This knit piece offers a statuesque and form-flattering silhouette, combining professional-grade warmth with an aura of Quiet Luxury and unyielding polish. #RibbedKnit #OffShoulderStyle #QuietLuxury #ad","Skirts"
"https://s.click.aliexpress.com/e/_c4nBuxER","https://ae-pic-a1.aliexpress-media.com/kf/S1bd57276eff44f45a4aa8bd4173f932ch.jpg_480x480q75.jpg_.avif","Pink Floral Slip Skirt | Romantic Silk-Feel Midi Skirt","Embrace a feminine vibe with this soft pink floral slip skirt. Its delicate floral print and silky texture make it ideal for brunch dates or a romantic evening look. #SlipSkirt #FloralSkirt #MidiSkirt #FeminineStyle #SoftGirlAesthetic #ad","Skirts"
"https://s.click.aliexpress.com/e/_c3eWTvOJ","https://raw.githubusercontent.com/avivaknin/PinterestImages/main/pinterst1/Skirts/3/pose_hands_in_pockets_bg-rooftop.png","Pointed Pearl Heels | Royal Social Style","Achieve a look of absolute sophistication with these stunning pointed pearl pumps designed for high end social celebrations and gala events tonight in the city. The sleek silhouette and refined fabric finish offer a regal and polished appearance for every prestigious gathering and wedding ceremony in style today. Crafted with professional precision to ensure a secure fit and a luxurious feel during your most special social wedding celebrations in the ballroom. This footwear is the perfect choice for combining modern style. #pearlheels #socialstyle #eveningwear #formalwear #luxuryfashion #weddingstyle #fashion #elegant #ad","Skirts"
"https://s.click.aliexpress.com/e/_c33i41UF","https://ae-pic-a1.aliexpress-media.com/kf/S9b35a2320b7348979f7095683d46eebfa.jpg_480x480q75.jpg_.avif","Purple Ruffled Lace Skirt | Elegant Boho-Chic Style","Add a touch of texture to your outfit with this stunning purple lace skirt. Featuring tiered ruffles and intricate lace details, it’s a beautiful choice for special occasions. #LaceSkirt #PurpleFashion #RuffleSkirt #BohoChic #RomanticStyle #ad","Skirts"
"https://s.click.aliexpress.com/e/_c30rJd6f","https://ae-pic-a1.aliexpress-media.com/kf/S157e7d4ad1904e07aaf7565c530d3086M.jpg_480x480q75.jpg_.avif","Python-Print Midi Skirt | Exotic Sinuous Architecture","Featuring a high-definition reptilian motif that adds a layer of provocative texture. This midi skirt offers a sleek, statuesque drapes and a high-shine finish, radiating a look of unapologetic confidence and professional-grade urban authority. #PythonPrint #ExoticMidi #StatementStyle #ad","Skirts"
"https://s.click.aliexpress.com/e/_c3Qrmh55","https://raw.githubusercontent.com/avivaknin/PinterestImages/main/pinterst1/Skirts/5/pose_quick_spin_bg-sunset-cliffs.png","Radiant Sunset Motion Flow Skirt | High-Energy Spin Design and Dramatic Coastal Look","Capture the breathtaking beauty of the golden hour with this radiant motion skirt, featuring a dramatic spin design against the backdrop of sunset cliffs. The lightweight, flowing fabric moves beautifully with every turn, creating a stunning visual impact that is perfect for high-end coastal events or evening celebrations. Its vibrant energy and modern silhouette reflect a passion for innovation and high-quality craftsmanship in contemporary fashion. Elevate your presence with this bold and beautiful piece that perfectly captures the essence of freedom, grace, and luxury. #SunsetStyle #MotionFashion #ad","Skirts"
"https://s.click.aliexpress.com/e/_c3eWTvOJ","https://raw.githubusercontent.com/avivaknin/PinterestImages/main/pinterest2/Skirts/5/description_imageS2c7451aec4f6453ab581d7b392f1e809r.png","Refined Minimalist Luxury Pencil Skirt | Sleek Professional Silhouette and Premium Textile Finish","Discover the ultimate blend of professional authority and modern style with this refined minimalist luxury skirt, perfect for the office or evening soirées. The sleek lines and polished finish create a sophisticated look that is both understated and incredibly impactful for any fashion-forward wearer. Crafted from high-quality textiles, it ensures a luxurious feel and a silhouette that remains sharp and elegant throughout your busiest days. This skirt is a stunning representation of elite craftsmanship, prioritizing both aesthetic appeal and superior comfort in every stitch. #PencilSkirt #MinimalistLuxury #ad","Skirts"
"https://s.click.aliexpress.com/e/_c2xMw34j","https://ae-pic-a1.aliexpress-media.com/kf/S30ff4862162e42c5a0a292b0b4b4b1c1E.jpg_480x480q75.jpg_.avif","Ruffled Denim Mini Skort | Trendy Denim Skirt with Shorts","Get the best of both worlds with this stylish denim mini skort. The playful ruffled hem adds a feminine touch, while the built-in shorts ensure comfort and movement. #DenimSkort #RuffleDenim #SummerOutfits #MiniSkirt #CasualStyle #ad","Skirts"
"https://s.click.aliexpress.com/e/_c3EO3r3Z","https://ae-pic-a1.aliexpress-media.com/kf/S7597c16725074c05a29f4f684eeb042fj.jpg_480x480q75.jpg_.avif","Ruffled Heart Apex | The Obsidian Kinetic Shield","Featuring a high-authority heart-motif anchor and statuesque ruffled geometry for multi-dimensional material depth. This mini skirt radiates an aura of elite-level boutique energy and unyielding modernistic innovation, framing the silhouette with radiant intent. #MiniSkirt #KineticShield #ObsidianArchitecture #ad","Skirts"
"https://s.click.aliexpress.com/e/_c303j4wj","https://ae-pic-a1.aliexpress-media.com/kf/S3ed5677cb6284367b41cc3461d31cc58Z.jpg_220x220q75.jpg_.avif","Ruffled-Asymmetrical Midi | Kinetic Avant-Garde Drape","A masterclass in asymmetrical engineering. This skirt features cascading ruffles that trace a diagonal path, creating a statuesque and dynamic silhouette that captures the essence of modernistic movement and high-fashion boutique charm. #AsymmetricSkirt #RuffledMidi #ModernistStyle #ad","Skirts"
"https://s.click.aliexpress.com/e/_c2RurWoB","https://ae-pic-a1.aliexpress-media.com/kf/Sab6b8049ce894c98ac3dcfb0918a4352k.jpg_220x220q75.jpg_.avif","Ruffled-Heart Pinafore | Graphic Romantic Volume","(Note: Dress/Skirt Hybrid). A whimsical yet high-end ensemble featuring structured heart-shaped detailing and voluminous ruffles. This piece provides a statuesque and playful profile, radiating a look of curated boutique energy and editorial femininity. #PinaforeDress #RuffledStyle #GraphicFashion #ad","Skirts"
"https://s.click.aliexpress.com/e/_c35tcqCn","https://ae-pic-a1.aliexpress-media.com/kf/Sdf6810bd1e25497c9811c3c50034ec4ez.jpg_480x480q75.jpg_.avif","Ruffled-Tiered Denim Mini | Industrial Ruffle Fusion","Redefining classic denim with rhythmic, tiered ruffles. This mini skirt offers a voluminous, statuesque profile while maintaining the rugged integrity of high-gauge denim, creating a look of high-energy urban charm and unstudied grace. #DenimMini #TieredSkirt #UrbanLuxe #ad","Skirts"
"https://s.click.aliexpress.com/e/_c4TmTUgn","https://ae-pic-a1.aliexpress-media.com/kf/Sa31b0c367eac497192afa8af4fff11ccb.jpg_480x480q75.jpg_.avif","Satin-Lace Slip Skirt | The Noir Boudoir Column","Merging the liquid-like sheen of premium satin with delicate, high-definition lace trims. This slip skirt provides a continuous, statuesque line that skims the silhouette, radiating an aura of sophisticated intimacy and unyielding high-society polish. #SatinLace #SlipSkirt #EveningElegance #ad","Skirts"
"https://s.click.aliexpress.com/e/_c4SgfcJz","https://ae-pic-a1.aliexpress-media.com/kf/Sb94cf9909e234b12b10c641c72ada95eI.jpg_480x480q75.jpg_.avif","Snakeskin Midi Skirt with Chain Detail | Bold Animal Print","Make a fierce fashion statement with this snakeskin print midi skirt. The edgy chain detail adds a modern touch to the classic animal print silhouette. #SnakeskinPrint #MidiSkirt #AnimalPrint #EdgyFashion #StreetStyle #ad","Skirts"
"https://s.click.aliexpress.com/e/_c3Qrmh55","https://raw.githubusercontent.com/avivaknin/PinterestImages/main/pinterst1/Skirts/5/pose_3_4_view_bg-library.png","Sophisticated Intellectual Designer Skirt | Elegant Library Aesthetic and Tailored 3/4 View","Embrace a refined and intellectual look with this sophisticated designer skirt, perfectly captured in a classic three-quarter view within a grand library setting. The premium fabric and meticulous tailoring provide a high-end feel and a flattering silhouette, making it an ideal choice for professional or academic environments. Its timeless design radiates a sense of luxury and calm, offering a polished aesthetic that is both contemporary and elegantly chic for any occasion. This skirt is a versatile masterpiece designed for the sophisticated individual who appreciates high-quality craftsmanship and a sleek, intelligent presence. #LibraryAesthetic #DesignerSkirt #ad","Skirts"
"https://s.click.aliexpress.com/e/_c3eWTvOJ","https://raw.githubusercontent.com/avivaknin/PinterestImages/main/pinterst1/Skirts/3/pose_hands_in_pockets_bg-library.png","Stylish Pleated Midi Skirt and Classic White Tee for Effortless Grace","Skirts Embrace timeless elegance with this effortlessly chic ensemble featuring a classic white scoop-neck top and a flowy pleated midi skirt. Perfect for a sophisticated yet comfortable look, whether you're exploring nature or enjoying a casual day out. Complete the outfit with delicate ballet flats for a touch of grace. #PleatedSkirtStyle #MidiSkirtFashion #ChicOutfit #WhiteTop #SpringFashion #ElegantStyle #affiliatelink","Skirts"
"https://s.click.aliexpress.com/e/_c2RipzDl","https://ae-pic-a1.aliexpress-media.com/kf/Sca85bb63c6224818a35774272325b2b9j.jpg_480x480q75.jpg_.avif","White-Lace Slit Maxi | Ethereal Architectural Veil","Featuring intricate, all-over lace craftsmanship and a dramatic thigh-high slit. This white maxi skirt offers a statuesque and airy silhouette, providing a look of high-end coastal luxury and uncompromised, serene femininity. #WhiteLaceMaxi #SlitSkirt #ResortLuxe #ad","Skirts"
"https://s.click.aliexpress.com/e/_c3tprzLh","https://ae-pic-a1.aliexpress-media.com/kf/S0e02b37aa1e6433e8ae44c5dcc2aa8c78.jpg_480x480q75.jpg_.avif","White-Satin Lace Mini | Pristine Luminous Texture","Saturated in a brilliant snow-white palette, this mini skirt combines high-lustre satin with precision lace detailing. The result is a statuesque and high-energy silhouette that serves as a powerful centerpiece for any luxury spring curation. #WhiteSatin #LaceMini #LuminousStyle #ad","Skirts"
"https://s.click.aliexpress.com/e/_c4kxnBoj","https://ae-pic-a1.aliexpress-media.com/kf/S62021da377e548da876ed91b3adb6b18l.jpg_480x480q75.jpg_.avif","Women-S-Black Skort | The Tactical Performance Hybrid","Combining the feminine fluidity of a skirt with the industrial-grade support of integrated shorts. This black skort offers a statuesque and polished profile, radiating a look of high-energy competence and unyielding professional authority. #BlackSkort #ActiveLuxe #HybridFashion #ad","Skirts"