Affiliate URL,Image URL,Name,Description,Category
"https://s.click.aliexpress.com/e/_c3jTEcPb","https://ae-pic-a1.aliexpress-media.com/kf/S1f576edca6f14ae3990365d5e22840351.jpg_480x480q75.jpg_.avif","Azure Linen Apex | The Luminous Structural Anchor","A study in organic architecture, featuring statuesque linen geometry and high-velocity azure anchors. This set radiates an aura of modernistic serenity and unyielding professional-grade resilience for the visionary specialist. #LinenSet #StructuralAnchor #LuminousStyle #ad","Suits"
"https://s.click.aliexpress.com/e/_c3xNAC1J","https://ae-pic-a1.aliexpress-media.com/kf/Sade0cfa40aa54e468da27feb344c9455n.jpg_480x480q75.jpg_.avif","Blue Floral Cutout Set | Vibrant Botanical Luxury","Celebrate summer in style. This vibrant set combines an artistic cutout top with matching trousers, featuring a lush floral print that’s perfect for luxury vacations. #FloralSet #CutoutFashion #SummerLuxury #ad","Suits"
"https://s.click.aliexpress.com/e/_c3JRlC9X","https://ae-pic-a1.aliexpress-media.com/kf/S32bee4af2a54428eaf7e5a8c086ff0d5V.jpg_480x480q75.jpg_.avif","Blue Linen Shirt & Shorts Set | Effortless Coastal Breeziness","The ultimate weekend uniform. Crafted from premium breathable linen, this coordinated set offers a relaxed coastal aesthetic that keeps you cool and stylish. #LinenSet #CoastalStyle #EffortlessChic #ad","Suits"
"https://s.click.aliexpress.com/e/_c2vIR3pT","https://ae-pic-a1.aliexpress-media.com/kf/S63f9dfa6d2444fdf9b20c4a1c42b25a1W.jpg_220x220q75.jpg_.avif","Brown Knit Cardigan & Skirt Set | Cozy Autumn Texture","Experience the warmth of high-end knitwear. This coordinated set features a soft cardigan and matching skirt, offering a rich chocolate hue perfect for autumn. #KnitSet #AutumnFashion #CozyChic #ad","Suits"
"https://s.click.aliexpress.com/e/_c3WMr4HX","https://ae-pic-a1.aliexpress-media.com/kf/S09882d72669749318c42010ae3400080D.jpg_480x480q75.jpg_.avif","Brown Wide-Leg Sweat Set | Premium Loungewear Glamour","Redefine your downtime. This deluxe sweat set features trendy wide-leg trousers and a matching top, providing the ultimate blend of comfort and street-style sophistication. #WideLegSet #LuxuryLoungewear #StreetStyle #ad","Suits"
"https://s.click.aliexpress.com/e/_c4d4vWyP","https://ae-pic-a1.aliexpress-media.com/kf/Sc063a50d31894bff885e1f1bf43710e9r.jpg_480x480q75.jpg_.avif","Chic Plaid Shorts Suit Set | Modern Preppy Sophistication","A fresh take on tailoring. This plaid set pairs a structured blazer with matching shorts, offering a playful yet polished preppy-chic aesthetic. #ShortsSuit #PlaidStyle #PreppyChic #ad","Suits"
"https://s.click.aliexpress.com/e/_c4Ny0lXn","https://ae-pic-a1.aliexpress-media.com/kf/Sc55c38f73b9f413ca71efcd66fbe4af9C.jpg_480x480q75.jpg_.avif","Chic Ribbed Knit Skirt Set | Timeless Feminine Texture","Celebrate classic textures with this elegant ribbed knit set. The flattering fit and high-quality weave create a polished, feminine look for any occasion. #KnitSkirtSet #RibbedStyle #ClassicChic #ad","Suits"
"https://s.click.aliexpress.com/e/_c3lF624H","https://ae-pic-a1.aliexpress-media.com/kf/S881996323180473b90efa58a89377120i.jpg_220x220q75.jpg_.avif","Chic Satin Loungewear Set | High-Shine Relaxation","Indulge in the luxury of staying in. This lustrous satin set offers a silky-smooth feel, bringing a touch of boudoir-inspired glamour to your relaxation. #SatinLounge #LuxuryNightwear #GlowStyle #ad","Suits"
"https://s.click.aliexpress.com/e/_c3nidZXZ","https://ae-pic-a1.aliexpress-media.com/kf/S5206ce08220b4769953f7c1be89a049df.png_480x480.png_.avif","Classic Pinstripe Suit Set | Executive Power Tailoring","Command the room. This sophisticated pinstripe set offers a sharp, tailored silhouette that reimagines classic executive wear for the modern woman. #PinstripeSuit #PowerDressing #ExecutiveStyle #ad","Suits"
"https://s.click.aliexpress.com/e/_c3JAqqMV","https://ae-pic-a1.aliexpress-media.com/kf/Sffaf6603a9c444e1b774e71dead7b26eL.jpg_480x480q75.jpg_.avif","Cozy Knit Turtleneck Set | Ultimate Winter Warmth","Wrap yourself in comfort. This premium turtleneck knit set provides thick insulation and a soft, relaxed fit for the coldest months of the year. #TurtleneckSet #WinterCozy #KnitwearFashion #ad","Suits"
"https://s.click.aliexpress.com/e/_c39vxmgV","https://ae-pic-a1.aliexpress-media.com/kf/S38848e4398c141edbf825c1841c70b45h.jpg_480x480q75.jpg_.avif","Crisp White Vest & Shorts Set | Minimalist Summer Chic","Pure, clean, and undeniably chic. This structured white vest and shorts set offers a luxe minimalist aesthetic perfect for elevated summer city days. #WhiteVestSet #MinimalistStyle #SummerChic #ad","Suits"
"https://s.click.aliexpress.com/e/_c4KOX2u5","https://ae-pic-a1.aliexpress-media.com/kf/S123a12e6629d4597971b3dfa3b737331H.jpg_480x480q75.jpg_.avif","Diamond Buckle Pumps | Luxury Social Style","Make a regal entrance with these magnificent diamond buckle pumps featuring a unique artistic silhouette and glamorous details for gala nights tonight. The sparkling finish and modern design create a show stopping presence that will make you the center of attention today. Crafted from premium materials to ensure a secure fit and a luxurious feel during your most prestigious gala wedding night celebrations. This luxury garment represents high fashion for the elite stylish guest. #diamondpumps #luxurystyle #glamourwear #weddingstyle #luxuryfashion #formalwear #fashion #elegant #ad","Suits"
"https://s.click.aliexpress.com/e/_c4kySLmf","https://raw.githubusercontent.com/avivaknin/PinterestImages/main/pinterst1/Suits/5/pose_garment_interaction_bg-spaceship-deck.png","Dynamic Executive Motion Suit ǀ Majestic Interaction Pose and Refined Professional Polish","This elite suit captures a powerful professional aesthetic, featuring a majestic garment interaction pose that highlights its modern textures and meticulous craftsmanship. The structured silhouette provides a polished profile, ensuring you stay comfortable while radiating a sharp and authoritative fashion presence. #ExecutiveMotion #EliteSuit #ad","Suits"
"https://s.click.aliexpress.com/e/_c38XoVer","https://raw.githubusercontent.com/avivaknin/PinterestImages/main/pinterst1/Women%27s%20suits/5/pose_sitting_floor_looking_up_bg-library.png","Effortless Sage Green Romper: Chic Summer Style for Scenic Outdoor Adventures","Women's suits Step out in comfort and style with this effortlessly chic sage green romper. Featuring charming tie-shoulder straps and practical pockets, it's perfect for your next outdoor adventure or a relaxed summer day. This versatile playsuit combines fashion with functionality for an easygoing look. #SageGreenRomper #SummerStyle #CasualOutfits #OutdoorFashion #Playsuit #WomensFashion #affiliatelink","Suits"
"https://s.click.aliexpress.com/e/_c2zFyaIb","https://raw.githubusercontent.com/avivaknin/PinterestImages/main/pinterst1/Suits/Suits/%D7%94%D7%95%D7%A8%D7%93%D7%94%20%281%29.png","Elegant Beige Pantsuit for Women: Chic Business Casual & Office Wear Outfit","Suits Elevate your professional and everyday style with this sophisticated beige pantsuit. Featuring a relaxed yet polished silhouette, it's perfect for business meetings, smart casual events, or adding a touch of elegance to your daily wardrobe. The versatile two-piece set offers effortless chic. #PantsuitStyle #BusinessFashion #OfficeOutfits #WomensFashion #ElegantWear #NeutralPalette #affiliatelink","Suits"
"https://s.click.aliexpress.com/e/_c3BuCDm9","https://ae-pic-a1.aliexpress-media.com/kf/Sbf574c5c0b324dd29fc0564cad16b51bB.jpg_480x480q75.jpg_.avif","Elegant Burgundy Pant Suit | Deep Crimson Authority","Radiate confidence in rich burgundy. This impeccably tailored suit offers a bold yet sophisticated look, perfect for making a powerful statement. #BurgundySuit #PowerTailoring #ElegantFashion #ad","Suits"
"https://s.click.aliexpress.com/e/_c3g3O2qv","https://ae-pic-a1.aliexpress-media.com/kf/S937ad121a18c49e2a343a282bafec56a1.jpg_480x480q75.jpg_.avif","Elegant Halter Vest & Pant Set | Modern Tailored Radiance","Redefine your formal options. This stunning set features a sophisticated halter vest, offering a fresh and feminine alternative to the traditional blazer. #HalterVest #TailoredSet #ModernBusiness #ad","Suits"
"https://s.click.aliexpress.com/e/_c3MXylFX","https://ae-pic-a1.aliexpress-media.com/kf/Sdcaf5219be8a4e22af40aea65a7b25c5i.jpg_480x480q75.jpg_.avif","Elegant Satin Blazer & Pant Set | Lustrous Power Dressing","Shine with professional grace. This satin blazer set combines a high-shine finish with sharp tailoring, creating a luxurious and commanding look. #SatinBlazer #PowerSet #LuxuryTailoring #ad","Suits"
"https://s.click.aliexpress.com/e/_c4NCRCf7","https://ae-pic-a1.aliexpress-media.com/kf/Sd8d1667c98b944e1a2d19d1e4248d0e6M.jpg_480x480q75.jpg_.avif","Elegant Satin Blazer & Pant Set | Lustrous Power Dressing","Shine with professional grace. This satin blazer set combines a high-shine finish with sharp tailoring, creating a luxurious and commanding look. #SatinBlazer #PowerSet #LuxuryTailoring #ad","Suits"
"https://s.click.aliexpress.com/e/_c4VazLPn","https://ae-pic-a1.aliexpress-media.com/kf/S1931e7c6c1634d6aad96f65cf39084f0K.jpg_480x480q75.jpg_.avif","Elegant Strapless Vest & Pant Set | Sleek Minimalist Power","Embrace a bold, shoulder-baring silhouette. This sophisticated strapless vest set offers a modern twist on tailoring, creating a sleek and powerful look for high-end events. #StraplessSet #ModernTailoring #MinimalistLuxury #ad","Suits"
"https://s.click.aliexpress.com/e/_c2zFyaIb","https://raw.githubusercontent.com/avivaknin/PinterestImages/main/pinterst1/Suits/Suits/%D7%94%D7%95%D7%A8%D7%93%D7%94%20%285%29.png","Elite Signature Executive Suit ǀ Sleek Modern Silhouette and Refined Luxury Polish","This elite signature executive suit defines the pinnacle of modern professional luxury, featuring a sleek silhouette and a refined designer polish. The premium fabric drapes with effortless beauty, providing a comfortable yet structured sensory experience for high-profile business meetings. It represents a beautiful harmony of minimalist design and high-end tailoring, ensuring a sharp and authoritative fashion presence for the modern leader. #ExecutiveSuit #EliteStyle #ad","Suits"
"https://s.click.aliexpress.com/e/_c38XoVer","https://raw.githubusercontent.com/avivaknin/PinterestImages/main/pinterst1/Women%27s%20suits/5/pose_hands_in_pockets_bg-rooftop.png","Elite Signature Women's Power Suit ǀ Sleek Contemporary Cut and Refined Luxury Polish","This elite signature women's power suit defines the pinnacle of modern elegance, featuring a sleek contemporary cut and a refined polish that radiates authority. Crafted from the finest materials, it offers a sharp fashion profile that is ideal for those who appreciate fine artisan craftsmanship and a minimalist aesthetic. #PowerSuit #WomenInFashion #ad","Suits"
"https://s.click.aliexpress.com/e/_c38XoVer","https://raw.githubusercontent.com/avivaknin/PinterestImages/main/pinterst1/Women%27s%20suits/7/pose_sitting_floor_looking_up_bg-luxury-interior.png","Ethereal Studio Sitting Suit ǀ Sophisticated Relaxed Pose and Radiant Professional Glow","Showcase a breathtaking professional look with this ethereal studio suit, featured in a sophisticated sitting pose that perfectly frames its modern lines. The high-quality construction and refined fabric offer a sophisticated aesthetic that is both visually striking and incredibly comfortable for a confident social presence. #StudioSuit #ElegantSitting #ad","Suits"
"https://s.click.aliexpress.com/e/_c4DbEGuH","https://ae-pic-a1.aliexpress-media.com/kf/S2f3ba5c81d954e368e9a156ccd00b93cG.jpg_480x480q75.jpg_.avif","Floral Satin Monolith | The Botanical Kinetic Shield","Integrating statuesque satin-texture geometry with high-fidelity floral anchors. This set radiates an aura of artisanal boutique energy and unyielding heritage-grade luxury, providing a continuous line of radiant intent. #SatinSet #KineticShield #BotanicalArchitecture #ad","Suits"
"https://s.click.aliexpress.com/e/_c3Q3UHkF","https://raw.githubusercontent.com/avivaknin/PinterestImages/main/pinterst1/%D7%90%D7%91%D7%99%D7%96%D7%A8%D7%99%D7%9D/Shoes/1/%D7%94%D7%95%D7%A8%D7%93%D7%94%20%283%29.png","Focus Group Test","Pointed Pearl Heels | Royal Social Pumps","Suits"
"https://s.click.aliexpress.com/e/_c3L5JlJZ","https://ae-pic-a1.aliexpress-media.com/kf/S3806280ade15412aa4c734bef5e42437p.png_480x480.png_.avif","Green Plaid Suit Set | Vibrant Heritage Sophistication","Infuse your wardrobe with color. This stunning green plaid set combines classic heritage patterns with a fresh, modern hue, delivering a sharp and energetic take on professional wear. #GreenPlaid #ModernSuit #VibrantStyle #ad","Suits"
"https://s.click.aliexpress.com/e/_c4DkYp3r","https://ae-pic-a1.aliexpress-media.com/kf/Sc6080eb70e874050812a08308bb79c56h.jpg_480x480q75.jpg_.avif","Innovative Trench-Style Skirt Set | Modern Heritage Design","Inspired by the iconic trench coat. This unique set features a structured, belt-detailed top and matching skirt, offering a bold take on classic heritage fashion. #TrenchStyle #ModernHeritage #CreativeFashion #ad","Suits"
"https://s.click.aliexpress.com/e/_c43xvj9L","https://ae-pic-a1.aliexpress-media.com/kf/Sae83385cc11848faab75bbbe37b6db06p.jpg_480x480q75.jpg_.avif","Leopard Print Two-Piece Set | Bold Animal Instinct Glamour","Unleash your wild side with this fierce leopard print set. The iconic pattern is paired with a modern cut, creating a high-energy look that’s guaranteed to turn heads and spark confidence. #LeopardPrint #BoldFashion #AnimalPrintStyle #ad","Suits"
"https://s.click.aliexpress.com/e/_c4dAhmxL","https://ae-pic-a1.aliexpress-media.com/kf/S9e0f732f72ad459b9bbdeff805ee0927h.jpg_480x480q75.jpg_.avif","Olive Green Vest & Shorts Set | Refined Utility Sophistication","Embrace a sophisticated utility look. This olive green set combines a structured vest with matching shorts, offering a rich, earthy tone and a polished silhouette for summer city days. #OliveGreenSet #UtilityChic #SummerTailoring #ad","Suits"
"https://s.click.aliexpress.com/e/_c42R9qL7","https://ae-pic-a1.aliexpress-media.com/kf/S13062b29ae90438b898ba3800b2aff976.jpg_480x480q75.jpg_.avif","Peplum Choker Monolith | The Radiant Linear Vault","Precision-engineered with high-authority choker geometry and a statuesque peplum framework. This blouse radiates an aura of Quiet Luxury and unyielding professional-grade power, defining a definitive structural anchor. #PeplumBlouse #LinearVault #RadiantArchitecture #ad","Suits"
"https://s.click.aliexpress.com/e/_c4Msv9S9","https://ae-pic-a1.aliexpress-media.com/kf/S750e8149653548778d40debda8351381K.jpg_480x480q75.jpg_.avif","Pink Cityscape Print Set | Artistic Urban Elegance","A wearable work of art. This unique set features a vibrant cityscape print in shades of pink, offering a creative and modern look that celebrates urban energy and feminine style. #PrintSet #UrbanFashion #ArtisticStyle #ad","Suits"
"https://s.click.aliexpress.com/e/_c42lUkOh","https://ae-pic-a1.aliexpress-media.com/kf/S3c47bd07fb614318b19531014d5b4f762.jpg_480x480q75.jpg_.avif","Pinstripe Vest & Wide-Leg Set | Modern Executive Radiance","Redefine office elegance. This chic pinstripe set pairs a tailored vest with voluminous wide-leg trousers, creating a powerful and trendy silhouette for the modern businesswoman. #PinstripeSet #WideLegPants #PowerDressing #ad","Suits"
"https://s.click.aliexpress.com/e/_c3v0LG1p","https://ae-pic-a1.aliexpress-media.com/kf/Sbfcc5d5fc8de42a091db3d19b833c18c9.png_480x480.png_.avif","Power Suit Pillar | The Obsidian Geometric Vault","Defined by extreme statuesque verticality and a high-integrity double-breasted architecture. This suit radiates an aura of unapologetic power and unyielding high-fashion authority, framing the silhouette with surgical precision. #PowerSuit #GeometricVault #ObsidianStyle #ad","Suits"
"https://s.click.aliexpress.com/e/_c2zFyaIb","https://raw.githubusercontent.com/avivaknin/PinterestImages/main/pinterst1/Suits/Suits/%D7%94%D7%95%D7%A8%D7%93%D7%94%20%283%29.png","Premier Artisan Luxury Watch ǀ Sophisticated Precision Craft and Elite Technical Detail","Elevate your style with this premier artisan luxury watch, featuring sophisticated precision craft and elite technical detailing that commands respect. The innovative design and unique structure ensure a durable and high-fashion aesthetic, providing a polished profile that reflects a deep passion for excellence. #LuxuryWatch #ArtisanDetail #ad","Suits"
"https://s.click.aliexpress.com/e/_c3Q3UHkF","https://raw.githubusercontent.com/avivaknin/PinterestImages/main/pinterst1/%D7%90%D7%91%D7%99%D7%96%D7%A8%D7%99%D7%9D/Shoes/1/%D7%94%D7%95%D7%A8%D7%93%D7%94%20%284%29.png","Radiant Executive Pump ǀ Vibrant Professional Aesthetic and Lustrous Couture Finish","Make a breathtaking statement with these radiant executive pumps, designed with a vibrant professional aesthetic that captures the essence of majesty and grace. The lustrous couture finish and high-quality materials ensure a polished look that is both visually striking and incredibly comfortable for a confident, high-fashion profile. This pair is a stunning representation of elite footwear, designed for those who appreciate fine artisan craftsmanship and a superior designer flair. #ExecutivePump #RadiantElegance #ad","Suits"
"https://s.click.aliexpress.com/e/_c4cnLNPv","https://raw.githubusercontent.com/avivaknin/PinterestImages/main/pinterst1/Suits/2/pose_elegant_profile_bg-spaceship-deck.png","Radiant Prestige Evening Suit ǀ Vibrant Luxury Aesthetic and Lustrous Couture Finish","Make a breathtaking impression with this radiant prestige evening suit, designed with a vibrant luxury aesthetic that captures the essence of modern majesty. The lustrous couture finish and high-quality construction ensure a polished look that is both visually striking and incredibly durable for a confident profile. #EveningSuit #RadiantLuxe #ad","Suits"
"https://s.click.aliexpress.com/e/_c38XoVer","https://raw.githubusercontent.com/avivaknin/PinterestImages/main/pinterst1/Women%27s%20suits/5/pose_quick_spin_bg-studio-spotlight.png","Radiant Prestige Tailored Ensemble ǀ Vibrant Modern Aesthetic and Lustrous Couture Finish","Make a breathtaking impression with this radiant prestige tailored ensemble, designed with a vibrant modern aesthetic that captures the essence of majesty. The lustrous couture finish and high-quality materials ensure a polished look that is both visually striking and incredibly comfortable for a confident presence. #TailoredEnsemble #RadiantStyle #ad","Suits"
"https://s.click.aliexpress.com/e/_c2zFyaIb","https://raw.githubusercontent.com/avivaknin/PinterestImages/main/pinterst1/Suits/Suits/%D7%94%D7%95%D7%A8%D7%93%D7%94%20%284%29.png","Radiant Prestige Tailored Suit ǀ Vibrant Luxury Aesthetic and Lustrous Couture Finish","Make a breathtaking impression with this radiant prestige tailored suit, designed with a vibrant luxury aesthetic that captures the essence of modern majesty. The lustrous couture finish and high-quality construction ensure a polished look that is both visually striking and incredibly durable for a confident, high-fashion profile. This suit is a stunning representation of high-end apparel, designed for those who appreciate fine artisan craftsmanship and a superior designer flair. #PrestigeSuit #RadiantLuxe #ad","Suits"
"https://s.click.aliexpress.com/e/_c4CC421f","https://ae-pic-a1.aliexpress-media.com/kf/Sd9721336ed444017b19517216d906524O.jpg_480x480q75.jpg_.avif","Relaxed White Linen Set | Pure Coastal Serenity","The ultimate in summer luxury. This breathable white linen set offers a relaxed fit and a clean, serene aesthetic, keeping you cool and effortlessly chic on the warmest days. #WhiteLinen #SummerStyle #CoastalChic #ad","Suits"
"https://s.click.aliexpress.com/e/_c3gSzD93","https://ae-pic-a1.aliexpress-media.com/kf/Sb88245ec6a264d0bbcbd4ae3f3cf060ej.jpg_480x480q75.jpg_.avif","Safari Belted Apex | The Tonal Industrial Shield","Featuring high-velocity utilitarian geometry and a statuesque belted-waist anchor for extreme material depth. This set radiates an aura of mission-ready power and unyielding boutique-level sophistication. #SafariSet #IndustrialShield #TonalArchitecture #ad","Suits"
"https://s.click.aliexpress.com/e/_c4cnLNPv","https://raw.githubusercontent.com/avivaknin/PinterestImages/main/pinterst1/Suits/2/pose_hands_in_pockets_bg-sunset-cliffs.png","Sophisticated Minimalist Tailored Suit ǀ Sharp Contemporary Lines and Elite Designer Polish","Discover the beauty of simplicity with this sophisticated minimalist tailored suit, characterized by its sharp contemporary lines and meticulous designer polish. The high-quality construction and refined textile choice offer a professional yet fashionable look that is perfect for maintaining a sharp profile in any setting. #MinimalistSuit #ModernLuxe #ad","Suits"
"https://s.click.aliexpress.com/e/_c38XoVer","https://raw.githubusercontent.com/avivaknin/PinterestImages/main/pinterst1/Women%27s%20suits/7/pose_3_4_view_bg-luxury-interior.png","Sophisticated Noir Executive Suit ǀ Sharp Contemporary Lines and Elite Technical Detail","Discover the beauty of urban sophistication with this noir executive suit, characterized by its sharp contemporary lines and elite technical detailing. The high-quality construction and refined textile choice offer a professional look that is perfect for maintaining a polished profile in any metropolitan environment. #ExecutiveSuit #NoirLuxury #ad","Suits"
"https://s.click.aliexpress.com/e/_c3TjCjNj","https://ae-pic-a1.aliexpress-media.com/kf/S4fdc1496d08b45c6b318dce1bb0d09474.jpg_220x220q75.jpg_.avif","Sparkly Striped Hoodie & Skirt Set | Playful Glamorous Comfort","Who says comfort can’t be glamorous? This unique sparkly set combines a sporty hoodie with a matching skirt, offering a playful and shimmering look for stylish downtime. #SparklySet #GlamSport #PlayfulFashion #ad","Suits"
"https://s.click.aliexpress.com/e/_c3GBVgYN","https://ae-pic-a1.aliexpress-media.com/kf/Sa40b1056ae2448c78f03557652c6c572i.jpg_480x480q75.jpg_.avif","Vibrant Red Crop Top & Maxi Set | Passionate Summer Flow","Radiate passion in this stunning red ensemble. The flirty crop top and flowing maxi skirt create a beautiful sense of movement, perfect for summer evenings and romantic getaways. #RedSet #MaxiSkirt #SummerElegance #ad","Suits"
"https://s.click.aliexpress.com/e/_c2wzrEKD","https://ae-pic-a1.aliexpress-media.com/kf/S4d69ec48489b46ec8fd8d6b621e28474E.jpg_480x480q75.jpg_.avif","White Embellished Vest & Skirt Set | Luxe Radiant Charm","Pure elegance with a touch of sparkle. This stunning white set features delicate embellishments, offering a radiant and feminine look that’s perfect for bridal events or upscale brunches. #WhiteSet #EmbellishedStyle #RadiantFashion #ad","Suits"
"https://s.click.aliexpress.com/e/_c43bdpq5","https://ae-pic-a1.aliexpress-media.com/kf/S6bd9607b3d504e1f9943a8409ed1b121M.jpg_480x480q75.jpg_.avif","White Floral Cutout Ensemble | Breezy Summer Romance","Capture the essence of a summer garden. This romantic white set features a delicate floral print and artistic cutouts, creating a light and airy look for your next sunny getaway. #FloralCutout #SummerRomance #WhiteStyle #ad","Suits"
"https://s.click.aliexpress.com/e/_c2Q5A4yN","https://ae-pic-a1.aliexpress-media.com/kf/S7a3d3c50532c4a5db864c23a0a02a2a66.jpg_480x480q75.jpg_.avif","White Keyhole Crop & Flared Set | Modern Bohemian Luxury","Experience a fresh take on boho-chic. This white set features a flirty keyhole crop top and dramatic flared trousers, offering a modern and luxurious silhouette for summer festivities. #KeyholeSet #FlaredPants #BohoLuxury #ad","Suits"
"https://s.click.aliexpress.com/e/_c3d9M341","https://ae-pic-a1.aliexpress-media.com/kf/S7008220afc4b484e835059b427db9c463.jpg_480x480q75.jpg_.avif","Yellow Peplum Top & Skirt Set | Vibrant Sunny Sophistication","Bring a burst of sunshine to your wardrobe. This vibrant yellow set features a figure-flattering peplum top and matching skirt, offering a radiant and polished look for any social event. #YellowSet #PeplumStyle #VibrantFashion #ad","Suits"
"https://s.click.aliexpress.com/e/_c3E0BJbD","https://ae-pic-a1.aliexpress-media.com/kf/Scf6ec39c1cee4f1e9f0c0d783a930ac6y.jpg_480x480q75.jpg_.avif","Yellow Sleeveless Wide-Leg Set | Bold Radiant Summer Look","Stand out in radiant yellow. This sleeveless set pairs a clean-cut top with voluminous wide-leg trousers, creating a bold and trendy silhouette that celebrates the joy of summer. #YellowSuit #WideLegSet #SummerRadiance #ad","Suits"