Affiliate URL,Image URL,Name,Description,Category
"https://s.click.aliexpress.com/e/_c3T7BcVh","https://raw.githubusercontent.com/avivaknin/PinterestImages/main/pinterst1/Sweaters/7/pose_over_the_shoulder_bg-graffiti-wall.png","Outerwea3 pose_leaning_on_wall_bg-graffiti-wall.pn.jpg","This urban edge jacket captures a powerful street-style aesthetic, featuring a sophisticated leaning-on-wall pose against a vibrant graffiti backdrop that highlights its modern textures. The premium fabric and structured silhouette provide a polished yet creative profile, ensuring you stay comfortable while radiating a sharp and authoritative fashion presence. Designed for the city visionary, this piece offers a seamless blend of street-inspired innovation and superior, high-end designer quality for any social setting. It represents a beautiful harmony of rugged charm and professional polish, making it a must-have for a curated and elite metropolitan wardrobe. Elevate your everyday rotation with a jacket that defines the pinnacle of contemporary luxury and bold, individualistic designer flair. #UrbanJacket #GraffitiStyle #ad","Swimwear "
"https://s.click.aliexpress.com/e/_c4bRMPEf","https://ae-pic-a1.aliexpress-media.com/kf/S7d305fe5ab984230a4c141df96ed3d72d.jpg_480x480q75.jpg_.avif","Painterly-Stripe Skirt Set | Artistic Linear Fluidity","Utilizing high-fidelity abstract stripes to create a sense of constant movement. The swim skirt provides a statuesque and modest profile, radiating an aura of intellectual grace and unstudied poolside elegance. #SwimSkirt #StripedSwimwear #ArtisticFashion #ad","Swimwear "
"https://s.click.aliexpress.com/e/_c3PBF6pD","https://ae-pic-a1.aliexpress-media.com/kf/Sb2a294a0391e41cb8c9b39aae55f33d2Q.jpg_480x480q75.jpg_.avif","Performance-Swim Jammers | Sleek Hydrodynamic Compression","Focusing on a zero-distraction, aerodynamic fit. These swim jammers provide a statuesque and powerful verticality, engineered with high-density fibers to ensure a look of unyielding athletic competence and elite aquatic polish. #SwimJammers #PerformanceSwim #AthleticAuthority #ad","Swimwear "
"https://s.click.aliexpress.com/e/_c3zlAA3H","https://ae-pic-a1.aliexpress-media.com/kf/S7a9295bc05d347fa8cb66e42b9e6e748V.jpg_480x480q75.jpg_.avif","Pink Tie-Front Bikini | Petal-Tone Kinetic Charm","Featuring a functional tie-front anchor that allows for a custom, statuesque fit. In a delicate petal pink, this set offers a streamlined silhouette and a look of unstudied boutique grace, perfect for high-energy beach activities or serene lounging. #PinkBikini #TieFrontStyle #BoutiqueSwim #ad","Swimwear "
"https://s.click.aliexpress.com/e/_c3MNNhIB","https://ae-pic-a1.aliexpress-media.com/kf/Sb19c380e700c4ff694b1b4d40fadc41dV.jpg_480x480q75.jpg_.avif","Pink-Crochet High-Cut | Tactile Rose Geometry","Combining a high-cut leg for extreme verticality with the textural depth of crochet. This pink bikini offers a statuesque and playful silhouette, radiating a look of unstudied boutique energy and artisanal high-fashion charm. #CrochetBikini #PinkSwim #HighCutBikini #ad","Swimwear "
"https://s.click.aliexpress.com/e/_c3haWXXt","https://raw.githubusercontent.com/avivaknin/PinterestImages/main/pinterest2/Swim%20%26%20Beachwear/5/description_imageS94a074e1308947fba1f17de3846d1e88U.png","Premier Azure Coast Swimsuit ǀ Vibrant Luxury Aesthetic and Lustrous Couture Finish","Make a breathtaking splash with this premier azure swimsuit, designed with a vibrant luxury aesthetic that captures the essence of modern majesty and summer grace. The lustrous couture finish and high-quality materials provide an exceptional sensory experience, ensuring a secure and flattering fit while radiating high-fashion charm at any exclusive resort. Its unique texture and structured silhouette make it an ideal centerpiece for a curated beachwear collection, providing a polished and undeniably stunning look. #AzureSwim #LuxuryBeachwear #ad","Swimwear "
"https://s.click.aliexpress.com/e/_c4Kxp8zh","https://raw.githubusercontent.com/avivaknin/PinterestImages/main/pinterst1/Swimwear/5/description_imageHbc04af61bd154277ba951cf750397cfc1.png","Premier Signature Resort Swimwear ǀ Exquisite Intricate Detailing and Timeless Summer Grace","Make a royal statement in this premier signature resort swimsuit, featuring exquisite intricate detailing that captures the essence of modern majesty and summer grace. The lustrous couture finish and high-quality materials provide an exceptional sensory experience, ensuring you stay comfortable while radiating high-fashion charm all day long. Its unique texture and structured silhouette make it an ideal centerpiece for a luxury beachwear collection, providing a polished and undeniably stunning look. #SignatureResort #SummerGrace #ad","Swimwear "
"https://s.click.aliexpress.com/e/_c4Kxp8zh","https://raw.githubusercontent.com/avivaknin/PinterestImages/main/pinterst1/Swimwear/5/pose_3_4_view_bg-fluffy-blanket.png","Radiant Fluffy-Blanket Swimwear ǀ Majestic 3/4 View and Sophisticated Soft Glow","Showcase a unique artistic aesthetic with this sophisticated swimwear, featured in a majestic three-quarter view against a soft and luxurious fluffy-blanket backdrop. The sharp tailoring and premium materials offer a polished and authoritative silhouette that blends comfortable textures with a refined, high-fashion designer finish. This piece is an essential for those seeking a unique, high-quality look that radiates confidence and reflects a deep passion for artistic excellence. #FluffyGlow #SophisticatedSwim #ad","Swimwear "
"https://s.click.aliexpress.com/e/_c3VOYUT9","https://raw.githubusercontent.com/avivaknin/PinterestImages/main/pinterest2/Swimwear/7/pose_quick_spin_bg-gradient.png","Radiant Gradient Spin Swimsuit ǀ Dynamic Studio Motion and Modern Minimalist Polish","Experience the fluid beauty of this premium swimsuit, captured in a dynamic quick-spin pose against a sleek studio gradient that highlights its vibrant colors and high-end finish. The innovative design ensures a secure and flattering fit while providing a sense of effortless grace and modern movement for a truly sharp fashion profile. This piece is a versatile essential for a high-fashion summer rotation, offering a seamless blend of technical innovation and superior designer quality. #GradientSwim #DynamicStyle #ad","Swimwear "
"https://s.click.aliexpress.com/e/_c3T7BcVh","https://raw.githubusercontent.com/avivaknin/PinterestImages/main/pinterst1/Sweaters/7/pose_3_4_view_bg-surreal-sky.png","Ready Set Move","Crystal Mesh Pumps | Elite Party Heels","Swimwear "
"https://s.click.aliexpress.com/e/_c3RHMW8J","https://ae-pic-a1.aliexpress-media.com/kf/Sa0b27630ccac4dcc90d44801122b1522S.jpg_480x480q75.jpg_.avif","Retro Black & White Button Detail Bikini","Channel vintage glamour in this black and white high-waisted bikini. The button detailing and classic color contrast offer a timeless, chic beach look. #RetroSwimwear #VintageBikini #HighWaistBikini #ClassicStyle #ad","Swimwear "
"https://s.click.aliexpress.com/e/_c4lMvlMj","https://ae-pic-a1.aliexpress-media.com/kf/Sefb4ff49fe424ffcad6465fd992b158cY.jpg_480x480q75.jpg_.avif","Ruched Noir Pillar | The Obsidian Structural Vault","Featuring high-authority ruching geometry and a statuesque one-piece framework for uncompromised structural integrity. This piece radiates an aura of unapologetic power and unyielding boutique-level sophistication. #OnePiece #ObsidianVault #StructuralArchitecture #ad","Swimwear "
"https://s.click.aliexpress.com/e/_c4tGyMhv","https://ae-pic-a1.aliexpress-media.com/kf/Hb63be103be734e6b889e7168ca9b112ej.jpg_480x480q75.jpg_.avif","Ruffled Lemon Print High-Waisted Bikini","Fresh and fruity! This lemon print bikini features playful ruffled edges and a comfortable high-waist cut, perfect for poolside lounging or beach days. #LemonPrint #RuffleBikini #SummerStyle #Beachwear #ad","Swimwear "
"https://s.click.aliexpress.com/e/_c3Gw7Xu3","https://ae-pic-a1.aliexpress-media.com/kf/S2e590bd077964750a3ec4f01b27de2bdH.jpg_480x480q75.jpg_.avif","Silky-Pink Shiny Bikini | Luminous Rose Lustre","Utilizing high-shine technical fibers to create a liquid-like glow. This triangle bikini offers a statuesque and minimalist profile, radiating a look of high-society glamour and unyielding editorial polish under the sun. #ShinyBikini #PinkLuxe #LuminousSwim #ad","Swimwear "
"https://s.click.aliexpress.com/e/_c4cYg3iP","https://ae-pic-a1.aliexpress-media.com/kf/S5a543c9093514b9187fa76573caca7b1Z.jpg_480x480q75.jpg_.avif","Striped Swim Set | The Linear Nautical Shield","Utilizing rhythmic striped geometry and functional drawstring anchors to define a statuesque and adaptive profile. This set radiates an aura of mission-ready urban grit and unyielding heritage-grade luxury, serving as a reliable structural foundation. #StripedSwim #NauticalShield #LinearArchitecture #ad","Swimwear "
"https://s.click.aliexpress.com/e/_c4swhHJD","https://ae-pic-a1.aliexpress-media.com/kf/S69c95f44b0fe45b89d78b73db363f79c0.jpg_480x480q75.jpg_.avif","Striped-V-Neck Swimsuit | Linear Nautical Authority","Defined by its deep V-neckline and high-contrast stripes that create an extreme statuesque verticality. This one-piece offers a professional-grade fit and an aura of Quiet Luxury, serving as a definitive icon of seaside sophistication. #StripedSwimsuit #VNeckStyle #NauticalLuxe #ad","Swimwear "
"https://s.click.aliexpress.com/e/_c4Kxp8zh","https://raw.githubusercontent.com/avivaknin/PinterestImages/main/pinterst1/Swimwear/5/description_imageH0b9d6249904549518bb91788391193289.png","Stunning Royal Blue Ribbed Ruffle Strap One-Piece Swimsuit with Lace-Up Back","Swimwear Dive into summer style with this gorgeous royal blue ribbed one-piece swimsuit, featuring charming ruffled straps and a chic lace-up back detail. Perfect for beach days, poolside lounging, or your next vacation. Flattering and fashionable swimwear. #OnePieceSwimsuit #BlueSwimwear #RuffleSwimsuit #LaceUpBack #SummerFashion #BeachStyle #affiliatelink","Swimwear "
"https://s.click.aliexpress.com/e/_c3wASj7D","https://raw.githubusercontent.com/avivaknin/PinterestImages/main/pinterst1/Swim%20%26%20Beachwear/7/pose_hands_in_pockets_bg-sunbeam-forest.png","Sun-Drenched Utility Beachwear ǀ Relaxed Hands-in-Pockets Pose and Radiant Natural Light","Embrace a blend of comfort and high-end style with this utility-inspired beachwear, showcasing a relaxed hands-in-pockets pose amidst a radiant and enchanting sunbeam glow. The design features a modern, structured silhouette that emphasizes effortless grace without compromising on the sophisticated polish required for a prestigious resort wardrobe. Each stitch reflects a commitment to quality, ensuring a breathable and comfortable experience while maintaining a sharp and trendy look that stands out. #SunbeamBeach #UtilitySwim #ad","Swimwear "
"https://s.click.aliexpress.com/e/_c3EkvE8f","https://raw.githubusercontent.com/avivaknin/PinterestImages/main/pinterst1/Swimwear/2/pose_3_4_view_bg-sunset-cliffs.png","Sunset Cliffside Elite Swimwear ǀ Majestic 3/4 View and Coastal Golden Hour Glow","Command the shoreline in this elite swimwear set, showcased in a majestic three-quarter view against a breathtaking sunset cliffside that enhances its delicate textures. The lustrous finish and premium materials capture the golden hour light, creating a silhouette that is both visually striking and undeniably sophisticated for a unique look. This piece provides a sharp and authoritative fashion profile, blending artistic innovation with the natural beauty of a coastal landscape. #SunsetCliffs #EliteSwim #ad","Swimwear "
"https://s.click.aliexpress.com/e/_c3f2CJpl","https://ae-pic-a1.aliexpress-media.com/kf/S617b87c490d04431990f14b980cfcdb17.jpg_480x480q75.jpg_.avif","Teal Crisscross Tummy Control One-Piece","Feel confident and supported in this elegant teal one-piece. The crisscross design and tummy-control fabric create a stunning, sculpted silhouette. #OnePieceSwimsuit #TummyControl #TealSwimwear #FlatteringSwimsuit #ad","Swimwear "
"https://s.click.aliexpress.com/e/_c3VOYUT9","https://raw.githubusercontent.com/avivaknin/PinterestImages/main/pinterest2/Swimwear/7/pose_hands_in_pockets_bg-sunset-cliffs.png","Trendy Teal Bikini with Pink Heart Print - Your Perfect Summer Swimwear","Swimwear Make a splash with this vibrant teal bikini adorned with playful pink heart prints. Designed for both style and comfort, this two-piece swimsuit is ideal for your next beach getaway or poolside relaxation. Elevate your summer wardrobe with this charming and chic design. #HeartPrintBikini #TealSwimsuit #PinkHearts #SummerFashion #BeachStyle #TrendySwimwear #affiliatelink","Swimwear "
"https://s.click.aliexpress.com/e/_c3SzP3U7","https://ae-pic-a1.aliexpress-media.com/kf/S7c9006a6444943a2b2fcd686f7f718eaM.jpg_480x480q75.jpg_.avif","Tropical Pink Monolith | The Botanical Radiant Shield","Precision-engineered with high-saturation pink geometry and a statuesque high-waisted framework. This set radiates an aura of Quiet Luxury and unyielding professional-grade elegance for the aquatic specialist. #PinkBikini #RadiantShield #BotanicalArchitecture #ad","Swimwear "
"https://s.click.aliexpress.com/e/_c3ZkPgrl","https://ae-pic-a1.aliexpress-media.com/kf/S84fc265dec5c4ce9b32fd2fcac384504W.jpg_480x480q75.jpg_.avif","Tropical Rash Guard | Botanical Kinetic Shield","Engineered for high-velocity water sports without compromising on style. Featuring high-fidelity botanical prints, this long-sleeve suit provides a statuesque and protective profile, radiating a look of professional-grade athletic authority. #RashGuard #TropicalSwim #ActiveLuxe #ad","Swimwear "
"https://s.click.aliexpress.com/e/_c3EkvE8f","https://raw.githubusercontent.com/avivaknin/PinterestImages/main/pinterest2/Swimwear/5/pose_sitting_stairs_to_camera_bg-tropical-beach.png","Tropical Staircase Beach Masterpiece ǀ Relaxed Frontal Pose and Majestic Island Glow","Showcase a breathtaking summer look with this tropical swimsuit, featured in a relaxed sitting-on-stairs pose that perfectly frames the garment against a radiant island backdrop. The high-quality construction and refined fabric offer a sophisticated aesthetic that is both visually striking and incredibly comfortable for an exclusive resort experience. It represents a beautiful harmony of natural charm and professional designer polish, ensuring you stand out with undeniable elegance and confidence. #TropicalSwim #IslandLuxe #ad","Swimwear "
"https://s.click.aliexpress.com/e/_c4PP1lKR","https://ae-pic-a1.aliexpress-media.com/kf/Sda51b6f45e564cf78a58c5b0ca91d271e.jpg_480x480q75.jpg_.avif","Trunk Organizer Monolith | The Obsidian Industrial Vault","Precision-engineered with high-velocity leather geometry and a statuesque modular framework. This organizer radiates an aura of mission-ready power and unyielding professional-grade utility, serving as a definitive structural anchor for the mobile environment. #CarOrganizer #IndustrialVault #ObsidianArchitecture #ad","Swimwear "
"https://s.click.aliexpress.com/e/_c3ve1Qxl","https://ae-pic-a1.aliexpress-media.com/kf/S1c2caa09ec3a44bc827dd6547293e369l.jpg_480x480q75.jpg_.avif","TYR-Black Tech Kneeskin | Obsidian Hydro-Performance","A professional-grade competition suit designed for the elite aquatic specialist. The high-tension fabric and geometric compression zones offer a statuesque and aerodynamic shell, maximizing speed and unyielding performance. #TYRSwim #TechSuit #ElitePerformance #ad","Swimwear "
"https://s.click.aliexpress.com/e/_c3wASj7D","https://raw.githubusercontent.com/avivaknin/PinterestImages/main/pinterst1/Swim%20%26%20Beachwear/7/pose_dynamic_dance_bg-graffiti-wall.png","Urban Dance Beach Statement ǀ Dynamic Graffiti Movement and Bold Vibrant Glow","Capture the vibrant energy of summer with this dynamic dance-pose beachwear, featuring a striking movement against a colorful and rugged urban graffiti wall. The premium lightweight fabric responds beautifully to the motion, creating a sense of effortless grace and modern romance for a truly unique and artistic fashion profile. Featuring meticulous tailoring and a polished finish, this piece stands out with a powerful and authoritative presence in any high-end summer collection. #GraffitiBeach #DynamicSummer #ad","Swimwear "
"https://s.click.aliexpress.com/e/_c4E9W6EL","https://raw.githubusercontent.com/avivaknin/PinterestImages/main/pinterst1/Swimwear/3/pose_hands_in_pockets_bg-rooftop.png","Urban Rooftop Utility Swimwear ǀ Relaxed Metropolitan Pose and Sleek Modern Lines","Redefine summer fashion with this urban-inspired utility swimwear, featuring a relaxed hands-in-pockets pose against a stunning and modern city rooftop evening sky. The innovative design combines practical comfort with a high-fashion aesthetic, ensuring a secure and flattering fit that commands attention with a powerful and unique presence. It is a stunning representation of luxury craftsmanship, designed for those who seek to combine bold confidence with an elite, artistic designer edge. #RooftopSwim #UrbanUtility #ad","Swimwear "
"https://s.click.aliexpress.com/e/_c3Yawr3p","https://raw.githubusercontent.com/avivaknin/PinterestImages/main/pinterest2/Swim%20%26%20Beachwear/7/description_imageSdd9d83ebb5f84587ae739e3c41712649S.png","Watches\ S2f8b06247f2543c7852ac5034bdf4982E.png","Elevate your professional profile with this sophisticated midnight executive watch, defined by its sleek modern lines and meticulous designer craftsmanship for a refined, high-end finish. The premium strap and high-quality movement provide an exceptional sensory experience, ensuring a secure and comfortable fit while maintaining a sharp, trendy social appearance. It represents a beautiful harmony of minimalist design and opulent texture, making it an essential piece for any curated luxury accessory collection. #ExecutiveWatch #ModernLuxe #ad","Swimwear "
"https://s.click.aliexpress.com/e/_c43wuGiL","https://ae-pic-a1.aliexpress-media.com/kf/S845687c3c59e4814a56570fc385eecc0F.jpg_220x220q75.jpg_.avif","White-Heart Gold Bikini | Luminous Ivory Ornament","A breathtaking fusion of pristine white fabric and high-lustre gold-tone hardware. This bikini offers a statuesque and precious aesthetic, radiating an aura of high-end boutique luxury and uncompromised resort elegance. #WhiteBikini #GoldDetail #ResortLuxe #ad","Swimwear "
"https://s.click.aliexpress.com/e/_c3zHWCBH","https://ae-pic-a1.aliexpress-media.com/kf/S51a62011719a4016be0c8282b4fc3e0ad.jpg_480x480q75.jpg_.avif","White-Zig-Zag Bandeau | Architectural Ivory Geometry","Defined by its clean bandeau neckline and rhythmic zig-zag texture. This bikini provides a statuesque and minimalist profile, radiating a look of unstudied urban authority and uncompromised coastal purity. #BandeauBikini #WhiteSwimwear #MinimalistLuxe #ad","Swimwear "
"https://s.click.aliexpress.com/e/_c3GvR6Lz","https://ae-pic-a1.aliexpress-media.com/kf/S4aee6d4074494aaa8b1198187110121aL.jpg_480x480q75.jpg_.avif","Wrap Bikini Pillar | The Umber Geometric Anchor","Defined by extreme statuesque verticality and high-authority wrap-anchor geometry. This bikini set radiates an aura of Quiet Luxury and unyielding modernistic serenity, framing the silhouette with surgical precision. #HighWaistedBikini #GeometricAnchor #UmberArchitecture #ad","Swimwear "