Affiliate URL,Image URL,Name,Description,Category
"https://s.click.aliexpress.com/e/_c30qQxin","https://ae-pic-a1.aliexpress-media.com/kf/Scdd3f955381e4e45a5dda9ccc65d6c5fB.jpg_480x480q75.jpg_.avif","Arena Racing Jammers | Professional Hydro-Kinetic Armor","Engineered for the elite competitive swimmer. These Arena jammers utilize high-compression fabric to minimize drag and maximize statuesque efficiency in the water. They radiate a look of unyielding athletic authority and professional-grade performance. #ArenaSwimming #RacingJammers #ElitePerformance #ad","Swimwear "
"https://s.click.aliexpress.com/e/_c35MnyzZ","https://ae-pic-a1.aliexpress-media.com/kf/S84bfd2b92e7e4c248bf0e1b25bd5ac69V.jpg_480x480q75.jpg_.avif","Blue-Pink Hearts Bikini | Graphic Romantic Geometry","A vibrant fusion of playful motifs and intricate braided detailing. This bikini offers a statuesque and high-energy silhouette, radiating an aura of unstudied boutique charm and high-fashion poolside allure. #HeartBikini #BraidedStyle #PoolsideLuxe #ad","Swimwear "
"https://s.click.aliexpress.com/e/_c3tRCjwP","https://ae-pic-a1.aliexpress-media.com/kf/H1500afc0dd6344faabb345989e500a58Q.jpg_480x480q75.jpg_.avif","Blue-Twisted Knot Bikini | Azure Sculptural Drapery","Featuring a sophisticated twisted knot anchor that adds architectural depth to the bust. In a commanding azure blue, this bikini provides a statuesque and presence-filled profile, radiating a look of Quiet Luxury and modernistic grace. #BlueBikini #KnotDetail #ModernistSwim #ad","Swimwear "
"https://s.click.aliexpress.com/e/_c3MMhGth","https://ae-pic-a1.aliexpress-media.com/kf/S2bf61010497e4310a4b772ec01887ccco.jpg_480x480q75.jpg_.avif","Boho-Striped Knit Set | Textural Nomadic Luxury","Merging the tactile depth of knitwear with a high-velocity swim silhouette. This coordinated set offers a statuesque and multi-dimensional look, radiating an aura of unstudied bohemian elegance and boutique-level curation. #KnitBikini #BohoLuxe #ResortStyle #ad","Swimwear "
"https://s.click.aliexpress.com/e/_c3FXEJH5","https://ae-pic-a1.aliexpress-media.com/kf/Sba6de5ea9db4467aba2ee4371084a227L.jpg_480x480q75.jpg_.avif","Brown Halterneck & Sarong | Espresso Tonal Column","A masterclass in coordinated resort authority. The halterneck swimsuit and matching sarong create a continuous, statuesque line in a rich espresso tone, providing a look of unyielding high-society grace and professional-grade polish. #BrownSwimwear #SarongSet #QuietLuxury #ad","Swimwear "
"https://s.click.aliexpress.com/e/_c3y9NNCx","https://raw.githubusercontent.com/avivaknin/PinterestImages/main/pinterest2/Sweaters/7/%D7%94%D7%95%D7%A8%D7%93%D7%94%20%283%29.png","Chic Autumn Street Style: Green Sweater, Leather Skirt & Elegant Slingbacks","Sweaters Embrace the autumn vibes with this effortlessly stylish look! Featuring a cozy olive green oversized sweater, a trendy burgundy leather mini skirt, and elegant buckled slingback heels. Perfect for a chic coffee run or a fashionable day out. #AutumnFashion #StreetStyle #GreenSweater #LeatherSkirt #ChicOutfit #FallStyle #affiliatelink","Swimwear "
"https://s.click.aliexpress.com/e/_c3wASj7D","https://raw.githubusercontent.com/avivaknin/PinterestImages/main/pinterst1/Swim%20%26%20Beachwear/7/pose_garment_interaction_bg-spaceship-deck.png","Chic Black Plunge V-Neck Mini Dress with Cut-Outs for Summer Style","Swim & Beachwear  Step out in style with this elegant black mini dress, featuring a flattering plunge V-neckline and chic waist cut-outs. The tiered, flowy skirt adds a playful touch, making it perfect for summer outings, holidays, or a casual day out. Pair with sandals for a relaxed yet fashionable look. #blackminidress #summerdress #cutoutfashion #plungeneck #vacationoutfit #summerstyle #affiliatelink","Swimwear "
"https://s.click.aliexpress.com/e/_c3EkvE8f","https://raw.githubusercontent.com/avivaknin/PinterestImages/main/pinterst1/Swimwear/2/pose_hands_in_pockets_bg-fluffy-blanket.png","Chic Blue Ruffled One-Piece Swimsuit with Lace-Up Back for Stylish Summer Days","Swimwear Embrace the summer vibes with this elegant royal blue one-piece swimsuit, featuring charming ruffle trim straps and a trendy lace-up back for a customizable and flattering fit. Perfect for poolside lounging or beach adventures, this ribbed swimwear combines comfort and style effortlessly. #OnePieceSwimsuit #BlueSwimwear #RuffleSwimsuit #LaceUpBack #SummerFashion #BeachVibes #affiliatelink","Swimwear "
"https://s.click.aliexpress.com/e/_c3haWXXt","https://raw.githubusercontent.com/avivaknin/PinterestImages/main/pinterest2/Swim%20%26%20Beachwear/5/%D7%94%D7%95%D7%A8%D7%93%D7%94%20%284%29.png","Chic Blue Tropical Print Zipper Front One-Piece Swimsuit for Sporty Summer Style","Swim & Beachwear Dive into summer with this fashionable black and blue tropical print swimsuit. Featuring short sleeves, a practical front zipper, and a comfortable one-piece design, it's perfect for swimming, surfing, or beach lounging. Embrace sporty chic with this stylish swimwear. #swimsuit #tropicalprint #rashguard #beachwear #summerfashion #sportyswimwear #affiliatelink","Swimwear "
"https://s.click.aliexpress.com/e/_c4E9W6EL","https://raw.githubusercontent.com/avivaknin/PinterestImages/main/pinterst1/Swimwear/3/pose_3_4_view_bg-rooftop.png","Chic Pink One-Piece Swimwear: Perfect for Rooftop Pools and Skyline Views","Swimwear Embrace the allure of the city night with this vibrant two-tone pink one-piece swimsuit. Its flattering design and eye-catching colors make it ideal for a luxurious getaway, a stylish resort stay, or simply a chic day by the pool. Elevate your summer wardrobe with this elegant and modern swimwear piece. #PinkSwimsuit #OnePiece #SwimwearFashion #SummerVibes #ResortWear #CityChic #affiliatelink","Swimwear "
"https://s.click.aliexpress.com/e/_c4Fwg8ix","https://ae-pic-a1.aliexpress-media.com/kf/S698f8283d22d4a84a472771e4e32c1b6h.jpg_220x220q75.jpg_.avif","Chic-Cutout Monokini | Architectural Negative Space","Defined by its daring geometric cutouts that frame the silhouette with surgical precision. This monokini offers a statuesque and avant-garde aesthetic, radiating an aura of high-fashion authority and uncompromised urban glamour. #Monokini #CutoutSwim #ModernistFashion #ad","Swimwear "
"https://s.click.aliexpress.com/e/_c3EkvE8f","https://raw.githubusercontent.com/avivaknin/PinterestImages/main/pinterst1/Swimwear/2/pose_sitting_floor_looking_up_bg-fluffy-blanket.png","Cozy Fluffy-Blanket Swim Aesthetic ǀ Soft Textural Contrast and Radiant Floor Pose","Discover a unique blend of comfort and allure with this swimwear piece, featured in a sitting-floor pose against a soft and luxurious fluffy-blanket backdrop. The contrast between the sleek swimsuit and the rich texture of the blanket creates a visually captivating and modern aesthetic that radiates pure elegance. Crafted with meticulous attention to detail, this set offers a polished and trendy profile that reflects a deep passion for artistic innovation and quality. #CozySwim #TexturalLuxury #ad","Swimwear "
"https://s.click.aliexpress.com/e/_c3a0feI3","https://ae-pic-a1.aliexpress-media.com/kf/S8fe2a12395ca409c8f71598ddc074ebfc.jpg_480x480q75.jpg_.avif","Cream-Leopard Bikini | Exotic Ivory Sophistication","A high-fidelity exploration of the leopard motif set against a pristine ivory base. This bikini provides a statuesque and provocative profile, radiating a look of unapologetic confidence and high-end boutique allure. #LeopardBikini #CreamLuxe #ExoticSwim #ad","Swimwear "
"https://s.click.aliexpress.com/e/_c3T7BcVh","https://raw.githubusercontent.com/avivaknin/PinterestImages/main/pinterst1/Sweaters/7/pose_dynamic_dance_bg-crystal-palace.png","Crystal Palace Dynamic Knit ǀ Majestic Dance Motion and Radiant Architectural Light","Capture the vibrant energy of the season with this dynamic dance-pose sweater, featuring a striking movement against the grand backdrop of a majestic crystal palace. The premium textured fabric responds beautifully to the motion and the light, creating a sense of effortless grace and modern romance for a unique profile. Featuring meticulous tailoring and a polished finish, this piece stands out with a powerful and authoritative presence in any high-end winter collection. #CrystalPalace #DynamicKnitwear #ad","Swimwear "
"https://s.click.aliexpress.com/e/_c3wASj7D","https://raw.githubusercontent.com/avivaknin/PinterestImages/main/pinterst1/Swim%20%26%20Beachwear/7/pose_3_4_view_bg-opera-stage.png","Dramatic Opera Stage Swimwear ǀ Majestic 3/4 View and Grand Theatrical Flair","Showcase a unique artistic aesthetic with this sophisticated swimwear, featured in a majestic three-quarter view against the grand and theatrical backdrop of an opera stage. The sharp tailoring and premium materials offer a polished and authoritative silhouette that blends creative performance style with a refined, high-fashion designer finish. This piece is an essential for those seeking a unique, high-quality look that captures the vibrant energy of elite culture with pure elegance and grace. #OperaSwim #GrandBeachwear #ad","Swimwear "
"https://s.click.aliexpress.com/e/_c3haWXXt","https://raw.githubusercontent.com/avivaknin/PinterestImages/main/pinterst1/Swim%20%26%20Beachwear/2/pose_hands_in_pockets_bg-spaceship-deck.png","Effortless Black Sleeveless Beach Dress with Pockets for Relaxed Summer Style","Swim & Beachwea Discover your new favorite summer essential! This black sleeveless A-line dress with convenient side pockets offers ultimate comfort and style for beach days, travel, and casual outings. Its simple yet elegant design makes it perfect for warm weather adventures. Don't forget your sun hat! #SummerFashion #BeachStyle #CasualDress #VacationOutfit #SleevelessDresses #TravelChic #affiliatelink","Swimwear "
"https://s.click.aliexpress.com/e/_c3wUIpaf","https://raw.githubusercontent.com/avivaknin/PinterestImages/main/pinterst1/One-Pieces/7/pose_quick_spin_bg-tropical-beach.png","Effortless Chic: Light Wash Denim Overall Dress for Casual Street Style","One-Pieces Step out in comfort and style with this trendy light wash denim overall dress, featuring a side slit for a modern touch. Paired with a classic white oversized t-shirt, white socks, and chunky sneakers, this look is perfect for a relaxed yet fashionable day out. Accessorize with layered necklaces to complete this casual streetwear ensemble. #DenimOverallDress #CasualChic #StreetStyleFashion #ComfortOutfit #SummerFashion #EverydayStyle #affiliatelink","Swimwear "
"https://s.click.aliexpress.com/e/_c4mHb8T1","https://raw.githubusercontent.com/avivaknin/PinterestImages/main/pinterst1/One-Pieces/5/pose_3_4_view_bg-library.png","Effortless Style: Grey Swimsuit and Sneakers for Mountain Exploration","One-Pieces Embrace minimalist chic with this stunning grey one-piece swimsuit, perfectly paired with classic white sneakers for an effortlessly stylish and comfortable outdoor look. Ideal for adventurous explorations or simply enjoying nature's beauty amidst majestic mountains. This versatile ensemble blends comfort with contemporary fashion, perfect for your next travel destination. #SwimsuitStyle #OnePiece #GreySwimsuit #OutdoorFashion #WhiteSneakers #MountainAdventure #affiliatelink","Swimwear "
"https://s.click.aliexpress.com/e/_c3T7BcVh","https://raw.githubusercontent.com/avivaknin/PinterestImages/main/pinterst1/Sweaters/7/pose_hands_in_pockets_bg-crystal-palace.png","Effortless Summer Style: Red Cardigan, White Top & Denim Shorts Outfit Idea","Sweaters Embrace laid-back elegance with this stunning summer outfit featuring a vibrant red open cardigan, a crisp white v-neck top, and trendy denim cut-off shorts. Perfect for a casual day out or a relaxed city stroll. This look blends comfort with modern style for any sunny adventure. #SummerStyle #RedCardigan #DenimShorts #CasualOutfit #FashionInspiration #EffortlessChic #affiliatelink","Swimwear "
"https://s.click.aliexpress.com/e/_c4E9W6EL","https://raw.githubusercontent.com/avivaknin/PinterestImages/main/pinterst1/Swimwear/3/pose_over_the_shoulder.png","Elite Over-The-Shoulder Swim Statement ǀ Sophisticated Profile and Premium Designer Polish","This elite swim statement features a sophisticated over-the-shoulder pose that highlights the garment's fluid lines and meticulous designer craftsmanship for a refined finish. The high-quality construction and refined fabric offer a professional yet fashionable look that is both visually striking and incredibly comfortable for a confident presence. Elevate your personal rotation with a piece that captures the essence of artistic innovation and provides a sharp, authoritative fashion profile. #SwimStatement #EliteDesigner #ad","Swimwear "
"https://s.click.aliexpress.com/e/_c3Yawr3p","https://raw.githubusercontent.com/avivaknin/PinterestImages/main/pinterest2/Swim%20%26%20Beachwear/7/%D7%94%D7%95%D7%A8%D7%93%D7%94%20%283%29.png","Elite Signature Tropical Masterpiece ǀ Exquisite Intricate Detailing and Timeless Allure","This elite signature beachwear masterpiece features exquisite intricate detailing and a refined silhouette that defines the pinnacle of modern luxury and professional vacation style. Crafted from premium materials with a high-end finish, it offers a polished look that is ideal for those who appreciate fine artisan craftsmanship and a sophisticated summer aesthetic. Elevate your personal rotation with a piece that captures the essence of artistic innovation and provides a sharp, authoritative fashion profile for any setting. #SignatureSwim #LuxurySummer #ad","Swimwear "
"https://s.click.aliexpress.com/e/_c3haWXXt","https://raw.githubusercontent.com/avivaknin/PinterestImages/main/pinterst1/Swim%20%26%20Beachwear/2/pose_elegant_profile_bg-sunbeam-forest.png","Ethereal Sunbeam Profile Swimwear ǀ Majestic Natural Lighting and Delicate Artistic Flow","Exude quiet confidence in this ethereal swimwear set, showcased in a sophisticated elegant profile that highlights the delicate flow of premium fabric under a radiant sunbeam. The natural lighting enhances the intricate textures and soft tones, creating a look that is both timelessly romantic and strikingly modern for a serene coastal aesthetic. This set is an expertly crafted garment that radiates grace and tranquility, offering a sophisticated, high-end designer edge that stands out beautifully. #SunbeamSwim #ElegantBeach #ad","Swimwear "
"https://s.click.aliexpress.com/e/_c3tMWvYb","https://ae-pic-a1.aliexpress-media.com/kf/S194799566f4d4c949ea6e5c36beeb5f6O.jpg_480x480q75.jpg_.avif","Fiery Red Ruffled Bikini Set | Playful & Bold Beach Style","Turn heads in this energetic red bikini. Featuring flirtatious ruffled edges that add volume and movement, this set is designed for the bold woman who loves to combine playful charm with striking color. #RedBikini #RuffledSwimwear #BoldSummer #ad","Swimwear "
"https://s.click.aliexpress.com/e/_c3uiRplH","https://ae-pic-a1.aliexpress-media.com/kf/S8519f5d9e6144ec593ec0e02f1d61ff5n.jpg_480x480q75.jpg_.avif","Floral Wetsuit Apex | The Botanical Kinetic Shield","Featuring high-fidelity floral geometry and statuesque long-sleeve zip architecture for extreme hydrodynamic integrity. This swimsuit radiates an aura of artisanal boutique energy and unyielding high-performance authority. #Wetsuit #KineticShield #BotanicalStyle #ad","Swimwear "
"https://s.click.aliexpress.com/e/_c3t1iHbv","https://raw.githubusercontent.com/avivaknin/PinterestImages/main/pinterst1/Sweaters/2/pose_hands_in_pockets_bg-spaceship-deck.png","Futuristic Utility Space Sweater ǀ Relaxed Command Pose and Sleek Galactic Polish","These elite utility-inspired sweaters redefine modern luxury, featuring a relaxed hands-in-pockets pose against a sophisticated and futuristic spaceship deck interior backdrop. The innovative design combines practical comfort with a sharp, high-fashion aesthetic, ensuring a flattering fit that radiates confidence and modern social grace. It is an essential masterpiece for those seeking a unique, high-quality look that captures the essence of a prestigious and polished designer lifestyle. #SpaceUtility #ModernSweater #ad","Swimwear "
"https://s.click.aliexpress.com/e/_c3t1iHbv","https://raw.githubusercontent.com/avivaknin/PinterestImages/main/pinterst1/Sweaters/2/pose_dynamic_dance_bg-spaceship-deck.png","Galactic Space-Age Dance Sweater ǀ Dynamic Command Pose and Futuristic Modern Lines","Redefine boundaries with this galactic dynamic-dance sweater, featured against a sleek spaceship deck for a futuristic and authoritative fashion statement. The innovative design combines structural precision with high-end knitwear textiles, ensuring a flattering fit that commands attention with a bold and visionary aesthetic. This piece represents the pinnacle of modern couture, blending high-tech inspiration with classic luxury to create a truly unforgettable and sharp professional look. #SpaceAgeSweater #DynamicKnit #ad","Swimwear "
"https://s.click.aliexpress.com/e/_c3wkJIdh","https://ae-pic-a1.aliexpress-media.com/kf/Scb032aa678a14a7a8a44aaea6808c846O.jpg_480x480q75.jpg_.avif","High-Waist Sport Shorts | The Kinetic Swim Shell","(Note: Swim-Active Hybrid). Engineered with a high-tension waistband for a statuesque core-lock. These shorts offer unyielding support and a streamlined profile, perfect for the modern curator who demands professional performance on both land and water. #SwimShorts #ActiveLuxe #HighWaistShorts #ad","Swimwear "
"https://s.click.aliexpress.com/e/_c3t1iHbv","https://raw.githubusercontent.com/avivaknin/PinterestImages/main/pinterst1/Sweaters/2/pose_3_4_view_bg-library.png","Intellectual Library Knitwear ǀ Sharp 3/4 View and Sophisticated Academic Polish","Project an image of intellectual power and refined style with this elite sweater, showcased in a majestic three-quarter view within a grand and atmospheric library. The sharp modern cut and premium textured knit offer a polished and authoritative silhouette that balances traditional luxury with a fresh, contemporary designer edge. Featuring a refined finish and high-end detailing, this piece ensures a confident fashion presence, capturing the true essence of empowered and sophisticated style. #LibraryKnit #IntellectualStyle #ad","Swimwear "
"https://s.click.aliexpress.com/e/_c3haWXXt","https://raw.githubusercontent.com/avivaknin/PinterestImages/main/pinterst1/Swim%20%26%20Beachwear/2/pose_quick_spin_bg-library.png","Intellectual Spin Beachwear ǀ Dynamic Library Motion and Sophisticated Modern Polish","Redefine boundaries with this intellectual-inspired beachwear, featuring a dynamic quick-spin pose set against the grand and atmospheric backdrop of a classical library. The innovative design combines fluid motion with a high-fashion aesthetic, ensuring a secure and flattering fit that commands attention with a powerful and unique presence. It is a stunning representation of luxury craftsmanship, designed for those who seek to combine bold confidence with an elite, artistic designer edge. #LibraryBeach #DynamicStyle #ad","Swimwear "
"https://s.click.aliexpress.com/e/_c4E9W6EL","https://raw.githubusercontent.com/avivaknin/PinterestImages/main/pinterst1/Swimwear/3/pose_quick_spin_bg-luxury-interior.png","Interior Luxury Spin Swimsuit ǀ Dynamic Indoor Motion and Opulent Designer Glow","Experience the height of dramatic fashion with this luxury interior swimsuit, featuring a dynamic quick-spin pose amidst a grand and opulent architectural setting. The premium textiles catch the indoor light beautifully, creating a look that is both timelessly romantic and strikingly modern for a truly unique fashion profile. This piece represents the pinnacle of modern couture, blending prestigious surroundings with classic allure to create a truly unforgettable and sharp look. #InteriorLuxe #DynamicSwim #ad","Swimwear "
"https://s.click.aliexpress.com/e/_c3QRR9Qr","https://ae-pic-a1.aliexpress-media.com/kf/S44dace6d47af4633a826ea6168c9a7e0i.jpg_480x480q75.jpg_.avif","Long Sleeve Graphic Print Mesh Swim Bodysuit","Make a splash with this edgy mesh swim bodysuit. Featuring a bold graphic print and long sleeves, it offers a high-fashion look with extra sun protection. #SwimBodysuit #GraphicPrint #BeachStyle #LongSleeveSwimwear #ad","Swimwear "
"https://s.click.aliexpress.com/e/_c3EkvE8f","https://raw.githubusercontent.com/avivaknin/PinterestImages/main/pinterest2/Swimwear/5/pose_power_stance_bg-tropical-beach.png","Majestic Tropical Power Stance ǀ Bold Beach Presence and Radiant Golden Hour Glow","Command the shoreline in this majestic swimwear, featuring a breathtaking power stance against a pristine tropical beach and a radiant golden hour sky. The rich textures and vibrant colors are enhanced by the natural light, creating a silhouette that is both visually striking and undeniably authoritative for a modern aesthetic. Crafted with high-quality fabrics, it ensures a secure and elegant fit while maintaining a trendy and professional profile that radiates pure confidence. #TropicalPower #BeachMasterpiece #ad","Swimwear "
"https://s.click.aliexpress.com/e/_c3EkvE8f","https://raw.githubusercontent.com/avivaknin/PinterestImages/main/pinterst1/Swimwear/2/pose_sitting_floor_looking_up_bg-minimalist-hall.png","Minimalist Hallway Studio Swimsuit ǀ Sleek Modern Pose and Sophisticated Clean Lines","Embrace the power of minimalist luxury with this sleek swimsuit, showcased in a reflective floor-sitting pose against a clean and contemporary minimalist hallway setting. The sharp tailoring and premium fabric offer a polished and authoritative silhouette that balances traditional high-fashion with a fresh, modern designer edge. This piece is an essential for those seeking a unique, high-quality look that captures the essence of refined style and professional technical excellence. #MinimalistSwim #ModernAllure #ad","Swimwear "
"https://s.click.aliexpress.com/e/_c4r62WJ9","https://ae-pic-a1.aliexpress-media.com/kf/Scbd038a6f08b4df382d713dff2b1289b0.jpg_480x480q75.jpg_.avif","Neon-Zigzag Trio | Kinetic Spectrum Architecture","A high-impact three-piece set featuring a vibrant zigzag motif. The coordinated skirt provides a statuesque verticality, radiating an aura of high-energy coastal luxury and unstudied editorial charm. #NeonSwim #ZigzagPrint #ResortLuxe #ad","Swimwear "
"https://s.click.aliexpress.com/e/_c4DeJUkB","https://ae-pic-a1.aliexpress-media.com/kf/Sbc1ab584a8ac4817956c8b6898f390d8R.jpg_480x480q75.jpg_.avif","Olive-Green Beaded Bikini | Organic Tonal Ornament","Featuring intricate shell-beaded straps that add a layer of artisanal depth to the earthy olive palette. This bikini offers a statuesque and grounded silhouette, radiating a look of nomadic luxury and serene boutique grace. #OliveBikini #BeadedSwim #NaturalLuxe #ad","Swimwear "
"https://s.click.aliexpress.com/e/_c4kwA1G7","https://raw.githubusercontent.com/avivaknin/PinterestImages/main/pinterest2/One-Pieces/7/%D7%94%D7%95%D7%90%D7%A8%D7%93%D7%94%20%283%29.png","One-Pieces\ הוארדה (3).png","","Swimwear "
"https://s.click.aliexpress.com/e/_c4kwA1G7","https://raw.githubusercontent.com/avivaknin/PinterestImages/main/pinterest2/One-Pieces/7/%D7%94%D7%95%D7%A8%D7%93%D7%94%20%283%29.png","One-Pieces\ הורדה (3).png","","Swimwear "
"https://s.click.aliexpress.com/e/_c4mHb8T1","https://raw.githubusercontent.com/avivaknin/PinterestImages/main/pinterst1/One-Pieces/5/pose_3_4_view_bg-rooftop.png","One-Pieces5 pose_3_4_view_bg-rooftop.png","","Swimwear "
"https://s.click.aliexpress.com/e/_c4mHb8T1","https://raw.githubusercontent.com/avivaknin/PinterestImages/main/pinterst1/One-Pieces/5/pose_hands_in_pockets_bg-spaceship-deck.png","One-Pieces5 pose_hands_in_pockets_bg-spaceship-deck.png","","Swimwear "
"https://s.click.aliexpress.com/e/_c4mHb8T1","https://raw.githubusercontent.com/avivaknin/PinterestImages/main/pinterst1/One-Pieces/5/pose_hands_in_pockets_bg-sunbeam-forest.png","One-Pieces5 pose_hands_in_pockets_bg-sunbeam-forest.png","","Swimwear "
"https://s.click.aliexpress.com/e/_c3wUIpaf","https://raw.githubusercontent.com/avivaknin/PinterestImages/main/pinterst1/One-Pieces/7/pose_hands_in_pockets_bg-forest.png","One-Pieces7 pose_hands_in_pockets_bg-forest.png","","Swimwear "
"https://s.click.aliexpress.com/e/_c3wUIpaf","https://raw.githubusercontent.com/avivaknin/PinterestImages/main/pinterst1/One-Pieces/7/pose_over_the_shoulder_bg-forest.png","One-Pieces7 pose_over_the_shoulder_bg-forest.png","","Swimwear "
"https://s.click.aliexpress.com/e/_c3wUIpaf","https://raw.githubusercontent.com/avivaknin/PinterestImages/main/pinterst1/One-Pieces/7/pose_quick_spin_bg-forest.png","One-Pieces7 pose_quick_spin_bg-forest.png","","Swimwear "
"https://s.click.aliexpress.com/e/_c32Funtl","https://ae-pic-a1.aliexpress-media.com/kf/S56c974f4224f42c5b953a364691d4ffeD.jpg_480x480q75.jpg_.avif","One-Shoulder Cutout Apex | The Tonal Industrial Anchor","A study in negative-space architecture, featuring statuesque cut-out geometry and a high-authority one-shoulder anchor. It radiates an aura of mission-ready power and unyielding high-fashion authority. #CutoutSwim #IndustrialAnchor #TonalStyle #ad","Swimwear "
