Affiliate URL,Image URL,Name,Description,Category
"https://s.click.aliexpress.com/e/_c3kYPGkX","https://ae-pic-a1.aliexpress-media.com/kf/S6f58f00ff74848ca8abc59b55404e44bm.jpg_480x480q75.jpg_.avif","Basic Tank Pillar | The Minimalist Linear Shield","A study in functional minimalism, featuring a statuesque vertical profile and high-integrity fibers. This tank provides a continuous horizontal balance and an aura of modernistic serenity, radiating uncompromised professional-grade polish.  #TankTop #LinearShield #MinimalistLuxe #ad","Tank Tops & Camis"
"https://s.click.aliexpress.com/e/_c4e326PN","https://ae-pic-a1.aliexpress-media.com/kf/S7205dd38a64c4ed6b8454a7de14e4fbcP.jpg_220x220q75.jpg_.avif","Black-Breathable Tee | The Aerodynamic Foundation","A high-performance technical tee in a commanding deep black. The advanced breathable fabric offers a statuesque and streamlined silhouette, radiating a look of professional-grade athletic power and unyielding urban polish. #BlackTee #PerformanceLuxe #UrbanActive #ad","Tank Tops & Camis"
"https://s.click.aliexpress.com/e/_c4ncbgIF","https://ae-pic-a1.aliexpress-media.com/kf/Sc47f31376d884916bbae11c73336d830D.jpg_220x220q75.jpg_.avif","Black-Cutout Tank | Architectural Stealth Geometry","Defined by its daring negative space and invisible strap engineering. This tank offers a statuesque and futuristic profile, radiating an aura of urban authority and avant-garde boutique edge. A powerful statement for the modern metropolitan specialist. #CutoutTank #ModernistStyle #BlackLuxe #ad","Tank Tops & Camis"
"https://s.click.aliexpress.com/e/_c2uoGuvt","https://ae-pic-a1.aliexpress-media.com/kf/S83eac56f0efb4daab92a05bfcfa1483e7.png_220x220.png_.avif","Black-Ruched Halter | Obsidian Kinetic Texture","Featuring high-definition ruching that adds multi-dimensional depth to the classic halter silhouette. This tank provides a statuesque and form-flattering presence, radiating a look of professional-grade polish and unyielding evening grace. #RuchedHalter #ObsidianStyle #TexturalLuxe #ad","Tank Tops & Camis"
"https://s.click.aliexpress.com/e/_c3DX9EBV","https://ae-pic-a1.aliexpress-media.com/kf/S87e05bb9d28b48e887d8f115e3ca3047Y.jpg_220x220q75.jpg_.avif","Blue-Halter Tankini | Azure Aquatic Verticality","(Note: Swim/Tank hybrid). Bridging the gap between a performance tank and elite swimwear. This halter-neck piece offers a statuesque and elongated profile in a commanding azure blue, radiating an aura of high-end resort elegance and uncompromised serenity. #HalterTankini #AzureStyle #ResortLuxe #ad","Tank Tops & Camis"
"https://s.click.aliexpress.com/e/_c3oSH5JD","https://ae-pic-a1.aliexpress-media.com/kf/S124799f5a2214e478a96e1cf0cf52dffX.jpg_480x480q75.jpg_.avif","Bra-Free Lace Cami | The Ethereal Support Column","Merging the provocative allure of sheer lace with integrated structural support. This camisole offers a statuesque and unstudied silhouette, providing a look of sophisticated intimacy and high-end boutique charm without the need for additional layers. #LaceCami #QuietLuxury #BoutiqueElegance #ad","Tank Tops & Camis"
"https://s.click.aliexpress.com/e/_c4TsvTcF","https://ae-pic-a1.aliexpress-media.com/kf/S0773de6b1e27481aa4ccf30d8d92b807c.jpg_480x480q75.jpg_.avif","Bustier Corset Monolith | The Sovereign Structural Vault","Engineered with a high-authority corset framework and statuesque lace detailing to ensure an uncompromised structural silhouette. This top radiates an aura of elite-level power and unyielding heritage-grade luxury.  #CorsetTop #BustierMonolith #StructuralVault #ad","Tank Tops & Camis"
"https://s.click.aliexpress.com/e/_c3LANeyf","https://ae-pic-a1.aliexpress-media.com/kf/S7955f9aeafbd4fee999a6f0f8e8cc2fep.jpg_220x220q75.jpg_.avif","Button-Front Tank | The Tailored Minimalist Vest","Featuring a high-fidelity button anchor and a structured knit profile. This tank top offers a statuesque and professional-grade aesthetic, radiating a look of intellectual authority and unyielding urban sophistication. #ButtonTank #TailoredLeisure #MinimalistLuxe #ad","Tank Tops & Camis"
"https://s.click.aliexpress.com/e/_c36rQeT5","https://ae-pic-a1.aliexpress-media.com/kf/S5855a10f83864e90abd812d8dce401390.jpg_480x480q75.jpg_.avif","Chic Peplum Sleeveless Top | Feminine Summer Blouse","Add a touch of elegance to your summer outfit with this chic peplum sleeveless top. The flared waist creates a flattering shape that's perfect for both office and casual wear. #PeplumTop #SleevelessBlouse #FeminineFashion #SummerStyle #ad","Tank Tops & Camis"
"https://s.click.aliexpress.com/e/_c35YEaWL","https://ae-pic-a1.aliexpress-media.com/kf/S70b79280a1034d329a60db09b6116f475.jpg_480x480q75.jpg_.avif","Chocolate Brown Square Neck Tank Top","Stay on trend with this rich chocolate brown tank top. Featuring a modern square neckline and a soft, stretchy fit, it’s the perfect neutral piece for any season. #SquareNeck #BrownTankTop #MinimalistFashion #NeutralAesthetic #ad","Tank Tops & Camis"
"https://s.click.aliexpress.com/e/_c3GLwg79","https://raw.githubusercontent.com/avivaknin/PinterestImages/main/pinterest2/Tank%20Tops%20%26%20Camis/3/S87e05bb9d28b48e887d8f115e3ca3047Y.png","Crystal Mesh Pumps | Elite Party Heels","Shine throughout the night with these breathtaking crystal mesh pumps designed for elite social gala events and prestigious wedding celebrations. The shimmering finish and sophisticated pointed toe offer a regal appearance for every grand ballroom gathering tonight in the city. Crafted from premium materials to ensure a secure fit and a luxurious feel during your most special social celebrations today. This designer piece is a perfect blend of modern fashion and classic elegance for the stylish woman. Enjoy a majestic presence that reflects your sophisticated taste in high end fashion and style for your most special night. #crystalpumps #partyheels #weddingstyle #luxuryfashion #glamour #formalwear #fashion #elegant #ad","Tank Tops & Camis"
"https://s.click.aliexpress.com/e/_c4rKTZhd","https://raw.githubusercontent.com/avivaknin/PinterestImages/main/pinterst1/Tank%20Tops%20%26%20Camis/3/pose_3_4_view_bg-rooftop.png","Dynamic Motion Urban Cami ǀ Majestic Artistic Movement and Refined Luxury Glow","Experience the fluid beauty of this premium cami, captured in a dynamic motion pose that emphasizes its modern lines and luxury finish. The high-quality fabric responds beautifully to movement, creating a sense of effortless grace and modern professional energy. #MotionCami #UrbanLuxe #ad","Tank Tops & Camis"
"https://s.click.aliexpress.com/e/_c4rKTZhd","https://raw.githubusercontent.com/avivaknin/PinterestImages/main/pinterst1/Tank%20Tops%20%26%20Camis/3/pose_hands_in_pockets_bg-crystal-palace.png","Effortlessly Chic White Spaghetti Strap Tank Top & High-Waisted Pants for Summer Style","Tank Tops & Camis Discover timeless summer style with this crisp white spaghetti strap tank top and matching high-waisted, button-front pants. This versatile and comfortable outfit is perfect for creating a clean, fresh look for any casual occasion. Elevate your everyday wardrobe with this elegant all-white ensemble. #SummerFashion #WhiteOutfit #CasualStyle #TankTopStyle #HighWaistedPants #WomensFashion #affiliatelink","Tank Tops & Camis"
"https://s.click.aliexpress.com/e/_c3jcI1UF","https://raw.githubusercontent.com/avivaknin/PinterestImages/main/pinterest2/Tank%20Tops%20%26%20Camis/4/Sf72e5b6757964d2b99a988ca319b0beeL.png","Effortlessly Stylish White Peplum Top and Tan A-line Mini Skirt Look","Tank Tops & Camis Elevate your everyday style with this chic and modern ensemble featuring a crisp white sleeveless peplum top and a flattering tan A-line mini skirt. Perfect for a polished casual look, date night, or sophisticated daytime wear. This versatile outfit combines elegance with comfort, making it a must-have for your wardrobe. #SummerStyle #PeplumTop #MiniSkirtFashion #ChicOutfit #EverydayElegance #FashionInspiration #affiliatelink","Tank Tops & Camis"
"https://s.click.aliexpress.com/e/_c2wdIclp","https://ae-pic-a1.aliexpress-media.com/kf/S962c69a69fb54ab8816c1356f11dc9dbn.jpg_480x480q75.jpg_.avif","Emerald-Satin Cami | Luminous Jewel-Tone Fluidity","Saturated in a commanding emerald green, this satin camisole offers a liquid-like sheen and a statuesque drape. It radiates an aura of high-society glamour and unyielding evening grace, serving as a powerful centerpiece for any luxury curation. #EmeraldSatin #CamiStyle #JewelToneLuxe #ad","Tank Tops & Camis"
"https://s.click.aliexpress.com/e/_c4rKTZhd","https://raw.githubusercontent.com/avivaknin/PinterestImages/main/pinterst1/Tank%20Tops%20%26%20Camis/3/pose_dynamic_dance_bg-graffiti-wall.png","Ethereal Studio Profile Tank ǀ Majestic 3/4 View and Atmospheric Modern Polish","Step into the spotlight with this ethereal studio tank, showcased in a majestic profile view that highlights its sharp modern cut and luxury textiles. The atmospheric lighting emphasizes the premium designer craftsmanship, providing a polished silhouette that radiates confidence. #StudioProfile #EtherealStyle #ad","Tank Tops & Camis"
"https://s.click.aliexpress.com/e/_c4rKTZhd","https://raw.githubusercontent.com/avivaknin/PinterestImages/main/pinterst1/Tank%20Tops%20%26%20Camis/3/pose_fast_walk_motion_blur_bg-moroccan-riad.png","Executive Power Statement Cami ǀ Bold Power Stance and Refined Contemporary Polish","Command attention in this executive power statement cami, featuring a bold power stance that radiates pure authority and refined contemporary style. The rich textures and modern silhouette create a profile that is both visually striking and undeniably confident for a leader. #PowerCami #ExecutiveStyle #ad","Tank Tops & Camis"
"https://s.click.aliexpress.com/e/_c4W6XlTp","https://ae-pic-a1.aliexpress-media.com/kf/S8c064a4faeeb4b1b80fc8bfeacf889e15.jpg_480x480q75.jpg_.avif","Halter Keyhole Top | The Obsidian Geometric Apex","Precision-engineered with a sharp keyhole architecture and a statuesque halter-neck anchor. This top radiates an aura of unapologetic power and unyielding professional-grade competence, serving as a definitive structural anchor for the modern curator.  #HalterTop #ObsidianApex #GeometricArchitecture #ad","Tank Tops & Camis"
"https://s.click.aliexpress.com/e/_c3Tkd4Zh","https://ae-pic-a1.aliexpress-media.com/kf/Sc72ad214768349fbbf14f856c036e3afv.jpg_480x480q75.jpg_.avif","Halter-Neck Top | The Statuesque Minimalist Column","A clean, high-neck design that highlights the shoulders to create an elongated, statuesque profile. This top radiates an aura of fashion-forward confidence and professional-grade minimalist authority for the modern specialist. #HalterTop #MinimalistElegance #StatuesqueStyle #ad","Tank Tops & Camis"
"https://s.click.aliexpress.com/e/_c3sjeeS3","https://ae-pic-a1.aliexpress-media.com/kf/S9b7f80823a9c405ba91fdcf339b6cf38d.jpg_220x220q75.jpg_.avif","Halter-Tank Top | Linear Performance Geometry","Merging sharp geometric lines with high-retention performance fabric. This halter tank offers a sculpted and powerful profile, radiating an aura of high-energy boutique fitness and uncompromised urban style. #HalterTank #ModernActive #HighEnergyStyle #ad","Tank Tops & Camis"
"https://s.click.aliexpress.com/e/_c3FE1Wlh","https://ae-pic-a1.aliexpress-media.com/kf/S5d63981e2b2249a78472b00e9a0da4dby.jpg_480x480q75.jpg_.avif","Hanging Neck Monolith | The Radiant Botanical Vault","Precision-engineered with high-velocity Hanging Neck geometry and statuesque lace-anchor architecture. This vest radiates an aura of artisanal boutique energy and unyielding professional-grade power, serving as a definitive structural anchor for the summer silhouette. #LaceVest #BotanicalVault #RadiantArchitecture #ad","Tank Tops & Camis"
"https://s.click.aliexpress.com/e/_c3kZFhYx","https://ae-pic-a1.aliexpress-media.com/kf/S40a008a0320e484c95405ed701fd0c94W.jpg_220x220q75.jpg_.avif","Lace-Button Tank | Intricate Ornamental Geometry","Combining the structural integrity of a button-front with the delicate texture of high-definition lace. This tank provides a statuesque and multi-dimensional silhouette, radiating a look of unstudied elegance and high-end boutique energy. #LaceTank #BoutiqueStyle #OrnamentalFashion #ad","Tank Tops & Camis"
"https://s.click.aliexpress.com/e/_c3TZBrEX","https://ae-pic-a1.aliexpress-media.com/kf/Sbc406a65dc794c7280bf0f25348c748cC.jpg_220x220q75.jpg_.avif","Mint-Basic Tank | Jade-Tone Minimalist Foundation","A masterclass in unstudied elegance. This tank top features a high-density, soft-touch fabric in a refreshing mint jade. It provides a statuesque and clean-lined silhouette, serving as the definitive foundation for an elite, high-energy casual curation. #MintTank #MinimalistLuxe #DailyEssentials #ad","Tank Tops & Camis"
"https://s.click.aliexpress.com/e/_c2JXZOT9","https://ae-pic-a1.aliexpress-media.com/kf/S2438ae25e8e04012b0402428d8b0ada1b.png_220x220.png_.avif","Oversized-Button Blouse | Voluminous Executive Fluidity","(Note: Blouse/Tank hybrid). A study in relaxed, statuesque proportions. This oversized piece offers a liquid-like drape and a presence-filled silhouette, radiating an aura of Quiet Luxury and unyielding professional polish for the modern global curator. #OversizedBlouse #ExecutiveStyle #QuietLuxury #ad","Tank Tops & Camis"
"https://s.click.aliexpress.com/e/_c37NZQnV","https://ae-pic-a1.aliexpress-media.com/kf/S597f9ce5d5e046a9a352616a9ae25880D.jpg_480x480q75.jpg_.avif","Pink Halter Apex | The Chromatic Kinetic Vault","Integrating statuesque cut-out geometry with high-authority bow-anchor architecture. This top radiates an aura of artisanal boutique energy and unyielding high-fashion authority, providing a continuous line of radiant intent. #HalterTop #KineticVault #ChromaticArchitecture #ad","Tank Tops & Camis"
"https://s.click.aliexpress.com/e/_c2uqfcaf","https://raw.githubusercontent.com/avivaknin/PinterestImages/main/pinterst1/Tank%20Tops%20%26%20Camis/2/pose_3_4_view_bg-sunset-cliffs.png","Premier Artisan Technical Tank ǀ Sophisticated Precision Craft and Elite Technical Detail","Elevate your everyday style with this premier artisan technical tank, featuring sophisticated precision craft and elite technical detailing that commands respect. The innovative design ensures a durable and high-fashion aesthetic, providing a polished profile that reflects a deep passion for excellence. #ArtisanTank #EliteDetail #ad","Tank Tops & Camis"
"https://s.click.aliexpress.com/e/_c2uqfcaf","https://raw.githubusercontent.com/avivaknin/PinterestImages/main/pinterst1/Tank%20Tops%20%26%20Camis/2/pose_hands_in_pockets_bg-sunbeam-forest.png","Radiant Modern Executive Cami ǀ Vibrant Contemporary Weave and Lustrous Luxury Glow","Showcase a breathtaking professional look with this radiant modern executive cami, designed with a vibrant contemporary weave that captures the essence of majesty. The high-quality materials ensure a polished look that is both visually striking and incredibly comfortable for a confident profile. #ExecutiveCami #RadiantGlow #ad","Tank Tops & Camis"
"https://s.click.aliexpress.com/e/_c2uqfcaf","https://raw.githubusercontent.com/avivaknin/PinterestImages/main/pinterest2/Tank%20Tops%20%26%20Camis/2/Sa95442c889034290bd813ba28890b7d2d.png","Radiant Prestige Statement Tank ǀ Vibrant Luxury Aesthetic and Lustrous Couture Finish","Make a breathtaking impression with this radiant prestige statement tank, designed with a vibrant aesthetic that captures the essence of modern majesty. The lustrous couture finish and high-quality materials ensure a polished look that is both visually striking and incredibly durable. #PrestigeTank #RadiantStyle #ad","Tank Tops & Camis"
"https://s.click.aliexpress.com/e/_c4cZHaCB","https://ae-pic-a1.aliexpress-media.com/kf/S33a0fa3d978540b99fc45e775607cf44D.jpg_480x480q75.jpg_.avif","Red-Halter Romper | Crimson Kinetic Unit","(Note: Romper/Tank hybrid). A high-octane one-piece in a vibrant crimson hue. The halter-neck construction provides a statuesque and elongated profile, radiating a look of unapologetic confidence and professional-grade athletic allure. #RedRomper #HalterStyle #CrimsonPower #ad","Tank Tops & Camis"
"https://s.click.aliexpress.com/e/_c3gGXiQ3","https://ae-pic-a1.aliexpress-media.com/kf/S37b776b155094cd1840b4cf0ef7d0b7bb.jpg_220x220q75.jpg_.avif","Ruched-Halter Bikini | Sculpted Azure Anchor","(Note: Swim/Tank hybrid). Featuring precision ruching and a secure halter anchor. This top offers a statuesque and presence-filled silhouette, radiating a look of high-fashion coastal luxury and unyielding structural support. #BikiniTop #RuchedStyle #CoastalLuxe #ad","Tank Tops & Camis"
"https://s.click.aliexpress.com/e/_c3cMQh99","https://ae-pic-a1.aliexpress-media.com/kf/Se467f74c7ed04260a0de85fb3c704f39x.jpg_480x480q75.jpg_.avif","Satin Lace Cami | The Radiant Architectural Veil","Combining light-refracting satin with high-fidelity lace geometry to create multi-dimensional material depth. This cami offers a radiant presence and an aura of Quiet Luxury, radiating unyielding high-fashion authority and sovereign grace.  #SatinCami #LaceArchitecture #RadiantVeil #ad","Tank Tops & Camis"
"https://s.click.aliexpress.com/e/_c302ZQNp","https://ae-pic-a1.aliexpress-media.com/kf/S8b674959830c4ea8af58df6f32442b045.jpg_480x480q75.jpg_.avif","Satin Lace Monolith | The Radiant Structural Vault","Precision-engineered with high-fidelity satin geometry and statuesque lace architecture. This blouse radiates an aura of Quiet Luxury and unyielding professional-grade power, serving as a definitive structural anchor. #SatinBlouse #StructuralVault #RadiantArchitecture #ad","Tank Tops & Camis"
"https://s.click.aliexpress.com/e/_c4UIJhaR","https://ae-pic-a1.aliexpress-media.com/kf/S668eb55618304dee9290e6d15d91f6ac7.jpg_220x220q75.jpg_.avif","Satin-Strappy Cami | Liquid Silk Column","A luxurious satin camisole featuring ultra-fine straps that create a delicate, statuesque silhouette. The high-lustre fabric offers a liquid-like drape over the body, radiating an aura of Quiet Luxury and unyielding evening elegance. #SatinCami #LiquidSilk #QuietLuxury #ad","Tank Tops & Camis"
"https://s.click.aliexpress.com/e/_c3qQjeHh","https://ae-pic-a1.aliexpress-media.com/kf/S8a141e86f9ac4bcc8bde72f4426bd80eL.jpg_480x480q75.jpg_.avif","Scoop Bodysuit Pillar | The Linear Geometric Anchor","Defined by extreme statuesque verticality and high-integrity seamless geometry. This bodysuit radiates an aura of modernistic serenity and unyielding professional-grade polish, framing the silhouette with surgical precision. #Bodysuit #GeometricAnchor #LinearStyle #ad","Tank Tops & Camis"
"https://s.click.aliexpress.com/e/_c4tyCimL","https://ae-pic-a1.aliexpress-media.com/kf/Sc575301d84734275be529c2fe545bb38e.jpg_480x480q75.jpg_.avif","Sheer-Floral Cami | Ethereal Botanical Veil","Combining a weightless, sheer fabric with high-fidelity floral motifs. This camisole offers a multi-layered, presence-filled aesthetic, radiating an aura of modern romanticism and unstudied botanical grace for a curated boutique look. #FloralCami #SheerLuxe #BotanicalArt #ad","Tank Tops & Camis"
"https://s.click.aliexpress.com/e/_c3jcI1UF","https://raw.githubusercontent.com/avivaknin/PinterestImages/main/pinterest2/Tank%20Tops%20%26%20Camis/4/Sf63f52a10032498a9c2f68e611aeb7d3X.png","Sophisticated Minimalist Elite Cami ǀ Sharp Contemporary Lines and Meticulous Designer Polish","Discover the beauty of simplicity with this sophisticated minimalist cami, characterized by its sharp contemporary lines and meticulous designer polish. The high-quality construction offers a professional yet fashionable look that is perfect for maintaining a sharp profile in any setting. #MinimalistCami #ModernLuxe #ad","Tank Tops & Camis"
"https://s.click.aliexpress.com/e/_c2uqfcaf","https://raw.githubusercontent.com/avivaknin/PinterestImages/main/pinterst1/Tank%20Tops%20%26%20Camis/2/pose_sitting_floor_looking_up_bg-spaceship-deck.png","Sophisticated Noir Essential Tank ǀ Sharp Contemporary Lines and Elite Designer Polish","Discover the beauty of urban sophistication with this noir essential tank, characterized by its sharp contemporary lines and meticulous designer polish. The high-quality construction and refined textile choice offer a professional look that is perfect for any metropolitan environment. #NoirTank #ModernLuxe #ad","Tank Tops & Camis"
"https://s.click.aliexpress.com/e/_c42PujmB","https://ae-pic-a1.aliexpress-media.com/kf/Sb1bff86b173a4fb3979023cad48c05b6D.jpg_220x220q75.jpg_.avif","Spiked-Leather Corset | Industrial Avant-Garde Armor","A high-integrity leather corset featuring precision spike detailing. This piece provides a rigid, statuesque body-sculpt, radiating an aura of unapologetic power, visual authority, and bold avant-garde sophistication. #PunkCorset #LeatherLuxe #AvantGardeStyle #ad","Tank Tops & Camis"
"https://s.click.aliexpress.com/e/_c3qeYPwR","https://ae-pic-a1.aliexpress-media.com/kf/S511e17640ed14b1a99372849ba8fcf34Z.jpg_480x480q75.jpg_.avif","Striped-Knit Vest | Rhythmic Linear Architecture","Utilizing high-contrast vertical stripes to create an extreme statuesque verticality. This knit vest offers a multi-textural profile and a look of unstudied boutique charm, perfect for layering within a high-stakes editorial wardrobe. #KnitVest #StripedStyle #ModernistFashion #ad","Tank Tops & Camis"
"https://s.click.aliexpress.com/e/_c2zFMYXV","https://ae-pic-a1.aliexpress-media.com/kf/H56cca0b457e441c4aac382bbd56a262al.jpg_220x220q75.jpg_.avif","Thermal Heated Apex | The Kinetic Industrial Shield","Featuring high-velocity heat-core geometry and a statuesque insulated framework for extreme thermal integrity. This vest radiates an aura of mission-ready power and unyielding high-tech authority. #HeatedVest #IndustrialShield #KineticArchitecture #ad","Tank Tops & Camis"
"https://s.click.aliexpress.com/e/_c2vq0iVZ","https://ae-pic-a1.aliexpress-media.com/kf/S33024ddc628345fbbebbecdf792b1f13A.jpg_480x480q75.jpg_.avif","Washed-Blue Cami | Azure Textural Minimalism","Featuring a sophisticated washed-blue tone that adds textural depth to the minimalist cami silhouette. The premium fabric provides a statuesque and relaxed profile, radiating a look of everyday luxury and high-end resort-ready grace. #BlueCami #WashedDenimStyle #MinimalistLuxe #ad","Tank Tops & Camis"
"https://s.click.aliexpress.com/e/_c4e6ndJt","https://ae-pic-a1.aliexpress-media.com/kf/Sbda6961643774f3c98c1a6bee3cf145cH.jpg_480x480q75.jpg_.avif","White Cami Monolith | The Tonal Structural Shield","A study in minimalist architecture, featuring statuesque white-fiber geometry and a high-velocity fitted framework. It radiates an aura of elite-level power and unyielding heritage-grade luxury. #WhiteCami #StructuralShield #TonalStyle #ad","Tank Tops & Camis"
"https://s.click.aliexpress.com/e/_c4obYbL1","https://ae-pic-a1.aliexpress-media.com/kf/S44ff78d6ab2f42b2b9f5a71fbb1d16cb8.jpg_480x480q75.jpg_.avif","White-Ribbed Crop | Linear Core Foundation","Defined by its vertical ribbed texture that enhances the statuesque height of the silhouette. In a pristine white palette, this crop top offers a sharp, sculpted look that radiates high-energy urban authority and polished active style. #RibbedCrop #WhiteLuxe #ModernistActive #ad","Tank Tops & Camis"
"https://s.click.aliexpress.com/e/_c3oBajQJ","https://ae-pic-a1.aliexpress-media.com/kf/S30da65ce04644c72a6521c058e779712i.jpg_480x480q75.jpg_.avif","White-Ribbed Henley | Architectural Casual Column","Combining a classic button-front Henley closure with a structured ribbed knit. This top provides a statuesque and elongated profile, radiating an aura of unstudied elegance and professional-grade minimalist precision. #HenleyTop #RibbedKnit #CasualAuthority #ad","Tank Tops & Camis"